All democrats love this treatment of our elderly when I say all democrats I mean politicians and voters they hate and try to put fear in the vulnerable elderly and you think it’s a tough decision in November, not me, it is Trump,
Playing in to trumps hands guys.  I get it protestors.  I do. but this is not good.  On any account.  And if it begins to help trump ...ugh.  Makes me sick
JOE BIDEN WILL NOT DEFUND THE POLICE.  DONALD TRUMP IS JUST LYING TO YOU AGAIN.
Nothing here done by trump
How did she stay on the NSC?  Is trump really that stupid?
Oh I agree about facts completely. Please take a screenshot of my tweet where I claimed that Trump went to a specific location?   said he wasn't on the plane. The facts show that he was.
Oh Lord, and this is what I get for telling them Trump was on Epstein's plane
Really? How so? Trump was also on the flight logs.  Still curious which email it was, specifically, that you found suspicious.
stop the 🐎 💩, stop wasting your time, $ &amp; embarrassing yourself/family.  Life’s hard, especially when we age.  Get diagnosed, treated enjoy your years left. You have ZERO chance. If U believe you do, I challenge you to a Trump debate.  Bet U do not have the balls.
Yes.   That how we managed to get Trump in the first place.  People were upset over Bernie sanders not getting the nomination.
Perhaps you're not informed about contact tracing but when someone tests positive they have to provide a history of where they have been and who they have been around. This is how we know that Trump rallies increased cases and protests didn't.
Waiting for 28x3-67.  Number of my favorite things! #flagsout #silentmajority #patriots #wwg1 #wga #youarethenews #funwithnumbers #trump #potus
I always try to vote true to my voice and often that is 3rd party. I think voting "against" someone is dangerous and it's how we ended up with President Trump. If more people would read the platforms and vote their real voice, voters would get power back from the party system.
RASHIDA’S REVOLT: Tlaib Says Authorities ‘Will Have to Arrest Her’ If Trump Sends Feds to Detroit | Sean Hannity ⁦ ⁦ ⁦ ⁦ ⁦ ⁦
This just in...  President Donald Trump Tweetstorm – The Saturday Edition
Unless they vote for Trump
Did I ever say to listen to Trump? No. Never once said that or even eluded to it
Have u discussed with these cadets the potential consequences of becoming victims to Putin’s bounties and how you, Trump and the rest of the GOP are just going to ignore it?
people are on facebook calling Obama a sex trafficker and Trump the savior of this nation... i— 😳
Judge calls out Trump, Barr DOJ for punishing Cohen over new book  via  It's about time someone stood up for what's right and TRump and Barr's criminal behavior. "Work for the people" not self
No way!!!!! I would believe that Trump and Russia created it!!!!
With due respect, we expect the Republicans and many Democrats to oppose to stupid things like this.  We all hope that democrats will stand against Biden if he did crazy stuff like this.  We had hoped GOP did that for Trump but we were abandoned....
Day 1283 of the Trump Administration.  101 days remain until the Presidential election.  #HopeOverFear #ScienceOverFiction #TruthOverLies #UnityOverDivision #NoSafeHarborForHate
trump better not be sending federal officers into these hellholes with the same bullsh!t rules of engagement that hamper our military. if he can't do that, just get them OUT!
State attorney says she'll prosecute federal agents who commit crimes in Baltimore
The ones trolling Trump and
FBI Perversely Used Counter-intel Briefing with Trump Campaign to Gain Info on Them  #Qanon #WeAreTheNewsNow #FactsMatter #WWG1WGA #WakeUpAmerica #UnitedNotDivided #SaveAmerica #GreatAwakening
We love you Predident Donald J Trump!!! Trump 2020 Landslide!!! 🇱🇷
I swear if Trump didn’t exist people would have no idea what to blame things on. No one else is responsible for anything that happens in this world besides Donald Trump.  I don’t need people on the ground to see the massive infection rate. Trump or no Trump its common senseAnd how many cities, has barr surged federal officers into under operation legend? How many of those police forces have joined up with them? How many of those white dudes are buying the propaganda they're now the poor victims, trump will stand up for em?
Do you really think the FBI spent over two years on a counterintelligence investigation into Trump, watching their leadership team and colleagues dragged through the mud, slandered, fired, deprived of their retirement benefits, and came up empty handed? No. They bagged his ass.
Contrary to Trump and his lying administration, we knew about the probability of a pandemic:
We should spread the word that his orange makeup keeps  Trump from getting COVID-19.  The germs can’t get through. Then all the Republicans will start wearing heavy orange makeup.  😃
Love you Joe !! We can’t get you elected fast enough. Trump is actually killing us.
Praying for all of your imbalances, Sorry you don't recognize good from evil !!   Take it to God, He is the only one who can save you !    You're wastin your time w/the smear talk !! President Trump's good deeds are testifying for him ... Nothin but facts !
MUST FIND A WAY to get money for small businesses and schools. Teacher Unions and other leftists will do ANYTHING to DESTROY the economy, to destroy TRUMP. Congress won't.. I wonder if big businesses.. is willing to produce new skills and cobntract teachers for citizens &amp; daycare
Trump must be stopped! Period! To even mention the thought of postponing an election should get him booted out of office by his own party. #TrumpTraitor #GOPCowards #GOPComplicitTraitors
News every day...  - Trump is terrible - COVID cases are up - Deaths are up - Look what Trump tweeted - We’re all going to die  Repeat...
How come Trump is now saying it is safe for America’s kids to go back to school, but its not safe for Americans to vote ?
Ask schiff if he ever got those naked trump pics he was trying to buy
I AGREE AS LONG AS HE WOULD ARE SPORLTS BACK UP OVER THIS HOAX VIRUS TRUMP UNAMERICAN NOT LETTING ARE KIDS PLAY SPORLTS #ObamaWasBetterAtEverything
Federalist Society co-founder calls Trump's tweet about delaying election "fascistic" - Axios
Trump will win the election on 3 November 2020. Even if all the polls say they are losing, they will win. Relax,Trump. You will win a hundred percent. Because,you have been chosen.
Memo to Agent Orange: Your Wall, like your entire life, is based upon a lie. It uses money intended for others, isn’t built in the way you promised  and is already collapsing. MAGE: DUMP TRUMP 2020
Didn’t say he was a protester but there were protesters all around the rally.  No one knows where he contacted Covid19 but so many want to blame the Trump Rally
Trump is the Prevaricator in Chief!
I despise tRump but Hermain Cain made the choice to attend.
Trump wasn’t in California today but he felt the earth move. And he’s a scared puppy.
This is another ploy to shift blame away from GOP chaos-while trump is trying to justify martial law with his "storm troopers" sent to cities in a first wave. His WhiteNationalist followers won't be far behind. He intends keeping the Presidency no matter what happens in November.
WE SHALL WIN GOD BE OUR HELP...ANOTHER 4YRS FOR TRUMP
Pompeo belongs in prison, along with Barr and trump!
Trump is already IMPEACHED by the US House .....
WATCH: Trailer released for 'The Comey Rule,' starring Brendan Gleeson as Donald Trump  via
LIVE--
If Herman Cain was the result of Tulsa, Trump will be the result of Texas. We just have to wait 🙂
You note: Trump “suggests” delaying the election. Then you imply that he is engaging in sinister behavior by saying “It's not within the power of the president to delay the election” as if he was going to try or as if he didn’t know. Classic propaganda ploy.
Bunch of bull 💩cause Trump will pardon and Democrats know it, that's what thy're pushing for to attack Trump.
Watch Live: Trump to hold press conference
Deductive reasoning would support that the Trump rally and Trumps insistence at the time that masks were not needed caused his death! DING DING DING!
Arkansas governor Asa Hutchinson I think you’re stupid for letting this big dumb orange president pressure you to open up when this out of control and getting worse thank god you can’t run no more cause you’re ruining Arkansas just dumb trump  done ruined America!!!!!!
You would have to be living on another planet not to know that Lincoln was a republican but, he would not support the Trump party and that is what we have now. They against anyone that do not agree and worship their prez.
I will personally volunteer to go door to door and pick up ballots and deliver them to the address they are supposed to go to, should Trump get rid of the post office.  I am sure others will follow suit.
Funny you blame the media for the depiction of trump. Remember Trump goes around the media straight to the people via Twitter. He does such a good job making himself appear racist that no one has ever seen anything like it.
You know Trump's tweet on this one drove Democrats to a new DROP ZONE 🤣🤣🤣🤣🤣
has about as much 'integrity' as panty hose that have been through an industrial washing machine 1,000 times 🙄  Susan Collins insists she hasn’t “changed” after Lincoln Project ad labels her a “Trump stooge”
You guys heard he was at the Tulsa rally, right? And Tulsa is having a spike now directly related to that shindig.   I’m practically the girl in the plastic bubble right now, but if I die of covid I want my stone to say Killed by Trump.
And have committed to testing, contact tracing, and supportive isolation. trump's only pro-testing for himself &amp; those who come into contact with him.
Yes. Trump's term expires in January of 2021.
Once Trump gets Moammarred down like Gaddafi for refusing to leave office he can have funerals in multiple places at the same time.
You can be I excited about him, fine. We all are. But to act like he’s a senile bat on the same level as trump is absurd.
Trump killed Herman Cain by not requiring masks at his rally and removing social distancing signs.  Manslaughter? You cannot waive a crime!
Obama and Biden have done more for this country than your President could ever hope to do. Please take the blinders off and see trump for who and what he truly is, a Cole and corrupt man who doesn't care about anyone but himself.
Please  - take your own advice. Instead of focusing on every word or gesture by Trump, do your job and legislate. Taxpayers are not paying you a healthy salary to grandstand and complain.
LEFTISTS and never Trumpers  SEEMS WILLING TO DO anything TO STOP POTUS from being reelected.... This is also why if Trump save inner cities, they dems will need the fraudulent votes to overcome the walkaway Black and democrat votes.
Mork and Mindy Trump #AddAWordRuinATVShow
it's not that they went against it, it is unconstitutional to do what Trump suggested. There is not anything anybody can do to change the election date at this time.
They should be sub zero by now. Trump didn’t elect you governors, your constituents did.  You’d be smart to do the opposite of what Trump suggests/demands. Look at his f’ing track record.
Only reason why racist people still support Trump as president is because they don't want to accept the fact that one of their dumb ass kind is fuckin up the world
Joe is pathetic, and anyone who actually thinks he’d be a good president is reaching. Talk about desperate, picking joe is the slack of a desperate party, they still have no one who can beat trump
Capitol Hill Republicans, if you can still enable Trump, or if you still stay silent about his traitorous, deranged behavior, you are just as weakly contemptuous as he is.
Good luck on collecting it! I’m sure Trump will say F..k Off🤣🤣
"Conviction." Heh.   meant eviction, but whatever.  I still think early resignation for the purpose of getting a pardon from Pres. Pence is more likely than Trump refusing to leave the building. Plus, Melania will be outta there asap.
If Trump cancels the election in November then we must simply  VOTE👏 HIM 👏 OUT 👏
Nothing about Trump is normal.
How can you be a volunteer and get Trump 4 more years in office. I’m from Arkansas
I'm watching President Barack Obama memorialize Congressman Lewis and I am waiting on the rising.  We will beat trump.
I wonder if a black Biden supporter had been killed for supporting him by a black Trump supporter if the national media would have covered it? Oh you bet they would.  But make it the opposite and not a peep.  Media bias is sickening!
He listened to his doctors when he had cancer and survived. He listened to Trump when he got COVID-19 and died alone.
Herman Cain was a good man sacrificed on the alter of President Trump’s ego and ignorance.
God, and I thought Trump and Biden were the only 2 bad options
Trump trying to tell if he loses will not except the decision of the elections and will not leave the White House ,stealing the 2020 elections!!!!!!!
As oppose to trump, Pelosi, many of the people in the house and senate. Their goal nowadays is to #conquerandDivide
Trump distracted us from the dreadful economic numbers this morning.
NTTimes: “2020 Election Live Updates: Republicans Reject Trump’s Suggestion to Delay Election, Something He Cannot Do” Even ReThugLicans are over the #OrangeShitWeasel
"Cain was a fierce public critic of mandatory mask efforts. The day before his hospitalization, he had praise for Trump’s no-mask policy a Mt. Rushmore event, declaring in a now-deleted tweet that 'PEOPLE ARE FED UP!'”  /1
Trump says all schools should be completely re-opened... but the election??? Delayed ❤️✨😝
And u live where???  TX??Although Biden is actually beating Trump in every poll out there.  Even in FL. Even FOX NEWS polls have Trump trailing.  Trump is a failure and has not once tried to unite.  Only divide.
I wonder why today of all days Trump explores moving Election Day .... GDP Down 9.5%; US Economy at Its Worst: Live Market Updates - The New York Times
But NPR is right. It is technically possible that Congress could pass a law delaying the election, but it is extremely unlikely that Pelosi and the House Democratic majority would do that. NPR said nothing about what Trump is capable of or likely to do.
The current Asshat-In-Chief has 0 regard for anyone but himself.  Don’t think Trump will go to Cain’s funeral either.
specifically said that Congressional consent to delay the election is extremely unlikely, and I agree with that. *No one* is saying it is extremely unlikely that Trump would violate any law at any time for personal benefit, or that the GOP would lift a finger to stop him.
Hitler/putin/stalin/trump?
Keep that same energy when someone, who looks like you, dies in the streets by some fascist cop and a bunch of Trump enabling Republicans callously deflect to "black on black" as a partisan issue.
No, there’s no shit pile as big as Trump...except maybe McConnell.
Trump: “children must return to school, every day in the fall, it’s completely safe.”  Also Trump: “we must delay the vote, which happens only one day, until it’s safe.”   Also Trump:
If Trump and his posse think there’s anarchists/terrorists marching in the streets now, they ain’t seen nothing. Push the election date and thousands more hitting the streets.
But this extremely unlikely thing would require Pelosi and her House majority to appease Trump the way Republicans do. "Extremely unlikely" merely acknowledges that it is not technically impossible.
Donald Trump killed him.
American politican Mr. Herman Cain is dead from COVID-19 and it didn’t have to be this way. Mr. Trump, if you're invited to his services, don’t politicize Mr. Cain’s passing like you did John Lewis by not attending services.  America what have we come to?  #negligenthomicide
Fun fact: both Donald Trump (6/14/46) and Joe Biden (11/20/42) are older than former presidents George W. Bush (7/6/46) and Bill Clinton (8/19/46), who have been out of the oval office for almost 12 and 20 years, respectively.
Herman Cain attended the Trump rally in Tulsa. Subsequently was diagnosed with COVID-19 and now one month later he's dead.  I can only presume that the official cause of death would be hemeroids, absolutely anything but COVID-19.
I agree about Oregon..   But if you there is a way to fit the crime in Chicago, DEMOCRATS may simply go crazy. They cannot allow Republicans (TRUMP), MAKE CHICAGO into a safe city. And even worse if enterprise zones recreate the economy. EXCITING TIMES ARE COMING!
Why oh why can't my dad be on twitter so he can see Trump endorse Nancy Pelosi.  He might finally leave the Republican party over that.
To assert that Donald Trump is an utter flop by all measures and from all angles, seems somehow terribly redundant. Unfortunately, for this Oval Office clown, we have exhausted all our very best epithetical descriptions.
ICYMI: French Hill thinks Trump’s clemency toward Roger Stone is ok because something something Obama.
Cain's positive coronavirus test came less than two weeks after he attended President Trump's controversial June 20 campaign rally in Tulsa, where he tweeted a picture of himself without a mask.
FACTS. We can like the man and not his plan. Unfortunately we can’t do either with Trump.
What's the link between US Christianity, which loudly calls itself "pro-life" in so many instances (and this is why 50%+ white Christians elected Trump), and toxic anti-life lies during this pandemic: Masks make you sick; hydroxychloroquine cures the virus? /3
This is exactly what I expected him to do and I felt like this was why he did not respond to Covid. Trump is the deadly pestilence on this country.
Trump is the only embarrassment and Barr and probably Pence.  Waste of gravity
said a year ago Trump is going to do whatever’s possible to stay in office even beyond two terms. We see the beginning of that today.
The irony of American politics to me rn is that the Obama presidency was “too progressive” for conservative white america when Obama was really a right leaning centrist like practically every dem. Trump was their openly racist white knight in shining armor
Trump trying to steal the elections already!!!!!👀👀👀👀👀👀👀👀👀👀
Actually, it's not all on Donald Trump. That is abdicating the responsibility of federal, state, and local governments as well as the responsibility of the American people to do the right thing. The blame game is easy... being solution oriented is hard and requires actual work.
He put his faith in a conman, and died because of it. He was a victim of the Coronavirus, more than that he was a victim of trump! #thetrumpviruskilledcain
So a rich, republican, Trump supporter dies from COVID and the cure hydroxochloroquine couldn’t save him. This is sad. Not a gloat just a wake up call to people.
He put his faith in a conman, and died because of it. He was a victim of the Coronavirus, more than that he was a victim of trump! #thetrumpviruskilledcain
He put his faith in a conman, and died because of it. He was a victim of the Coronavirus, more than that he was a victim of trump! #thetrumpviruskilledcain
Gave his life for Trump.  What a guy.
Here it goes. We’ve talked about it. We knew it was coming. He’s even mentioned it a few times, but this starts 45s “official” 2020 campaign: delegitimize the 2020 Presidential election so he can keep power.
This Hotel CEO speaks BIG! America has many empty Hotel Rooms bc of COVID-19. The Federal Government won’t do what’s adequately required to stop the Virus bc WE need Rapid Testing, Contact Tracing, and Quarantining. The hotels &amp; Trump’s Storm Troopers will quarantine the infected
- trump held a rally in Tulsa, during a pandemic. - trump did not require his audience to socially distance. - trump did not require masks at his rally. - trump did not have a National Plan in place to quarantine and #StopTheSpreadOfCOVID19   #thetrumpviruskilledcain
.   His death is on trump's head. - Herman Cain at the June 20th Tulsa trump rally. - trump did not follow the examples of TRUE leaders. - trump did NOT protect the public. - trump shunned masks and encouraged others to as well.
So did they truly establish it was a voice over? I admit I can't imagine trump watching the hills have eyes.
Rip Herman Cain but watch trump is going to be all sympathetic over mr.cain but look at all the people around him contracting the trump virus and dying,so trump virus is still a hoax?
Trump floats November election delay -  but he can't do that
You are not the only one.   The election MUST be held on November 3.  If Trump dies of Covid 19 between now and then because he doesn’t wear a mask, Pence must run in his place.   There absolutely , positivity MUST be an election on November 3, 2020.
We can ony conclude that Trump Republicans are hopelessly stupid. If not equally suicidal.
Trump floats delaying election despite lack of authority to do so
lmfao y’all we not laughing but.. he contracted COVID at a Trump rally so we can at least chuckle at that part. Giggle.
In this scenario (which I consider to be a thought experiment), I think Chief Justice Roberts would swear in on Jan. 20 the president chosen by the Electoral College. But before that, I think Trump would resign in hopes of getting a pardon from President Pence.
Wow. Herman Cain died. Trump killed him.
He went to the Trump rally and did not wear a mask.  #Republicans have killed one of their own.   Science will win.
Yep, trump just vocalized delaying the election because mail in or absentee voting is bad
The failed leadership of   has decimated our economy &amp; led to the needless deaths of over 150K Americans. They don’t care if you get sick, lose your job, lose your home, lose a loved one, or lose your life. All Trump &amp; Pence Carr about is retaining power.
trump; this Country abide by the Constitution not by your twisted thoughts.
Mr. tRump this is not about you, but the people and what they want.  You need to get over yourself.  You have had 4 years to go against the American people and now comes the vote on how the American people feel about it.  Stop being a baby and take your medicine like a big boy.
Donald Trump is a threat to the planet!
I'm starting to think that one of the things Republicans hated most about Obama is that he was a constitutional scholar. It would explain their undying admiration for Trump, who swore to uphold something he only understands enough to despise it.
trump has finally vocalized delaying the election. Please read up on it, please
Trump trying to stoke fear into because he’s getting desperate and scared don’t believe he’s lies!!!!!!
Trump is just trying to play on your fears because he’s looking like he’s gonna lose in November,so he’s trying to stoke fears in you he’s getting desperate and scared watch when it close to the election in November he is gonna get more desperate and dangerous!!!!!!
Hell no your time has come to leave bye bye Trump
“According to the Presidential Succession Act of 1947, Trump would cease to be president on noon of Jan. 20 if Congress does not certify him as the winner, passing his authority as commander in chief of the military to the acting president, the speaker of the House of Rep...”
Trump is unchecked and unbalanced.
Trump is showing you he is about to steal the November elections?
As Trump demurs, an unimaginable question forms: Could the president reach for the military in a disputed election…
Anyone who supports Trump does not support the Constitution or care about their fellow Americans.
"Obama is expected to eulogize Lewis, while Clinton and Bush will participate in the service. Donald Trump, of course, did not travel from the White House to the Capitol to pay his respects as Lewis lay in state there."  /2
Trump suggests delaying 2020 election
Trump floats idea of delaying the November election, a power granted to Congress, as he ramps up attacks on voting…
Donald Trump suggests delay to 2020 US presidential election
"As the Boy Scouts of America face a nationwide reckoning over accusations that it failed to keep children safe from sexual abuse, at least 26 local Boy Scout councils named in current sex abuse lawsuits have received loans from the Trump administration’s taxpayer-supported" /1
Related: here’s a helpful article about what would happen if Trump refused to accept the results:
FROM THE “CAN YOU GUESS WHO BECOMES PRESIDENT UNDER CONSTITUTION IF ELECTION IS POSTPONED” DEPARTMENT?(Spoiler: it’s Pelosi...)
"Instead of focusing on the looming economic crisis, Trump upset members of both parties today when he announced that he would be withdrawing 12,000 troops from Germany."  What do you need me to do next for you, Mr. Putin? I'm at your service!
I’ve been told I’m crazy and conspiratorial for saying that Trump will not accept the results of the election if he loses.  And yet here we are with him warming up the engines by talking about delaying the election.  This sociopath is gonna do whatever it takes to stay in power.
What is QAnon? CNN's John Avlon explains
President Trump floats idea of delaying the election
In a tweet, President Trump raises the possibility of delaying the US election in November, as he continues effort to cast doubt on the established reliability of mail-in voting
Trump can’t read a teleprompter
Actually Trump said #NobodyLikesMe
Yep. The whole world colluded to get rid of Trump.
No. Trump had a stroke.
We elected Trump to stop that, because we didnt. we don’t need you to spend what we don’t have.
Sounds like how trump won with Russia
