Sure which one, there are many.. most were stapments made by Trump about Epstein and Maxwell. It's crazy..
He doesn’t tweet as much and his timeline is relatively boring (thank god). I think that’s why. But clearly he’s popular. He’s been getting more fundraising the last couple of months than Trump.
He only kicked him out after an Elected Official that was a member told him there was an open case and there were over 20 complaints about the age of some of Epstein's guest. Trump is quoted admiring Epstein for his many different young, beautiful women.
Chris Cuomo reacts to Trump comment 'nobody likes me'  via
tRump should not be talking to Putin AT ALL.
Why didn't trump make sure Cain got hydroxy from the witch doctor?
I wonder how trump is feeling about the deaths of Cain. Getting closer to him all the time.
I did not vote for Bush, but I respect him and never disliked him. So much different feelings  for trump!!!!!!!!!  VOTE BIDEN!💙
Trump cares about the Constitution?
Trump likes it when they hold the sausage
Trump campaign reaches $2 million in unpaid security bills just as Mike Pence rallies with cops -
trump is gonna hold the presidency hostage...just watch.
Obvious to the world:  “Mr Trump appears to be doing everything in his power to undermine the credibility of November's vote...”
Instead of Trump tweeting about #HermanCain he tweets about pizza... at least we know where his priorities are with black trump supporters. 🤧
Barbara Walters Exposed Trump's Massive Debt &amp; Admiration For Hitler's S...  via
Let this be yet another warning to those willing to listen to Trump. He will take you over the cliff to your death before he will admit he is wrong...how many will die for attending yesterdays MAGA party...? #MAGAIsACult Trump is killing more than Jim Jones.
Fareed Zakaria: Trump is a B.S. artist  via
Imagine dying at the altar of Donald Trump's stupidity.
Trump Campaign Laundering Millions to His Own Family  via
Like Trump will #Hydroxychloroquine
Fuck Donald Trump and his supporters 🖕🏼🖕🏼🖕🏼
Funny how the only voting fraud in the last election were people voting multiple times for Trump
Praise Trump /s
So, how long do you think it'll take till Trump blames this #earthquake on antifa?
And that same year I became a Reagan Democrat. For much of the reasons Trump cited.
2 of 5 stars to Too Much and Never Enough by Mary L. Trump
Bill Barr Caught Contradicting Himself on Issue of Trump's Criminal Comm...  via
Fuck 'em... Biden said he would be announcing next week I believe. Personally I hope it is Kamala. All the energy used talking smack about her is kinda nuts considering the goal is to get Trump out and get this country back on track. People need to get their priorities straight.
Fed up CNN host ENDS interview with top Trump official who can’t control...  via
Dave knows Donald Trump is not a conservative  via
I was wondering if you or anyone would be pay attention to the Postal service's funding, hours or the handling of mail, etc. since it's the way many are planning to vote.  trump can mess with anything federal. Right???
I'm sorry.. Trump's good friend was Jeffrey Epstein, and this not the Apprentice my friend
Democratic super PAC quotes Reagan in anti-Trump ad set to air on Fox News: 'Are you better off?'
Praise Trump
American institutions have begun to fail us. Trump's indifference to us all has saturated each part of this democracy. Everywhere we the people turn to for safety, help and leadership has been defiled by our own president.
Trump pulling U.S. Troops out of Germany. Says they're not paying their bills. So. Look who's talking, Mr. Bankruptcy himself.
Trump Moans 'Nobody Likes Me,' And Twitter Critics Quickly Remind Him Why  #SmartNews
Trump’s New COVID Doctor Says Sex With Demons Makes You Sick  via
Texas  Louie Gohmert blames the mask for causing his virus infection. I hope he means the fact that he didn't wear one &amp; should have. Remember when Orrin Hatch put on glasses that weren't. He Louie, try Dr. Trump's Super Disinfectant Injection or a bottle of those Hydroxychor..
PEOPLE OF KENTUCKY ASK YOURSELF!  Does Mitch McConnell deserve another term?  He is complicit in the dire situation we are in with the Virus by condoning the actions of Donald Trump &amp; refusing to go against him in his actions of sluffing off the virus as something that will pass.
The GOP under the "leadership ?" of McConnell has led us to the situation we are  in with the virus by condoning, supporting, &amp; rubberstamping everything Trump has done since he has been in office including sluffing off the virus as a cold. Please do something. NOW!
He already new...Putin likely told him and ...  Trump said Yes sir Daddy Putin.....you are so strong and powerful...and you love me right?  Putin said yes my neon bitch....you are my most powerful asset in the United States..  Trump... We are in love...he said I'm powerful😘😘
How about when President Trump verbally attacks Democrats all the time and childishly calls folks names?  It goes both ways.  I will never vote for Trump. I did not care for him prior to his running for President. Please stop looking the other way when Trump misbehaves.
Caught on Video: Naval Petty Officer Screams 'F*** Trump' at Pro-America Rally Attendees
Dan Rather retweeted a man, who posted a picture of Trump walking, with this sentence.  “Departing for North Carolina, President Trump says he will not be visiting Rep John Lewis who is laying in state at the US Capitol”  I’m ready for #VoteBlueToEndThisNightmare.
How could anyone who watched the Barr hearing.........still  vote for the party who sponsored that crap.    Trump picked up millions of more votes yesterday.
President Trump should buy up all the hydroxychloroquin..... and only let Republicans be able to buy it.
After watching Trump ignite panic in Alabama after Sharpiegate, Shirley ...  via
Fe fe fi fi fo fo fum He's spreadin' Covid lies in the auditorium Donald Trump, He's a grump He's a Ku Klux Klown who's goin' down He's gonna take a beatin'  From Biden out behind the gym why's everybody always pickin' on him?
Kay can't support Trump because he doesn't believe in science, and he do...  via
Yep, team I am proudly voting Trump 2020.
WATCH: ‘Real discrepancy’ in how Barr reacts to protests by Trump suppor...  via
Trump has started looting channeling  money to his children and their friends  through the account of his former campaign chairman. He knows he is going to lose &amp; will use the remaining time to suck every thing he can from the government into his pocket before he leaves.
Everyone would be all for it if Trump wasn’t the one who stated it might work! They’d rather kill our people then put an AFFORDABLE cure out.
Of course je is going to try and find a way to do whatever trump orders or wants.
What economic recovery? Why don't you deal with the #TrumpEconomy? Is it because he won't let you guys do anything? You all bow to him likes dogs obeying their masters. Funny how you and your colleagues roll over for the likes of Donald Trump. Trump is a disaster and you know it.
Trump to extend current DACA protections, reject new applications after Supreme Court knockdown  #SmartNews
Deranged Trump Says Its ILLEGAL For Negative News About Him To Trend On ...  via
Wonder how Trump is going to edit this?
Trump Spreads False Information About Coronavirus “Cure” | Morning Joe |...  via
Trump's NEW Political Foes: Moms, Dads, and Veterans  via
Trump's Worst Attacks on the Working Class | Robert Reich  via
How much went to Trump?
That Trump throwing out the first pitch for the Yankees on Aug 15 is in the news again.  Fact is, Trump can't throw the ball because he has a problem with his right arm &amp; too, is not able to coordinate taking that step one has to to throw a ball to the catcher. Just can't do it.
Everyone in America: *watching every documentary on Jeffrey Epstein* #Trump on Epstein’s accomplice: “I haven’t really been following it too much, I just wish her well, frankly.”  WHAT. Forget political ideologies, this is embarrassing.
Registered and still voting for Trump!
Trump Says Exec. Order Will Drop Price Of Insulin Down To Pennies A Day -
This is sickening. They might get away with what they are doing right now but this is abuse of power. Whoever these men are they are not there to help. They are making it worse. Barr &amp; Trump belong in jail. You have to be a sick MF to do this #TrumpGestapo #98DaysToGo #OustTrump
I love Barack but let’s get real you could poop something superior to Trump
We are well aware of the wall. There is 3 miles of NEW WALL WHERE THERE WAS NO WALL bdt. There is approximately 260 miles of FENCE THAT NEEDED TO BE REPLACED, but dt had "his impenetrable wall" replace the previous fence.  Like all things trump, it's incompetent of doing it's job
Trump is losing the battle against the coronavirus.
The NYT has reported that Trump was never invited to throw out the first pitch at the Yankees game. #TrumpleThinSkin #TrumpWasNotInvited #lyingTrump
So Umm...Is Trump Instituting Martial Law?  via
Trump's entire scheme to incite violence in Portland gets exposed | No L...  via
#TrumpleThinSkin #TrumpGriftsYouDie   Nothing to see here folks. Trump is just having another tantrum. 99 days until we finish him.... #VoteBlue2020 #VictimInChief   He's upset because #TrumpCantKeepItUp
It begins.  Biden’s handlers will never let him debate Pres. Trump.   HERE WE GO: Notre Dame Withdraws From Hosting Presidential Debate Due to Concerns Over COVID-19
Next you'll tell us Trump is the greatest Christian since Jesus
Trump is controlling the message
That one where tRump melts after Dorothy throws urine on him.
Well it was by invite only and he wasn't invited. Nobody wants Trump who has no conscience to dishonor a man known to all as the #ConscienceOfCongress who cared deeply about #America.. He'll try to grab the spotlight back..he is desperate..Not today Trump. Today is #JohnLewisDay
Did not accept the job 3 times. He refused to work for Trump but you know that. But thanks for bringing even more attention to #ProjectLincoln They are doing a helluva job.... Have a great day hun..... #VoteLikeYourLifeDependsOnIt
Christian TV Host Begs Trump To Kill Protestors  via
Punks Terrorize Pro-Trump Supporter, Vandalize His Property, Man Now Has an Epic Surprise Waiting: 'That’s the Goal'
Houston Police Chief to Trump: 'Keep Your Mouth Shut' | NowThis  via
Matthew (IN) voted for Trump in 2016, but Charlottesville showed him who...  via
Trump’s Troops Violate The First Amendment And Undermine Faith in Federa...  via
Lakes across America are having boat rallies for a trump.
Trump's wall is being blown apart. Cheesey construction. Mr. Negotiator probably didn't put anything in the contract about withstanding wind. Looks like a fart could have blown it over.
Trump will say it's fake news.
TRUMP Boat Rally Lake Hamilton July 26 2020  via
It's true. US Intel briefed UK. We aren't missing anything. Trump is running America as a dictator. That's why the secret police are dragging people away. He told us in his inauguration speech.. American carnage. Cruelty is the point!
Trump is a good Christian.
Just because they aren’t making millions, doesn’t mean that they aren’t brainwashing the masses and f trump supporters like you.
"Two gin-scented tears trickled down the sides of his nose. But it was all right, everything was all right, the struggle was finished. He had won the victory over himself. He loved Big Brother.” Fuck Trump, just I case I wasn't clear.
Don't trust polls. #VoteLikeYourLifeDependsOnIt Never forget the darkness we are living in. In the light of day it's a beautiful thing that Americans have come together to stand against tyranny. You deserve to live the American dream. #VoteBlue 🇺🇸
Is November coming so USA can finish up its election. By then rioting &amp; violence will stop. But will start something else when Trump wins. What will be that? Economic collapse? Be prepared America &amp; pray. Take authority over the devil in Jesus' name &amp; order it out of America.
People protesting are being disappeared by federal agents in Portland, so is Trump the communist right now? Or are you using communism like how the left uses nazi?
I am voting Trump 2020 who is with me?
He has more to lose on the frontend sitting face to face with Trump, proving he is a patsy for China.
Trump's Tribe
Reverend reveals what evangelicals say privately about Trump  via
10000000% voting for Trump.
Why Didn't Bob Mueller Find a Conspiracy Between the Trump Campaign and ...  via
Trump would be proud of him
Does Trump know this? Do his lemmings know this?
Trump thought twice about throwing out the first pitch at the Yankees game because that's his weak arm, remember when he had to use his left are to help his right to drink a glass of water? He probably couldn't throw the ball far enough. Hey, we know Donald. SAD
Thread by  EVERY TRUMP FOREIGN POLICY SCANDAL IN ONE TWEET. It is impossible to summarize any of Trump's complex foreign scanda280 characters—key pieces will always be missing—but Twitter urges us to try. So I hope you'll RETWEET this threa…
Mr Cuban, They did not vote for Donald Trump. They voted against Hillary Clinton, who was the worst candidate in Democratic history. She was universally disliked by even her own party.
#WeWantJoe Not a loser who couldn't even run a casino without going bankrupt. Truth is #Trump couldn't drive a golf cart without screwing it up much less an economy. Trump is morally bankrupt, demented and has corrupted as much as he could get away with in 3+ years #VoteBiden2020
Trump says he won't throw out the first pitch at Yankees game because of his strong focus on the Pandemic. This all after his grueling games of Golf with Brett Favre ( I can't believe it  Brett?) at Bedminster in New Jersey.
Apparently Nikki Haley is in love with Donald Trump &amp; ignores the damage he has done to America. Maybe she wants to marry him after Milania divorces him. Nikki, please read about the Pandemic &amp; how your boy Donald ignored it &amp; cost us ove4 140,000 lives, so far that is. SAD
#CoronaRonna your lane is full of dead Americans bodies. Joe Biden is not the disaster. The disaster is now. Trump is the President.
Pure Evil. You talking about Trump?
Trump stole #ReaganCampaignSlogan
#Trump even stole #RonaldReagan campaign slogan....
So surprised that some well to do people I know are tRump fans. But I really think they are just fans of the GOP and more $$$ than tRump.  Just won’t admit it to a Dem.
Trump Failed America: Don the Dumb  via
My hope is that the day will come when they are unable to get through a night without regret, his words on loop in their heads. He came with facts. Anyone who falls in line behind #Trump will be remembered as a traitor. #VoteThemAllOut #VindmanIsAHero #ResistanceTaskForce
Sarah Cooper | Hilarious Donald Trump lip-synching Imitations | The Project  via
Sketchy Donald Trump Deal Eyed For Ties To Iran | Rachel Maddow | MSNBC  via
Trump Accidentally ADMITS He Failed America  via
We have an authoritarian regime attempting to redefine America by destroying the middle class &amp; the American dream.Trump uses race relations to divide us. His real agenda is to create a class war even convincing some that he is far more superior than most. #resistancetaskforce
Trump sold American babies to the Ayatollah as food. Every time Tump gives a thumbs up he is signaling that he has had congress with the beast again.
Winners? America is sick. #Covid19 raging on.1000 a day are dying. Here Trump is rambling about showers, his hair, perfect dishwashers, people who do dishes, water, rain and that was only 10 days ago. Today 145000 are dead from #Covid19. This is not winning! Trump is evil!
No no no.  Trump is just sending the bat signal to women that can’t think for themselves.
Your President is 100% spot on and SIMPLY AMAZING!!!! Donald J Trump is the BEST PRESIDENT EVER!!!
1.  “Go to Hell Donald Trump” 2.  “Let’s get this Covid shit right”
Angela Merkel Doesn’t Want To Be The Same Room As Trump, “I Don’t Want to Be in the Room With the Guy”  via
Yes and even more so with this coming out:
You’ve got to be kidding me... Indictments SOON I hope!!  100% vindication!!
Trump's Team Is Making Joe Biden Look Better Than Ever  via
Trump has been doing that to you for the past 4 years and you've been eating it with gusto and want more.
Not everybody who follows trump are fans.  It is best to know your enemy, so you can respond properly.
This lifelong Republican has had enough of Donald Trump  via
Over 4 million cases &amp; approaching 145,000 deaths &amp; the WH is trying to blame Fauci. THE REAL CULPRIT IS DONALD TRUMP BECAUSE HE WAITED TOO LONG TO DO SOMETHING .
Swing state Republican turns against Trump  via
Illegal for trump to send out unmarked troops for so called “riot control”. How about everyone shout out “Lock Him Up” now?
And... BLM doesn’t care.   Black Man Known for Standing Outside With ‘Vote Trump’ Signs Murdered in Broad Daylight – District Herald
Cute Midwest Grandpa Talks Trump  via
Dr. Fauci claps back at Trump after Trump called him an “alarmist”  via
It started long before Trump Lisa as you well know and flourished under your legal direction. So you can blame yourself and those protecting your team for this shame.
Barron Trump's School Won't Fully Open For In-Person Instruction This Fall #SmartNews Why doesn’t this crap surprise me ?
New Trump Admin Policy Would Restore Voting Power To Citizens
#AmericasGreatestMistake   🔥🔥🔥Donald Trump A Scheming Conniving Russian Asset . Long before the election a very courageous woman told us how dangerous he was. She told us "a man you can bait with a tweet is not a man you can trust with nuclear weapons." #HillaryWarnedUs
God must be the conductor of the Trump Train lol
Paula worked with kids all her life, and she is appalled by Trump's trea...  via
Trump called out for blaming Obama for city violence but not himself dur...  via
Biden is not all there but he doesn’t realize he’s not all there.........  His handlers do. They walk a tightrope.....doing damage control  every time he opens his mouth.   They know it’s game over when he debates Trump.   What’s their plan?
Trump Proves His Cognitive Abilities With Five Magical Words: Person, Wo...  via
Anti Trump (never Trumper) what is she covering for. We know who.
Trump selfless?
Trump Admin Orders Filmmakers To Hide Footage Until After Election  via
Why Bill Barr Faces A Reckoning If Trump Loses | The Beat With Ari Melbe...  via
OOPS: Trump Confirms Press Secretary Lied...Badly  via
Trump interview about questions at the end of the #MoCA test are hard...😝😝😝
Donald Trump is FREAKING OUT About His Polls Numbers and Telling OUTRAGE...  via
Thread by  NEW: Trump’s Use of Unidentified Federal Officers to Suppress Protest Is Backfiring in Senate and Presidential Battlegrounccording to  data we commissioned this week. Majorities of #AZ, #ME, and #NC voters oppose Trump’s secre…
Trump newest "shill" Dr Mark Siegel marveling at Trump's memory, but he has too many lapses in judgement and lies like hell Dr. so what does that have to do with his memory. SAD
New CDC guidelines in favor of opening schools this fall, though Trump says some may be delayed
Facebook profits by spying on us and using the data to let advertisers target us. Trump is exploiting their model to spread lies about elections — it’s time to investigate #Facebook and rein this in.
Thank you President Trump and Senator Inhofe for the deference to our great military history.  God Bless.
What will he do when they kneel during National Anthem?  You know they will.   President Donald Trump plans to throw out first pitch at Yankees game during 2020 MLB season
Trump appeared on Fox News 3 times in 5 days? *scratches head* didn’t he disown Fox? Is he cheating on OAN?
Anyone is better than trump. ANYONE!
Governor Cuomo Announces President Trump Has No Plans to Send Federal Ag...  via
President Trump Goes to War With GOP Rep. Liz Cheney
Evil NaN. Karl Marx: “Accuse Your Enemy Of What You Are Doing, As You Are Doing It To Create Confusion” therefore, she is the failure in her own world. Frustrated by Trump’s huge success.
The conversation with my future kids when I show them "pictures" of Trump will be interesting.  Shyftlets: "But dad, that's just a dildo covered in cat hair!"  Me: "What can I say? It was a different time!"
Trump is always talking about his intelligence. We all have observed he's not all there. He's still obsessing over his #MoCA test. He is mentally impaired and sadistic. What he calls his #VeryVeryLargeBrain is what makes #TrumpTheDisaster
Trump's Boasts About His Cognitive Test Are Freaking Out The Public  via
wonder who joe biden’s vice president would be..  because if he did somehow win i bet he wouldn’t be in office long. dude literally has dementia..  so basically whoever his VP is, is actually running against trump, not biden.  btw he is announcing who it is August 1st. #staywoke
But you did not object to #TulsaCoronapolozza His irresponsible behavior is why America is sick and dying. The lies Donald Trump and most Republican legislators told calling #Covid_19 a Democrat hoax, blaming it on the media, attacking Dr. Fauci. Go take a #MoCA and a nap Chuck.
Thank you, Comrade Trump
President Trump holds coronavirus daily briefing at White House | USA TODAY  via
President Trump holds coronavirus daily briefing at White House | USA TODAY  via  hear America is doing great economically. Stock is great.
Trump lol
Former Evangelical pastor speaks out against Trump  via
Despite voting for him in 2016, Buck is determined to get Trump and his ...  via
U.S. Senate passes $740 billion defense bill, bucking Trump on Confederate names  #SmartNews
The big winner is employers not employees. It would save 7.65% on every dollar an employer has to pay so who does a payroll tax help? Donald Trump businesses and all of his billionaire friends. He isn't going to get it in the new stimulus bill but he will try to do it again.
Trump wants to send help to riot torn cities suffering destruction and death.   The Democrat leaders of the cities are refusing his help.    Remember that in November.
#ChristopherDavid the veteran beaten by Trump's militia is calling for a #WallofVets  Thank you to everyone who are standing up for America. For a while it felt like we forgot the Golden Rule. It took a demagogue on a golden toilet to remind us #AChangeIsGonnaCome Sam Cooke #BLM
Inside Donald Trump &amp;amp; Mariano Rivera&amp;#8217;s Longtime Friendship  via
After President Trump wins this November.... I hope the people who do polling are out of business for good.    Even though Trump supporters know these polls are rubbish....  We gonna fight like hell to deliver a 2nd term to Pres. Trump.
So you’re saying because he supports Trump, he’s not “warm, decent, and kind”? Incredibly sad that you let politics dictate who people are, despite knowing differently.
Trump for President! He has done more for this Country and the rights &amp; freedoms of the Citizens for past 4 yrs. He has been trashed, hounded, vilified by politicians due to jealousy, media because they were paid to, for what? What end? Dems have been disgusting, media deplorable
This will be in the list of memorable protest songs of the Trump era just like so many great songs that came out in my youth. We didn't have rap in the 60's but Mississippi God damn by Nina Simone, A Change Gonna Come, Sam Cooke, Eve of Destruction, Barry McGuire... 😭🇺🇸
This article is nothing but dogwhistles -- "Do you want those BLACK people and POOR people moving into YOUR neighborhood? Vote Trump to keep it all white!"
You need the test!  trump is your 🤮 President! Not joe Biden.
#ImVoting4BidenBecause He is not a pathological liar. He is far more qualified than Dolt 45 ever could be.   45 is a malignant narcissist who wants to be a Dictator. Biden has compassion and decency, tRump has passed a dementia test. Allegedly.. 45 is lower than a snake's belly..
There isn't time or space to list all the tRump lies..  That would take a set of encyclopedias since not even a War And Peace sized tome could contain them all..
I think that’s exactly what they are trying to do Trump has been trying to start a racial war since  the idiot took office He cares Not !!
Donald Trump’s Niece Mary Tells Stephen Colbert That Her Uncle “Could Not Function In The Real World On His Own”  #SmartNews
Trump deploys more federal agents under ‘law and order’ push  #SmartNews
Well I’m a proper southern woman that lives in the 21st century not the 19th I believe in separation of church and state and that Trump and the southern avengelicals that support him are pseudo Christians who care more about his political career than this country
Trump not washing his hands?
President Trump is the man I want in the White House.   He has no obligations to anyone except America and her people.    We must  re-elect the most patriotic leader and President the world has ever known.   HE WILL MAKE AMERICA GREAT AGAIN
Like Trump took responsibility for ignoring  the Corona virus?
How much money does Mark Zuckerberg make off of Trump's #Facebook ads? Federal regulators need to investigate the false claims they make.
I am already not liking Boden. Bernie and Elizabeth Warren are not saying anything at all. If I can vote Trump will be  choice.
Trump Promises To Sign Imaginary Healthcare Bill In 2 Weeks  via
Rubbish! #MeghanMcCain is not as dumb as she likes to play. This woman is a talker. I don't believe for a second she didn't know or hadn't been told or never saw the many photos of Trump and the #billionairepedos ...  I'm not saying she's brilliant but fos oh yeah!
