Yeah cause I was making fun of how dumb the conspiracy is. When the adherents of the claim fail to attack Trump, even though he’s just as “guilty” as the Clinton’s if we’re using being photographed with Epstein as evidence, it’s most likely a fake story with an agenda
Trump will  call out the guard!  He won't let that happen.
Bravo President Trump!
TRUMP/PENCE 2020!
ME too! VOTE RED. TRUMP/PENCE 4 MORE YEARS!
Yes, and EVERY single Trump voter MUST vote in person, please!
And Pelosi was just saying that we weren't up with Europe and called it the Trump virus. She is a wicked, heineous person! I pray she loses her seat in Congress!
I know him. Trump Nazi president lol
NO MATTER WHAT TRUMP TRIES IT IS WAY TOO LATE FOR HIM ..... WE THE PEOPLE ARE NOT GOING TO VOTE HIM BACK IN
why are y'all showing old riot videos to push your agenda..... TRUMP IS NOT GETTING RE-ELECTED BECAUSE "WE THE PEOPLE" HAVE BEEN LIED TO WAY TOO MANY TIMES BY THIS ADMINISTRATION DURING THIS WHOLE TERM!
No, no, I'm ready to get past all this mess! TRUMP 2020. VOTE RED NOV 3. BEST PRESIDENT EVER!
Love  you, Lara Trump. Stay safe!
President Trump.......BOSS! TRUMP 2020! VOTEXRED ON NOV 3.
Trump wants to do just that .....clean up in a short time!
Yes and vote RED! TRUMP 2020! SAVE AMERICA!
Scott, I want you to know how thankful I am for you and all the others who are working so hard for our President. When President Trump wins another 4 years, he needs you in his administration! Thank you with love and admiration!
The fact that Biden thinks trump is the first racist person to be elected president is crazy too me 🤔🤦🏽‍♂️
The good news for Trump is no one will be there to boo him.
President Trump Says Obama Did A 'Poor Job' Stopping Gun Violence
You are a very smart woman and Patriot! TRUMP 2020! VOTE RED ON NOV 3!
Thank you, Donald Trump, best ever President!
I am so proud of President Trump for takung care of them!
I am sure that your citizens are very thankful to President Trump! You need a brain check!
I stand with President Trump! VOTE RED ON NOV 3!
Nancy Pelosi, how dare you say that President Trump is at fault for Covid 19 cases and deaths  If he had,xt closed our border when he did, we would have had 10's of thousands more. You and Chuck Svhumer said he was being, what was word, zenaphobic for doing so.  We do not need
Sorry, Greg, thought this was Trump Girl's statement!  I am glad you did that because I think you will be glad!
I love Donald John Trump, our awesome President!
TRUMP 2020! VOTE RED ON NOV 3!
You alreadyhave blood on your hands Let your police and Trump help your civilians!
Good TrumpTrump is absolutely THE worst person ever! I’ve never hated anybody like I hate him!
Don’t you have covid? Biden is a better man, father and husband than any person named Trump.
Trump claims, with no evidence, that keeping school closed during summer vacation (as schools have been doing since the 19th century) is causing more death than COVID-19.
You forget Trump is stupid rich or something.
You called it again.
QUESTION FOR LAWYERS OUT THERE: We know Trump cannot delay the election and Congress won't approve it.  But, can governors force delays in their states?
I cannot believe that I am saying this.  As a liberal American, I have rejected the view I'm about the express.  It is wrong, or at least should be.  IF YOU VOTE FOR TRUMP, YOU ARE PRACTICING TREASON.
TBF, Trump would have been miserable the whole time. Everybody would be talking about John Lewis and shrimp would have to spend the whole time figuring out how to make himself the topic.
About 1/3 of the value of all the goods and services of our country has been lost in 3 months due to the failure of our government to address the virus. I ask again, how would Trump's behavior be any different if his goal were to destroy American society?
Gov. Hutchinson says election on Nov. 3 needs to go on as scheduled and #Arkansas is prepared for it. President Trump had suggested earlier today in a tweet that the election might need to be delayed. #covid19Ark
They aren't sure because he's been recklessly traveling around without wearing a mask to places with lots of disease. But probably the Trump rally.
Not only is Trump trying to commit yet another act of treason but the good news just keeps on coming. Fuck 2020, man. Seriously. #2020worstyear
It was reported that 6,200 people attended the Tulsa Trump rally on June 20th how many people will die from this??
Someone needs to do it, Trump sure won't.
Which is why Trump votes by mail. Only voter fraud of recent note has been almost exclusively Republican.
Right, that's the coordinated action for which Dems are so well known. Only person calling for changing election date is Trump because voting by mail "rigs" the election which is why he votes by mail.
Trolling is when you don't really mean it. These are not the words I want my President to say. (I voted Trump)
Trump: "fear not Aztec suburban mom's, I won't let those jungle people move to your neighborhood with their jaguars trying to stop your human sacrifices!" No doubt Trump fancies himself as a "Sun God".
here come the Trump snowflakes in 3, 2, 1…
In the end, it’s not about delaying the election.  It’s about planting a seed of illegitimacy with the same people who believe a pizza parlor is the epicenter of a global child trafficking ring that only Trump can bring to justice, revealed through coded missives on the internet.
FLASHBACK: Conservatives attacked Joe Biden for predicting Trump would try to delay the 2020 election #SmartNews #JoeGotThatRight
Vulnerable Senate Republicans betraying the country again after Trump floats election 'delay' #SmartNews #ThrowThemAllOut
I’m so numb these days...  you can literally say as 150,000 people died Trump cared more about: Winning an election Being disliked Golfing Goya Drinking Water w/ one hand Walking down a ramp A cognitive test White Lives Boaters in Flordia And on  And on And on..  &gt;150,000 DEAD.
The Kremlin today praising Trump's move to weaken U.S. military support for Europe should be chilling.
Covid.  Contracted at Trump rally in Tulsa.
Trump basically helped Herman Cain kill himself. I did not agree with Cain, but he did not have to die. Trump is responsible.
Flashback to 2016 when then-candidate Donald Trump was ranting about (imaginary) *in-person* voter fraud.  The dude just doesn't want people to vote.
What do we do when trump shuts down the country in mid October
Donald Trump’s Tulsa rally killed Herman Cain. #HermanCain
Herman Cain, who attended Trump’s Tulsa rally without a mask and two weeks later tested positive, has died from COVID.
Oh my God. God, have mercy.  Mr. Cain attended Trump’s Tulsa rally without a mask. Two weeks later he announced his COVID positive result.
Under trump’s leadership we just posted the worst economic contraction over a quarter *in our nation’s history*.  He doesn’t want you to know that. Or to talk about it.   He’s desperate. It’s BETTER FOR HIM for us all to be talking about him illegally cancelling the election.
Donald Trump's Logic:  Send teachers and students to school nation wide because COVID-19 will 'just disappear'.   Delay the November election because it's unsafe to vote.   This man is a clown.
Yep - Trump has tipped his hand that even he knows how weak he is right now.
The only thing Trump has shown himself to be good at is grifting. Whenever you see a wild flourish of one hand - immediately focus on the other hand. He would rather we talk about demon sperm, alien DNA, and delaying the election than an economy he has driven off a cliff.
In case you were wondering why Trump is throwing all the crazy at us this news cycle - here is the thing (along with Russian bounties on US soldiers) that he is trying to distract you from seeing.
“TRUMP FLOATS DELAYING ELECTION” HAHAHAHAH SORRY MY GUY NO CHANCE
Trump is now officially pushing to delay the Election. Not because it’s unsafe—he’s sending kids to school. So things, to him, aren’t that bad.  He’s pushing to delay the election because he’s f*cked his presidency up so bad that there is NO way for him to steal it from Biden.
“The U.S. Constitution gives the power to regulate the “time, place and manner” of elections to the U.S. House and Senate, with Congress also empowered to alter the rules. Nowhere is the president granted such power.” #LyingTrump
Trump floats election ‘delay’ amid claims of voting fraud #SmartNews we have to stop this from happening #RESIST #VoteBlueToSaveAmerica2020 #VoterSuppression
And so begins Trump's desperate clinging to an office undeserved.
Shut up Vladimir Trump
If your a democrat or a liberal you have already been brain washed by the Marxist left!!! President Trump is trying to protect the everyday people of this country!!
Trump. He’s damn near finished it off already!
We have a new POS president.  The first thing she did was to violate the POS rules against political signs in yards.  Trump, of course.
Are they considering allowing absentee ballot counts to begin early? I’m concerned if it takes multiple days to complete the losers will claim election fraud. Trump is already starting this. Also, can early voting period start earlier?
This is Trump’s next physician. Finally, someone nuttier than a fruitcake to take care of himself.
Trump
Gretchen Whitmer broke Donald Trump’s Midwestern firewall. Like, smashed it into a million pieces.
TRUMP
Perhaps shifting gears to 2022?  Saving for blitz this fall? Waiting to allocate to best chances to hold onto Senate? Trump has already lost 65+ (reliable!) vote which he won last time. Other crucial suburban vote now for Biden.
As long as trump is president this is true
Pelosi on Feb. 24th - three weeks after Trump shut down travel to China over COVID.  “We want to be careful how we deal with it (coronavirus). But we do want to say to people, come to Chinatown. Here we are, again, careful, safe, and come join us.”
If you ever wanted irrefutable proof that Donald Trump is an overwhelmingly racist piece of shit, then here it is.
United States citizens: Black Lives Matter and we want to see real change in the systematic racism in our country  Trump:
Did the Trump spawn ever take that court ordered class after being convicted of stealing from a children's cancer charity? Asking for the soul of a country.
"... yet to see a dime."  "Trump’s budget request also includes an additional $7 billion in spending on education, a 10.5% increase, with money going to support STEM, childhood intervention in the opioid crisis &amp; post-secondary vocational training."
Looks like they got degrees from Trump University, doesn't it?
Trump is the gift that keeps on giving.
2021 will likely be the year of GOP reckoning that was scheduled for post 2016. Suspect much finger pointing RE responsibility for Trump and 2020 disaster where white vote goes for Dems for first time in generations (Nixon?).
If you made a list of the 100 most batshit crazy things any president of the United States ever did or said, how many of them would be Trump?
You can stop rattling your chain of bones against the cave and sit down high priest of argle bargle,  ye prophet of Cayman Islands profit prophecy, your Grand Poohbah Trump's multiple bankruptcies proves connected wealthy fail upward. A physician would go to prison.
Historically...trump could do stuff like this &amp; then blame his opposition for blowing it out of proportion &amp; it would rally his base....now its hurting more than its helping bc we are in a pandemic, folks are dying &amp; suffering. Words, actions &amp; results matter more than ever now.
Trump is breathtakingly out of his depth on the world stage, and he seems unwilling or unable to learn even the most basic parts of the job. Historians may be able to correct me here but I don’t think any president has ever taken the security of the United States less seriously.
Can we get a super cut video of Trump running away from women calling him on his B.S.?
How the ever loving fuck does a young man, a Black reporter look like old-ass Michael Bloom? Trump is senile and it’s not even a question.
We’ve been talking like Trump unleashed Schutzstaffel death squad super soldiers yet these dweebs are trynna pull up with paintball guns and 3 pistols??? Looks more like Trump hired Paul Blart et al, gave em some Airsoft LARPing gear and said, “be home in time for dinner, kids!”
Same way Trump got elected. Electorate blew when they should have inhaled.
I get it Trump has never convinced me to vote for him... but I thought the job of Trump supporters was to convince me to want to vote for their guy. Not one of them has even tried to use facts or reality to make me change my vote in the next 98 days. #TrumpleThinSkin
I thought your job as a trump supporter is to convince me to want to vote for you guy right?
Here's the story behind Trump's Red Sox-Yankees first pitch that wasn't  #Sports #DonaldTrump
Why Trump's invasion of Portland is textbook fascism  via
"I don't trust anything the liberal media says, but I definitely trust a random dude with a picture of Trump on twitter over anyone else."
She has a trump shirt on bro this is comedy gold
Trump backs out of Yankees opening pitch he was never even invited to. An official told The New York Times the idea emerged from jealousy of Fauci. #SmartNews #LiarInChief
'We cannot stand idly by': Senators demand Mitch McConnell call vote on John Lewis voting rights bill #SmartNews yes 🙌🏼🙌🏼🙌🏼🙌🏼
Barr calls Russia scandal 'bogus,' says he acts independently of Trump in blistering opening statement #SmartNews 🤣🤣 As INDEPENDANT as a four year old #Resist
I would but trump be like
Where is all the money going? Trump has been taking donations for his reelection campaign since... oh what day was it🤔
Trump is a virus! We need a whole system reset to clear out all the bugs 🤔
The Gestapo has no place in American society.  Get them the fk out of our cities!  Damn Trump for putting them there.
Donald Trump just got destroyed for his "illegal" tweet  via
My favorite thing about trump supporters is that they have the time and money to rent a whole-ass boat for a political photo op but they lack the sense to stage the photo so it looks like a full boat.
Donald Trump treats women this way, are you really surprised when his jackbooted thugs emulate him?
I don’t see anyone verbally attacking anyone. I see someone upset that you said it’s like the flu after his sister died. I also see you blaming Democrats for Donald Trump’s incompetence.
Yeah, pretty sure if trump's gonna be in an arena full of New Yorkers with bats it's really not gonna end well. Like the worlds most gruesome pinata party and everyone gets to live out their childhood fantasy of beating a dictator to death with a stick.
(it was either this or a "well, Eric thinks Trump is Jesus, so..." tweet)
If donald trump is your moral compass, you're doing Christianity wrong. If hell is real, you'll burn in it for supporting trump
Trump Announced, Then Canceled, a Yankees Pitch. Both Came as a Surprise.  #TrumpDonaldJ #NewYorkYankees
And it will be once the Trump virus is removed from office!
Lmao, can trump whine about literally anything else
John Lewis did more in his life by age 23 than Trump will ever do in his lifetime.
The board will follow suit. Anything to hurt Trump and parents all in the same swipe is a win for them. Every study in the world has shown kids aren’t the issue with COVID-19. Surrounding schools all have done a mixture to help parents but not TPD. Smh.
At least he’s not being a hypocrite &amp; going to pay “respect” to a person he disliked. Lewis hated Trump.  Obviously Lewis &amp; his family probably don’t want Trump there.  Trump goes: “He’s not welcome.” Trump stays away: “He should’ve gone.”
Health and safety trump revenge as Dodgers hit the road to play the Astros  #LADodgers
Please contact your state representative and ask them to get the federal COVID relief to NWA that the CDC, the Governor, and the Trump Admin have all agreed the region needs.  1/x #arleg #arpx
Today is the day that the GOP is concern about the rule of law? No, you do not get to complain about the “rule of law” after what Trump has being doing. Nope nope nope
The Trump campaign concedes the large majority of Americans on land have realized their administration is a dumpster fire however the boats have not abandoned them.  They will always have the boats.
In the last 100 years, I think the only presidents with a case for being worse than Trump are Harding, Hoover, Nixon, Carter, and Bush Jr. lol so it wouldn't take much for Cuban to be better
The video of Trump declining to pay his respects to Congressman Lewis and his family. His affect speaks volumes here.
So I see here that you accept there is a pandemic. Are you wearing a mask? If this statement were true- it would be a gift to Trump to fix it. But alas, you are misinformed. Please consume other news sources that corroborate and vet what is printed.
I agree 100%. I'm not a Trump supporter and could never vote for him. I'm struggling with finding a way to vote for Biden though. Leaning towards third party.
Trump only pivoted on coronavirus after reportedly being warned of spikes among 'our people' in red states
Idk why people hate on trump for “dodging the draft,” stubbing your toe hurts
Neil Young Rips President Trump for Using ‘Free World’ Like It’s His ‘Theme Song’
Arkansas.   Only one poll so far and it was Trump +2  Trump won by 27 in 2016.
all this does is make me despise donald trump even more for the shit leadership he’s shown by not shutting out country down like every other country in the world and stopping this spread. we could have been done with it MONTHS AGO
I have cut all ties to anyone who voted for Trump in 2016. Family or friends it does not matter. They are gone! I do not associate with hate!
All Biden needs to do for the next 100 days is keep posting positive and supportive messages on social media, make on camera appearances to twist the knife into Trump, and remind the entire south that they’d have SEC football if Trump would’ve taken Covid seriously.
Huge. Just imagine if Trump had taken this seriously. We’d all be safely back at work/still employeed. I trust data analysis geniuses more than some right-right science-denying assclown and his sycophantic lemmings.
Vietnam Vet Sprayed In The Face By Trump's Federal Agents In Portland
WTF??? Trump is calling protesters terrorists. That puts him in the company of the world's autocrats
Now that Trump’s beautiful and very long border wall has blown over, I’m guessing that we will find out that section was built by Obama and Biden
will allow Trump to use his illegal troops to intimidate voters  will use unqualified judges if the vote is close    will allow mailed ballots to go uncounted
⁦  needs to go down to #florida and hold a #republican #convention   #takethemasksoff #maga
We should never forget  stayed silent when he found out President Trump knew our soldiers were being targeted for murder by Russians and did nothing.   If that’s “leading from the front,” Steve needs a demotion.
The political parties switched sides ya idiot. He was a racist and a bigot, unlike the late John Lewis who was beaten within inches of his life on that bridge, standing up for equal access to voting.
This feels very fake to me. Big brother needs to not even think about it. Feel scummy.   UN calls on US police to halt the use of force against journalists covering protests
He won’t be able to debate Trump!! I would love to see that!!!
Steak tacos! And it’s not even #TacoTuesday    And yes, this is more interesting than your Trump is awful/Trump is awesome tweets.
To the future leaders of Class 2024, remember the Oath that your swore, protect and defend the Constitution, protect the USA from non democratic republic enemies, be ethical, follow the Rule of Law, defend the USA against Fascism, authoritarian activities that Trump is doing.
For Trump
Ok--EVEN IF Trump's characterization of the protesters were correct, American citizens are guaranteed by the Constitution. That would be the document Trump swore to uphold.
Twitter finds this asshole and get him arrested.   find this man in the Trump hat.
Trump Backs Out of Throwing Pitch at Yankees Game  #Baseball #NationalAnthems
When trump wins, it will multiply by 100
Isn't it funny that today's Nazis evoke the name of a Jew to praise them for Trump?
is learning that "Anything Trump Touches Dies"
Rick Wilson said it well, "Everything Trump Touches Dies."
You’re just attempting to come up with a lame excuse for losing the election, which you will indeed lose, but not for that reason.  You’re a horrible president and aren’t protecting the people of USA from the Trump virus.
Biden should do an interview with Wallace. His team should prep him well and he needs to show that he can take the heat. If he can’t handle a lean-right interview, how will he debate Trump?
Well- when the trump regime falls, she will be sure to give thanks for answer to her prayers.
Shhhh! It's a secret! Trixcy Hobbits can't gets Trump secret from us!
This is now tRump’s America &amp; it is wrong. He is unleashing a goon squad comprised of different federal agencies and mercenaries that are kidnapping protesters and interrogating them which is against the law and the constitution. This is morally and lawfully wrong.
Get RED TRUMP/PENCE 2Q2Q FACE MASKS. BLACK WITH BLUE LINE, #45 2Q2Q LANDSLIDE  That'll be supportive of the POLICE RANK AND FILE  and REELECTION of PRESIDENT Trump and Pence
Damn straight, PRESIDENT Trump won't go against the CONSTITUTION to prosecute the Treasonous TRAITORS. He's allowing the DOJ pursue the prosecution within the guidelines of the United States CONSTITUTIONAL LAW. The TRAITORS are supportive of ANTIFA/BLM PAID MERCENARIES RIOTERS.
Even #RonaldRegan doesn’t want to be associated with #Trump
This is Trump’s America.
Made-for-TV fascism: how Trump’s ‘crime explosion’ ploy could backfire
Pretty sure trump never bowed his head in prayer. Pretty sure the Reagan family will disavow this painting- seeing as they want trump to cease and desist in using Reagan in any campaign ads. However- if prayer gets him out of office, let’s go.
What’s next, the Nazi party gunna call and tell trump and his supporters to stop using nazi symbols and propoganda to recruit?  What is this world coming to?
The same searing Trump focus that produced multiple bankruptcies? May not be "Hail Mary" as they imagine it.
I apologise that you are a right wing pseudo christian bigot whose blind worship of morally diseased Trump for the purpose of packing Supreme Court has ultimately failed.
Trump has violated the oath of his office. If you support him, you’ve violated the police officers oath as well.
If you can SPY, INTERROGATE, MAKE FALSE ACCUSATIONS, against President Trump's campaign and TOP SECURITY ADVISER, will mean that ALL OF US WILL SOON BE ATTACKED BY FULL POWER OF OUR GOVERNMENT IF PRESIDENT TRUMP LOSES NOV.3RD, 2Q2Q! PRESIDENT TRUMP will restore  the RULE OF LAW!
Is it bad that I’m jealous of the people who died in 2015?   Imagine having lived your whole life not knowing a Trump presidency or COVID-19
It reminded me of “normal” presidents who go further gray after 8 years in the White House and age significantly. I don’t anticipate Trump following this pattern because he doesn’t carry America’s weight on his shoulders. All he carries is his oversized ego.
Her memories of Barack dealing with the rough moments of his tenure: Newtown and Charleston shootings, and more, his grief, how he felt the sadness of America on his shoulders, stands in stark contrast to Trump.
She makes it clear that her disliking of  goes back to the first Obama term when Trump tried to bring back up the birther movement.
Yup. Trump supporters can now include the Ronald Reagan Foundation along with both Presidents 41 and 43 as having “TDS.”
‘Wall of Veterans’ Arrives in Portland to Protect Black Lives Matter Protesters from Trump’s DHS Troops
Please vote, but note Trump has no intent on honoring the results of the election. This is the real reason he is sending paramilitary troops to Democratic strong hold cities. When he loses he has until January 2nd to enforce martial law nation wide &amp; arrest democratic leaders.
I absolutely love it!!! Take that, tRump, you racist , fascist twit.
So let me get this straight. Libs that don’t control WH or senate are SO powerful they got Trump, Asa, Hunter Yuracheck, the Razorback football team and most sane individuals to support mask usage. Damn. That’s quite a theory 😂😂
Trump Flags everywhere, and the STARS and STRIPES!
i wonder if y’all know how embarrassed you should be for being trump supporters.
Trump is the one in charge of his administration.  No one else.  He’s making himself look bad not anyone else
I think Joe is the favorite &amp; will win this election but I also think Trump could pull a rabbit out the hat. Trump is the modern day “Teflon don” lol
These Trump Campaign Payments to the Trump Organization Look Shady as Hell
This should scare Trump, Barr and the Republican Party
MSNBC/CNN are bad about talking over the briefing with TDS TRUMP DERANGEMENT SYNDROME DIMocrats. FOX NEWS gives what used to be called TEASERS. INCOMPLETE INFO to PEAK INTEREST for the WRONG REASONS.
Correct, the 25A allows the president to nominate a replacement if Pence did resign, but the House has no reason to take that up. The historical precedent is for Pence to finish the term and be replaced by Haley on Jan 20, if Trump wins re-election. FDR did this twice.
That’s because Reagan and Trump are very similar
