"Harris was one of the frontrunners from the very beginning, but Rice gained in the so-called veepstakes because reports were that Biden was looking for someone who could help him govern.”
This fool repeats everything he says, 3,4, 5 times in a row so his supporters hear his lies, so they believe them. I ain’t seen one of these ads! This fool has got to get gone!!!! #Biden/Harris2020
2- The fact that Biden is using a Republican for Hispanic/Latino outreach is a perfect example of how stupid they are, that is of course if you believe that they actually care about progressive values.  If you don't believe they care it then makes sense.
Can't get Biden/Harris to lose the election by sticking to the real issues this country has so you have to make up lies and b/s knowing the moron you support wants to get rid of health insurance, social security and medicare!
As Kamala Harris joins Biden ticket, Wall Street sighs in relief - The Wall Street Journal
Kamala spent the majority of the democratic debates blasting Biden on his racist voting record...
Gotta push back on this. You're missing the fundamental critique of leftish folks who won't vote biden, which is that Trump is NOT fundamentally unique as a president. The terror of this administration is not novel, and we believe 'business as usual' dems will only further...
imagine someone trying to explain this to Biden
Ugh I know people are trying to encourage other people to vote but I get nauseous AF when my feed is just biden 🤢🤢🤢🤢
Definitely location-dependent. I watch Jeopardy and Wheel every night and haven't seen a single Trump ad (or Biden ad, for that matter)  I also live in Vermont, which explains everything
White men are freaking out the Biden's VP pick doesn't look like them. To me, personally, I don't care what gender or race a candidate is. But I know it's important for this reason, which is why I supported Biden picking Harris or Abrams.
Has John Cornyn become a Biden supporter?
Not only that, you’re citing 1 NATIONAL poll to make a point against the Florida poll I initially retweeted. Like I get you dont like Biden, but learn how to use empirical evidence to make your points.
So, I guess logically, Biden Harris IS the most progressive ticket, given the stipulations above.
You know who leads blm. racist Corey booker and Kamala Harris. BLM donated over 50 mil to biden campaign. Oh look now Kamala is his vp
Yes but I’m still voting for lesser of two Evils ( Biden )
Alright I’ll be the one to say, this one sat alright with me. Didn’t sit great. Didn’t feel *good*. But it was just...fine. Sort of like Biden?
Hey Biden, you think maybe you can  take a cognitive test to reassure the people that you’re mentally fit to even run for President? Wait.... it’s you and your party’s plan to really just make sure you some how cheat the system to win and let Kamala be president and  destroy us.
Joe Biden wants to use your taxes to resettle economic migrants in red states and cement the demographic doom of this country.
Joe Biden wants to raise your taxes. Pass it on.
It just keeps getting more insane. Calls biden a racist and believes the accusations from women accusing him of assault. Who wants a leader like that? biden
. If I was Joe Biden, I’d sleep with one eye open, because she’s looking to take over the White House. 👀  #Hannity
Amazing thread. I too went to bed last night teary eyed with joy.... This morning? Was the first time in forever I woke up excited to turn on the news. I just wanted to see and hear Biden and Harris...and remember what HOPE feels like.
Biden should have put a coupon in the penny saver and offered free pens.
Biden has been trying to cut Social Security for decades. But you know that.
Trump, Biden, and Pete.
But I don’t believe Biden.
If republicans are so willing to vote for Biden that should say something!! It’s a trap and we are in for another shit show if he’s voted in.
We could have had Yang or Sanders. We are stuck with Joe Biden who I’m not convinced will beat Trump.
Joe Biden calls these folks "peaceful protesters"
Reply to this tweet with all the tough questions Joe Biden &amp; Kamala Harris were asked today
They own it now. Except who in the press will report it or ask Biden about it? If they ask Kamala she can always say “ It’s a Debate!”
Oh boy. Here we go. The loud mouth Biden needs to attack with because he’s too diminished to do it himself. Dems have no Workable ideas. You can’t win with hate and being against Trump. What do they offer besides platitudes? Nada #WalkAwayFromDemocratsForever #Trump2020Landslide
It’s a valid argument to say that Trump is worse, but Biden will continue most of Trump’s policies at about 8 instead of 11 And the media just won’t talk about it. Progressives in Congress will have to fight no matter who wins.
President Trump is a MOOD.  "I saw just a moment of [Biden] speaking, a moment of [Harris] speaking and it was enough."
How challenging to Wall Street do you suppose Biden Harris is going to be? C'mon man, gimme a break.
Sure, that is your opinion. Mine differs. All cows are not black, but these two very much are. We only went backwards under Obama, and you think it will be better under Biden? We're out of time. We desperately needed progress, and our leaders just keep getting worse.
Let’s hope so. She’s for UBI. I like Kamala more than I like Biden.
Perhaps you convince Biden.
Vermont Democratic Party Spokesperson Christoper Di Mezzo, says for the Biden Campaign… the choice of Kamala Harris was a no-brainer.
FACT CHECK: After Charlottesville, President Trump Specifically and “Totally” Condemned “Neo-Nazis and White Nationalists”  Joe Biden, who honored a former KKK Exalted Cyclops and repeatedly used the N-word, is lying again.
People are dying, and the earth is dying, and it's your own fault for supporting conservatives like Biden who won't do a damn thing about it.
Me walking into the booth about to vote Biden/Harris
Joe Biden, Kamala Harris Hold First Joint 2020 Campaign Event
this presumes they'll take questions or that they'll call on people who aren't on Biden's pre-approved list
so when Biden and Kamala best Trump and Cori congratulates them, she'll be bad then?
y’all can vote for the Biden/Harris ticket in November and still hold them accountable for the harm and trauma they’ve caused BIPOC   like the two aren’t mutually exclusive, hold your elected representatives to higher standards, please  ALL OF THEM
It's understandable that this Biden/Harris event is over 30 minutes late because Biden has tons of events and is doing loads of interviews that backed him up - oh wait....
This Biden/Harris event is probably running so late because Biden keeps forgetting the name of who his handler's chose to be his VP. #BarelyThereBiden
The former primary rivals will appear at a high school in Biden’s Delaware hometown to discuss their shared vision for how to defeat Trump and then lead the country through a pandemic, its economic fallout and a long-simmering reckoning with racism.
Yes but I'll still vote for Biden because  is an actual fucking fascist. #antifa #AntiFascist
Agreed, there is no debate. Time to vote. Biden lowers himself to be on the stage with Trump.
"sHeS NoT mY FiRSt cHOicE fOr VP eiTHeR, bUt...."  Just be quiet and let me be mad about this. I know I gotta vote for Biden/Harris, but I don't have to like it.
The takeover of Joe Biden by the extreme left is complete. Together Biden &amp; Harris want to:   ❌Raise taxes on families &amp; businesses  ❌Ban fracking &amp; kill countless jobs  ❌Increase household energy costs w/ a carbon tax  ❌Ban plastic straws
Oh shit. Biden's lead in the polls just dropped from 9% to 9%.
Sounds like Tucker Carlson is supporting Biden like the rest of the majority of the country.
Over half of likely voters don’t believe Joe Biden will finish first term
.  to make unusual campaign debut in virus era
The prospect of the Kamala decade is extremely scary but it’s also freeing knowing I will most definitely not be voting for joe Biden
If you're rich enough to really care about whether Biden wins or not, you're rich enough to pay me. Would be way more convincing than a tome of lame tweets. Save some time for all that phonebanking and texting you need to be doing.
Now I can only wonder what other types of fuck bots there are out there. Lemme see, fuck Biden, fuck politicians, fuck shadow government, fuck US Intelligence, fuck sheep, fuck you, fuck your mom, fuck the mad ancient scientist pretending to be a god who engineered white people
yeah people need to be radicalized right now and expending any time and resources for biden is a waste  if he loses it won't be because of a lack of effort on our part
Most candidates run to the center in the general election. Biden is moving left.  via
Fact Check: Joe Biden’s False Claim Trump Promised to Defund Social Security
Ctrl+C, Ctrl+V Biden campaign talking points
You are right. The fossil fuel industry gets to call the shots even if it's destroying the planet.  The President can't do anything... that's why Biden when POTUS will be able to implement is his bold climate plan... got it. You are so good at this.
Lol! Good one.  "It wasn't Obama's or Biden's fault" Got it. It's not like they were in charge of a country or anything.  Convincing stuff right here.
Clinton County Democratic Party Chair Jerry Marking was pleased with Tuesday's news that former Vice President Joe Biden had tapped U.S. Sen. Kamala Harris as his running mate.
I feel like the biden campaign is entirely built on looking at what the people actually want and then hand-wringing and saying "what about the right? we gotta appeal to the centre more"
No, it does include inferring based on past actions.  What did Biden do as VP for 8 years?
Biden will also continue accelerating the crisis. He has no plans to actually follow through on his promise.
So that fits perfectly then. right? Cuz that's the same percentage change we will get with Biden.
It's the same script whether it's Bernie or a centrist like Kamala or Biden or Obama. Socialist communist marxist stalinist fascist radical. Words have no meaning.
Seems like Ben is jumping over attacking Biden, when he himself acknowledges 60% don’t have faith in Biden.   That’s not a leader
Biden and Harris are garbage. But still gotta vote for them as they are the lesser of two evils at this point. Maybe some day this country can get people who actually care into power. People like AOC
President Biden,  Please double back on Russia.  Stop their advances north to the Arctic.  Sanction them until Putin is overthrown.  They are more of a threat to world peace than anyone, and they're not smart.
I said this yesterday. Allowing Trump on a stage with Biden only elevates Trump. Trump has nothing to offer on policy that is fact driven. He will lie and fear monger. That’s all he is capable of doing. He has no 2nd term agenda goals to explain.  Seriously- Why bother?
So you think Donald Trump is “closer to Christ” than Joe Biden?
Kamala is the running mate of a doomed presidential candidate. She won't ever be Vice President of anything. Choosing her is the coffin nail for Biden.
man fuck kamala harris and fuck joe biden and fuck the two party system
Be careful, you need to be very specific with Jay. Ask him who he prefers between Trump or Biden or he'll just answer "Mitch Daniels".
I wasn’t really a Tulsi person, but I noticed that she stopped being a Russian asset within seconds of endorsing Biden.
Nothing wrong with trying to stay safe in the middle of a Pandemic. When it comes to the issues, Biden is much more qualified as a President than Trump will ever be.
The Bishop knows Biden is Catholic. Just like Tucker knows how to pronounce Kamala.   It's almost like they're generating completely erroneous statements that prey upon a certain zeitgeist to influence undecided voters.  In other words, fake news. Election meddling.
We know who you align with and you embarrass me, as a Catholic  Catholic Church received at least $1.4 billion in COVID-19 relief aid  Biden is Catholic and you should getchu self together
Picking a VP who could not beat Biden, dropping out early with dismal results, and with more baggage than Ru Paul on an overnight trip to Pasadena, has to be one the stupidest strategic picks in history...at least Rice had some rep of being an individual.  #wednesdaymorning
Joe Biden was never stunned. Stone Cold Steve Austin Stuns Donald Trump  via
People would’ve hated Biden’s VP choice regardless of who it was. Why are people going to not vote for Biden because of Harris?
“Joe Biden and the radical left.”
Or she’s done more than you, Penske, and Biden combined.
🚨NEW from  🚨   Meet Joe Biden’s newest liberal handler: Phony Kamala Harris.
Biden VP pick Harris promoted group that put up bail for a serial rapist, an attempted cop killer, and other violent fugitives.
Oh please be quiet. You can’t beat Biden/Harris on the issues so you have to attack like a rabid dog. The way you handled the Pandemic showed us just how totally incompetent you are.
Let’s win BIGLY!! Go team Biden/Harris!! 👏👏👏
now my biggest hang up is whether to vote or not. it's not like I think Biden/Harris has a huge likelihood to win, but if Trump wins for another 4 years, is that more likely to radicalize people, who will take steps in their lives to dismantle capitalism and electoralism? idk.
One top aid &amp; several senior Trump advisors = Trumpworld? I was hoping you’d have a record of a few actual names quoted. Mostly you quote mind readers working for Axios or the Biden campaign. Should I be surprised?
You're kidding me right. His handlers made that pick. Biden can't pick out his socks in the morning.
I think we’re hearing Porky pig speaking every time Biden get on stage. Someone put him back in his pen. 🤣🤣🤣🤣🤣
USA now has Hope! We had it with just Biden...but with these 2 we now have Full Hope! 🖐👏💯
No, I thought he was a center left moderate. That would have been a nice change from right wing lunatics like Harris and Biden.
“When asked by Fox News about Senator Harris and her previous comments about Biden and race, Trump responded by talking about the 2016 Russia investigation.” #missionaccomplished
One of  political analysts weighs in on the Biden/Harris 2020 campaign. What he says about the direction of the #DemocraticParty on Channel 3 This Morning. Join us!
I think Andrew Yang or Bernie Sanders would have made a better President than Joe Biden—that is if Biden can even beat Trump.
Don’t hold your breath if Biden/Harris get elected. Simply the better choice between two bad choices. We need progressives.
Biden boxed himself in by saying he would only pick a woman. You should keep your options open when picking a VP. Biden got too caught up in trying to be "progressive".
If Kamala were to become president after Biden dies or retires for health reasons Kamala then has the power to appoint someone to the office of vice president subject to approval by congress.
You don't have 2 vote for Biden :)
I was so close to voting Biden.... so close!! I wonder how many people he will lose for this.
Yeaaaaaa... Biden was suppose to win my vote not lose it...
i was lost at biden😐
Biden really wanted to sniff Whitmer. Handlers said no. 💅
As much as I dislike the ticket for  I will be voting for Biden. My grandfather watches nothing but Fox News and they have convinced me to vote Biden and Kamala. It is with disappointment, but I will do it.
If Biden is a rapist what is trump to you?
Voting for Biden is going to cause me physical pain.
Sure, it’s Joe Biden and not you who’s racist.
I’d rather still vote Biden and Harris over trump
Most likely the shit they pedal about Biden the left say about Trump.... I just informed that u was incorrect and the pic was old..
What is Catholic about Biden?
Joe Biden once said “you cannot go to a 7-Eleven or a Dunkin Donuts 𝘂𝗻𝗹𝗲𝘀𝘀 𝘆𝗼𝘂 𝗵𝗮𝘃𝗲 𝗮 𝘀𝗹𝗶𝗴𝗵𝘁 𝗜𝗻𝗱𝗶𝗮𝗻 𝗮𝗰𝗰𝗲𝗻𝘁. I’m not joking!”
Biden chose Harris, and you know the second trump learned about it he hid in the bunker.
Biden respects the health &amp; safety of his supporters. Unlike tRump who insisted on holding his unmasked super-spreader rally in Tulsa &amp; ended up killing Herman Cain &amp; still refuses to act responsibly &amp; respect the health of others everywhere he goes.
*yawns at biden*
Kamala Harris &amp; Joe Biden’s radical plan to ban fracking will decimate our economy and obliterate jobs in states like Texas, Pensylvania, Oklahoma, &amp; Ohio.
via  News flash! You can’t be both safe and energizing!! “DNC continues to miss the point”
Watch out. Now that Biden has made his (most excellent) choice, the toxic vitriolic lies of magaland will bubble up and try to dissolve everything in acid.
‘Top Cop’: Bernie Sanders’ Former National Press Secretary Weighs In On Biden Picking Kamala Harris  via
Joe Biden already blew it for himself
Very happy about Kamala Harris being chosen as Biden’s VP. Especially since it means we’ll get more of this treasure. #KamalaHarris #BidenHarris2020
Why do you think so? How does she hurt Biden? She's a moderate
He’s also showing how professionals are unable to defend Kamala and her attacks on biden
(so how long will #biden have to stay before  is #POTUS??) #Election2020
Biden can't be trusted near a mic either. But DNC is trash so what can we expect?
Remember when Kamala Harris basically called Biden a racist in the first debate lmao
Remember a sane Joe Biden, would never pick the Joker to be his number 2. Kamala is as ambitious as Hillary but homicidal and not a suiciding bitch
The most pro-abortion presidential ticket in history.
Me but Biden could have picked Bozo the Clown and I'd still vote Biden.
"Kamala Harris, whom expected Democratic presidential nominee Joe Biden announced Tuesday as his running mate, said last year that she believes the women who accused Biden of sexual assault."
With Kamala Harris, Biden gives moderates no reason to vote for him
Kamala Harris is Biden's political living will
Biden’s run in 08 sucked equally as bad. Doesn’t matter
Hopefully Biden/Harris will define themselves first  she’s also just not scary—she’s a consensus-builder who can authentically appreciate anyone—&amp; amplify the best qualities Biden already has that we need most now—adults who can work together to solve problems. Woohoo!
USA TODAY: #DonaldTrump: Some 'say men are insulted' by #Biden choosing a female VP  Is there any greater indication of an impending lie than  starting off any sentence with "some people say . . ."?
Joe Biden’s handlers didn’t even trust him to say “I’m calling you today” without a script 🤣🤣
You have to be asleep to not understand that millions of people understand that M$A is dead because of Biden and Harris.  So Trump can play this game now over and over again.  Utterly depressing.
Low key, but kinda high key, Joe Biden and Kamala Harris as the democratic ticket for Prez is the opposite of a dream come true
Ultimately we are living In Bernie’s revolution. That is what matters.  Biden is the laziest candidate in history and Kamala well....not a favorite of social justice advocates when you look at her record. This is a ticket of the past. Moderate Demrocrat porn for times gone by
not me trashing Biden and Harris online and then voting for them in November
how biden choosing kamala harris as his vp in this climate is beyond tone deaf. acab.
Called it. Biden/Harris 2020.
Would have given me one more reason not to support Tulsi rather than a reason to support Biden TBH.  Would rather Tulsi distance herself from the DNC and be the bastion of the center that we need.
there is truly no such thing as the perfect candidate &amp; there NEVER HAS BEEN. bernie fully supported the nra. pres. obama worsened the middle east crisis and thousands of innocent civilians died bc of it. clinton. i would love if biden/harris wasn’t our best option but they are
PHUCK YEAH!!!  BIDEN/HARRIS 2020!!!
Make no mistake—Biden and Harris represent the lesser of two horrible options. The people have no power. The election became rigged so that Bernie couldn’t win it. Sanders and Yang were the only 2 candidates who truly care.
"If elected, this weak Democratic duo will aid and abet the radical socialists and anarchists at every turn.   Americans must reject Joe Biden, Kamala Harris, and their dangerous ideology."
While the country protests for justice reform, Biden selects someone with the mindset of someone they're protesting against. Awesome
Kamala Harris believes Joe Biden's accusers.   "I believe them and I respect them being able to tell their story and having the courage to do it..."
Whenever you’re feeling beaten down, just remember that Joe Biden had to pick the woman who smeared him as a segregationist on live television to be his running mate.
FANTASTIC choice, sir! I CANNOT WAIT to vote Biden /Harris on November 3rd
WATCH: Trump drops "Phony" anti-Kamala Harris ad minutes after her selection as Joe Biden VP choice - YouTube
people: WE WANT POLICE REFORM!  joe biden: How about I make a cop my VP
Sen. Kamala D. Harris named as Joe Biden’s running mate   Hey stupid,  start packing!
I'm not a Democrat. Kamala Harris wouldn't be MY choice for VP. But Joe Biden is a Democrat and given the parameters he set for choosing a running mate, I think Harris is a good choice.
Hoard your coins until Biden is  President.
Here’s my one tweet today about this. I rather see Kamala debate Trump than Biden. Wonder if they can switch bodies. Of course I rather  be running for president.  #BidenHarris2020
That would require Biden to actually win but from where I'm sitting a second term of Orange Man seems pretty likely.
Sweet.  Can't wait for Biden's executive order seizing all of Trump's assets.
I like Joe's pick.  The cloud I feel when I Think Trump is now clearing even more.  Biden/Harris 2020 ftw.  Harris/? 2024.  That's my prediction.  This is the beginning of the country healing.  Get out and vote on 11/3 like your life depends on it!!!
I’m going to vote for Biden in November and then come home and get so drunk that I forget I voted for him
The website with the Biden Harris merchandise is down due to so many people trying to buy stuff. Tell me we ain't excited?!?!! #BidenHarris2020 #BidenVP
To be fair Biden never actually said “defund the police” because he was afraid of alienating his moderate base  🥴
Apparently, this is a week of nonstop naivety for me because I thought there was no way Biden would pick a cop with a track record of ignoring corruption in her jurisdiction as his running mate but here we are.
Biden Decides - Kamala Harris Has the Best Smelling Hair.
Biden didn't pick Warren because she's going to be Senate Majority Leader.
YES!!!!!👏🏼👏🏼👏🏼👏🏼👏🏼👏🏼  (11) Joe Biden has selected Kamala Harris as his running mate
Biden wasn't my first choice, but the 🤡 in the WH has to go.
Kamala Harris embraced far left radical positions, including:  ❌Eliminating private insurance  ❌Implementing the job-killing Green New Deal  ❌Supporting sanctuary cities  Now, Joe Biden embraced her as his political living will.
The establishment picked Kamala Harris....Biden just made the announcement! . And you abused your husband
Joe Biden picks Kamala Harris as his VP in 2020 presidential election  via
I think it just shows weakness and a lack of character from Biden imo.
Biden picks California’s top cop for his VP, yikes
“we’re good if biden wins”  Cringe
I'm sure I'll regret these words, but the way things are going with covid and the economy, Biden could pick Saddam Fidel Hitler as his running mate and still probably win. All he has to do is sit back and let Trump keep killing himself.
Biden narrowed his choices when he said he would pick a woman. But Kamala? I don't see her as a way to "reach out." Judging from how she behaved as CA's AG and a senator, she's the Left's chaperone for Biden.
Biden really chose Kamala the cop as his VP 🙃
Thank you!!!! Biden Harris 2020
Ultimately Biden needs the black vote to turn out to win. Anyone still even considering Trump probably isn't switching to Biden at this point regardless.
Wonder if she had to do the something to Joe can't remember shit Biden, that she did to Jerry Brown.
🚨INBOX:  statement on Kamala Harris 👇🏼  “Joe Biden is no moderate, and with Harris as his ‘political living will,’ he is surrendering control of our nation to the radical mob with promises to raise taxes, cut police funding, kill energy jobs, open our borders...”
Right!
There's no evidence of Biden moving radically to the left on any issue. There won't be any radical leftists in his administration either.
how butthurt are you that your precious Biden picked someone just as insane and better yet, a California Senator....im sure this will do well in the rust/sun belt!
In choosing Harris, Biden is embracing a former rival from the Democratic primary who is familiar with the unique rigor of a national campaign.
She has been a VP contender since she  endorsed Biden. Harris is the first Black woman and Asian American person on a major-party presidential ticket.
Guess who Biden picked 🤔
Joe Biden has selected Sen. Kamala Harris to be his VP runningmate on the Democratic ticket
Story: Biden selects California Sen. Kamala Harris as running mate
BREAKING NEWS:  has decided on his running mate: Sen. Kamala Harris.
