Well if Will &amp; Grace can’t save Biden...
And  knows all about what Russia is doing! He's helping out Russia along side of Rudy Giuliani! Ron &amp; gang spent 4th of July over there two years ago! So yes, there is a cabal working tirelessly to try to stop Biden! Guess they're scared! Good.
Let's ask  He must know. After all, he is working with Russia and Putin to deliver DJT! Why did Ron and gang spend 4th of July in Russia? I'd like to know that.  You're looking for Biden dirt. Makes you a dirtbag!
Internals must be bad. No way they’d acknowledge the economy if they thought they had a chance for senate majority/ Biden winning.
Biden Tells Staffers To Pick Any Black Person For VP 'Since They All Think The Same Anyway'
Sent you a DM with link to kzillion Biden memes. Enjoy.
No one:  Absolutely no one:   Not one single soul:   Joe Biden: ARE YOU A JUNKIE?!
“Listen, bucko!” Biden yelled, jabbing his finger at the pigeon. “I get tested every day! You hear me? Why are you just bobbing your head around? Are you some sort of junkie?”
Don’t forget the time he said: If you have problems voting for me or Trump, then you’re not black. And the one where he said: What are you, a junkie? Biden answers with racist comments when he doesn’t want to tell the truth.
It don't think Biden would like his age and cognitive decline to be the reason for stepping down. It's better for his legacy to compete the term and act like he never wanted to be president, that it was only out of duty and love for his country to save it from Trumpism.
Just appoint a team of advisors to vote on decisions for Biden to make.
Why would they want to replace Biden?
How has this pandemic and economic crisis affected your ability to work effectively as a collaborator with the rest of the DNC to insure Joe Biden is the next POTUS!?!?!?
boosting youth voter turnout by reminding them that Biden ran for president before any of them were born
So many “good” Christians speaking out about Biden cherry picking biblical law and not owning up all the other laws they’ve set aside is ridiculous. Especially Matthew 7:1-5.
I really cannot understand the BernieBros who are labeling Biden as tRump2 &amp; refusing to vote for him. Seriously idiots? Can you not see that if tRump is re-elected, if there’s any doubt abt a Biden victory, that tRump/Barr will almost literally burn it all down? 🤬
I think Biden will need to pick Angela Freaking Davis to overcome all his past--and future!--racially tone-deaf gaffes.
Joe Biden is a cave man 👌🏻
You idiots. Biden is not tRump2. 4 more yrs of tRump means SCOTUS &amp; courts loaded with RWNJ judges, putting progressive policies out of reach for another generation. It means you may not be able to vote at all in 2024. It means intensified persecution of LBGTQ &amp; immigrants. 🤬
Trump used a photo of Biden praying to make him look weak.
The news media is covering for Biden. I have started to notice articles saying debates are not necessary. They realize the less we see of Joe the better...
Joe Biden has no clue what it takes to rebuild the economy  ❌As VP, he oversaw the SLOWEST recovery since the Great Depression  ❌Today's jobs gain is 3X better than any gain while Biden was VP  President Trump built the greatest economy in history once &amp; he's doing it again!🚀
Plus, If you voted for Bill Clinton or Barack Obama, you can vote for Joe Biden.  Hell, Dr. Angela Davis is voting for Joe Biden.
Biden walks back African American 'diversity' remarks, lauds community's 'diversity of thought'
Explain … what exactly?  Most of these are extremely reasonable, especially when you know that he has a mild stutter.  Also, criticizing Biden for "not talk too good" while supporting Trump is *really rich*.
I'm starting to wonder if Sleepy Joe Hidin Biden is waiting to officially announce his VP pick until after so many absentee ballots and early votes are cast.
Uh oh! Cleanup on aisle Biden 🤪
Biden should use eminent domain to turn Mar A Lago into a national historic site and the actual southern white house, a la Camp David.
Is there anything logical about Biden running for president? Looks like elderly abuse 😟
The best part: looks like even senile Biden is doing better than Hillary 🤣 how low can she go 🤣
Several sources tell me that Joe Biden's VP is still a tossup.
New add! Biden doesn’t represent the good parts of America.  When will he do a real interview? Someone ask him about Byrd, and Ukraine.
seems like we getting some mixed signals, his staff walked back his comments
I guess we'll see how Biden handles it but I doubt he'll have much of a different approach honestly
Joe Biden is a fucking idiot
Lolololo.   Wait.   Hahahahahah.    Sorry.  Lol.  Ok. Lol. Haha.  Seriously .  You think Biden corrected his statement?
I actually don’t care if Trump or Biden mispronounce a word or a name. Mispronunciations happens. I opppse Trump because he has terrible policies.
Joe Biden: "are you a junkie?"  c'mon man, geez.   CC
I drafted a tweet in response to Biden's gaffe originally, but figured it wouldn't get any attention. Only responding now because there's real differences in policy behind whatever Conway's throwing out.
Joe Biden shouldn't call people junkies. Am I shocked that he did? Absolutely not. Has he been awful, re: drug policy in the past? Oh, yes.   Which administration would be better for people with SUD, Trump 2020 or Biden 2020?  That's super easy.
1. Biden refers to people as junkies  2. Trump praises Duterte, who has people who use drugs killed  Hmmmmmm
Krystal and Emily: Joe Rogan KNOCKS Biden After New Cringe Interview Dis...  via
BBC News - #US election 2020: #Trump says opponent #Biden will 'hurt God'  How can any person of faith support this horror show?  stands for nothing that any faith holds dear.
When your grandma dies of covid, "the Lord works in mysterious ways."  Thought of Biden being President, "will hurt God."   Nothing can hurt God. If Biden wins it's part of His plans.
Lol I'm not the one taking soundbites then twisting into some delusion of insanity. Trump has aced his cognitive assessment test every time meanwhile Biden refuses saying it's asking a coke addict to take a drug test though he doesn't say it as coherent.
ok im not saying I like biden or anything, but what if i also want to hurt god
BIDEN WILL HURT BIBLE. AND GOD!!!!!!
"ouchie"- God at Biden
Paid for by Biden's Alzeimer Fund.
That's Biden not Trump.
That's Biden not Trump.
Biden refuses to take the test. Trump took it and passed.
The best part about a Biden-Harris ticket will be Porter in the Senate.
Watching people that I feel like I would like in real life try to create the perfect character for seeing Biden as irredeemable is painful to watch. Since I, too, have an online problem, I sometimes feel like Tom Hanks to Leo DiCaprio in "Catch Me if You Can".
This statement, like biden, won’t age well
Joe Biden is the only choice. We must defeat Trump at all costs.
Biden fans aren't on the left.
John McCain was the Republican’s Joe Biden, only difference was a war hero and Purple Heart. Neither were ever correct and always self serving.
Ssoooo....who ya GONNA vote for?????.....given that, in these dirty life and times, a vote for ANYONE other than Biden is a vote for Drumpf!?!?!?! (no self-righteous sanctimony allowed in your reply----IF THERE IS ONE!?!?!)
Biden will give his speech sitting on the can
here we go: all the never trump "resistance" grifters are getting ready to stab biden in the back
Because we would vote for Joe Biden’s corpse before you.
'No, Joe! Spit It Out!' Shout Aides As Biden Takes Huge Bite Out Of Cognitive Test
Biden raises eyebrows with remark contrasting African American, Latino diversity
never seem willing to offer an opinion on which man, Trump or Biden, is better suited to serve as the president over the next four years...
Biden is refusing to take the mental assessment test saying it's like asking a coke addict to take a drug test! Trump took his test.
It’s going to get ugly when this starts playing on tv constantly. It’s from Biden’s speech on the 1994 crime bill witch is literally everything #BlackLivesMatter is protesting against. He wrote the whole thing.
What- he thinks Biden will see God walking down the street and try to run Him over with his Camaro?
We need to stand against Trump's racism! ..with Biden's racism?
Anyone who voted for Biden might as well be working for Trump.
Wow, really lost my respect for Noam Chomsky lately...  Krystal and Emily: Noam Chomsky's New Biden Pitch 'Your Feelings Are Irrelevant'  via
Biden done got too comfortable riding Obama wave. He really be trying us
A few months ago, Biden told Black Americans they "ain't Black" if they don't support him, implying all Black Americans must think the same.  Today, he said the quiet part out loud.
These are not gaffes.   When Joe Biden said the Black community doesn’t have diversity of thought, he was clearly just saying what he thinks.  That’s why he told Black voters they “ain’t Black” it they don’t vote for him.
Many of the K voters in NH seemed more wishy-washy last minute decision voters but I can’t get over the Beto stans pinning all the blame on Pete months later for B dropping out, they came around quickly for Biden while still spewing all sorts of nonsense about Pete’s campaign.
Mr. Biden sir I think your pick should be  She would be Perfect match for you. Just an opinion from a wife, mom of three and disabled with Muscular Dystrophy living in Burlington, VT. Good Luck and Good Health! Thank you for you being you!
Actual text from Trump campaign: Pres Trump took a cognitive test &amp; ACED IT. Why won't Joe take it? What is he hiding? We want to know what YOU think. Take the short poll NOW:
Corvettes -- the car older older men who are overcompensating for at least one thing. In Biden's case, it's probably 3 or more.
You could have saved a lot of words and just said: “I’m butthurt my candidate didn’t win, so I am gonna do my best to sabotage Joe Biden”.
🗣️ Americans deserve to watch Joe Biden &amp; President Trump debate before they cast their ballots.   Pass it on.
Joe Biden told Black Americans they “ain’t black” if they don’t vote for him.  Joe Biden accused a Black journalist of being a junkie because he asked him a question he didn’t like.  Joe Biden said Black Americans are all the same.
There is zero chance he'll be at Biden's inauguration. Hopefully because he'll be getting cuffed and taken to a NY jail cell.
Good Morning to everyone except Joe Biden, who called President Trump’s life-saving China travel restrictions “xenophobic” and opposed them for months.  Experts credit the President’s decision with saving countless lives.
OMG, I'm turning into Biden! Yep, time to start my political career. Lol
Even with a Biden loving/Trump hating moderator panel, I don't think there is enough they could do to save Joe in a debate... could let Joe do most of the talking and win easily.  Joe's going to finish himself if they debate at all.
TBH, I think it's appropriate for Republicans to be questioning Biden's mental acuity. I hate that we're, yet again, stuck picking between two old white men.
Revolutionary Communist Party Endorses Joe Biden - Sara A. Carter
A whopping 33 people tuned in to watch Joe Biden ask a Black journalist if he was “a junkie” in response to a question about taking a cognitive test.  I for one, am shocked.
Joe Biden bizarrely lashed out at a Black reporter, asked him if he was a junkie, &amp; struggled to finish his sentence.  "Oh well just Joe being Joe!" shrugs the media who has given this almost no coverage.  IMAGINE the coverage if this were President Trump.
Joe Biden wants to allow illegal immigrants to flood across US borders without consequence.  This is no longer just a security issue, it's a health issue.  President Trump's strong border policies have protected the health and safety of Americans during the coronavirus crisis.
or arrested/indicted after Biden takes the oath of office!
I feel the same. trump has been sucking the oxygen out of the country forever. Biden needs to stop teasing this and announce already. This news cycle of trump's choosing needs to change.
. on cognitive test: Why would I take a test?
He doesn't know the 2nd highest ranking Republican in the Senate? Is he that uninformed or cognitive decline? Imagine Biden asking if Dick Durbin is a Democrat
Krystal and Rachel: Biden Supporters Terrified He'll BLOW IT At The Debates  via
Hmm interesting. I feel like the debates (if they happen?) will matter. I don't see how Biden ducks out of that. Gosh, I'm gonna need all the alcohol.
Seriously you wouldn’t vote for her and risk 4 more years of trump?  Hell I will vote for Biden if he picks Sarah Palin.
rich old white people in an extremely secure living situation complaining about minor inconveniences? yeah that's the Biden campaign alright thanks Tommy
A six-part thread on what to expect from President Biden’s first 100 days:
The debates, as organized by the media, would be stacked against Trump. But Biden’s deficiencies might still make it worthwhile for Trump. It’s hard to say. It’s obvious the media are not interested in fairness. Will they offer an unacceptable deal and blame Trump for refusing?
And you’d say, “Honey, I have no idea.” Then you push up off the couch and walk down to the taco truck that had been installed by federal law on your corner—and every US street corner—on the first day of the Biden administration for a late night snack. /END
The next night, your partner would do the crossword while you read Karl Knausgaard—there were after all no juicy tell-alls from the Biden White House in sight—and your partner would say, “Who is the Secretary of State these days? We hear so little from them I can’t remember.”
Undecided's break quite heavily for Biden though.
Trump's average is around 40 %. It's Biden's average they're bringing down.
This coordinates with my experience and also with a podcast by The Daily in which a political journalist suspected that all Biden needs to do to win is stay the fuck out of the news for the next few months
Lol I didn't vote for Biden and if I wasn't in a swing state I wouldn't vote for the ghoul in November either
West/Tidball is a formidable ticket. Look out Joe Biden
I imagine Disney is already working on a Biden animatron.
The scary reality is she might get her wish. Biden is way past his expiration date
So did Casey Anthony and Squeaky Fromme turn down Biden’s VP offer?
RIP: Joe Biden Buried By Trump Campaign’s Ground Game
Johnathan, if one person criticizes Biden and someone else responds by saying that Trump is "worse", that's called a "comparison"  I've attached the definitions of both the noun "comparison" and the verb "to compare" for clarity
Johnathan, I don’t know if you know this but in November there will be an election where voters will have to between “Joe Biden” and “Donald Trump”. That’s why people always compare the two  Hope this clears things up for you
misstatements with real-world consequences vs. disingenuous agonizing over biden's junkie comment today (which was bad, but still)
Because some husbands would beat their wives if they voted for Biden publicly.
It’s different because Biden, pelosi, Omar families are involved in criminal acts. Trumps family is clean. They have been the most investigated family ever and... nothing. The Dems keep making stuff up, cuz nothing. Russia, Ukraine..Projection.
This is just a terrible poll for trump, no way to spin it. And Biden is 6 points over 50%
Already more viewers than Biden.
Trump Suggests Convention Speech At White House; GOP Sen. Asks: 'Is That Even Legal?'
Instagram Displayed Negative Related Hashtags For Biden, But Hid Them For Trump  via
I know we live in a bazaro world, but trump has been overall good about less foreign intervention/drawing back american empire.  Biden would/will be a disaster
Joe Rogan: People Are ‘Very Uncomfortable’ That Biden ‘Seems To Be Mentally Compromised’
yesterday you tweeted a thread about why to vote for joe Biden but didnt mention anything but donald trumps. how you expect people to vote for either one if neither has an agenda that works for the working families of this country?
BIDEN: "No, I haven't taken a test. Why the hell would I take a test?" - YouTube  #WeDoNOTReallyKnowJoeBidenInAlmost4YearsNow - Honestly - #DoWe??? - F.T.A ...
Biden......"Hey jive turkey, you ain't blk unless you smoke crack."
Biden..... "Listen here jive turkey, you ain't blk unless you smoke crack."
Chip in to elect Joe Biden and other Democrats on the ballot
Joe Biden will not be going to Milwaukee to accept the Democratic nomination...due to coronavirus concerns..  In what world do some people still believe he is going to debate Trump?
‼️ NEW --&gt; Majority (61%) of Black Americans want police to retain local presence. 67% of all US adults agree.  Americans don't agree with Biden's radical agenda to "redirect" police funding.
The Memo: Biden faces balancing act | TheHill  As The People Of The United States Have The Right To Know IF He's Suitable Due To His#COGNITIVEDISSONANCE
🚨NEW  AD🚨  Joe Biden has NO answers. And after 5 decades of failure, he never will.
Biden is very candid. I think it legit pisses him off. I don't want him to change and be what the consultants want him to be. That is what Hillary did and look where that got her. People don't want a robot. If I asked my grandma to take a cognitive test she would be pissed.
Joe Biden Snaps at Black Reporter over Cognitive Test Question: ‘Are You a Junkie?
Really Liz? Americans have shown they like raw emotion from candidates. It was a fair retort from Biden. Can I just say I think my opponent is drunk during a debate and demand he take a breathalyzer right there? Will all elderly candidates now be harassed about taking this test?
Biden quote......"You ain't blk unless you smoke crack"
Joe Biden....."You ain't blk unless you smoke crack"
Joe Biden...."You ain't blk if you don't smoke crack"
President Trump is putting #AmericaFirst.  Joe Biden was chief proponent of the disastrous trade deals that killed American jobs and hollowed out American manufacturing.  Great read from  👇
Zelensky seeks probe over leaked audio of Biden linking US aid to Ukraine prosecutor's ouster
Hannity: Democrats worried Biden is too feeble to take on Trump
This is like being asked if you'd rather have gonorrhea or syphilis...  Biden confidants see VP choices narrowing to Kamala Harris and Susan Rice - Axios
Doesn’t matter.  He’s still going to lose by a landslide to Biden.
The leader of the US Communist Party just endorsed Biden – and that should speak volumes
President Trump on the radical left’s takeover of Joe Biden: “He is whatever they tell him to be.”
It looks like the Democrat king and queen piece are empty... They know that this is basically only for Republicans, or straight up didn't expect Joe Biden to win lmao
My worry is Trump will drop out before the election and someone else becomes the candidate.  The whole focus to get rid of Trump is gone and Biden will have to use something else than "I'm Not Trump".  The Republicans helping to remove Trump join the other side.
Unfortunately I’m not sure Trump is going to lose. Biden is not a strong candidate. His VP choice is important because many voters not affiliated with either party that vote either way may see that person as having a real chance to be President due to Biden’s age.
Biden also is a puppet.
Cleveland Indians let Joe Biden do a twitter takeover.
did Joe Biden write this tweet?
I #WishItWasWarren She would be a better President than Biden.   Forget her popularity.  If she was the nominee, I'd be sleeping better. Wouldn't you?
Lol of course I'm voting for Biden. I wish it was Warren.
They can debate remotely, and they can even debate in person with physical distance. Biden’s campaign doesn’t want to because they don’t want to risk a bad cognitive day.
Oh, that’s young Joe Biden.
For real. Can't wait to rock a Harris/Biden campaign t shirt.
Trump is effective at being a bully.  With that said, I will enjoy watching both Biden and Trump make a fool of themselves.  Popcorn time.
So joe Biden is a political pedophile and know one cares.
If Joe Biden Gets His Way, You Won’t Know The Election Results for Months
This is an excellent Biden ad.
42 after New York’s election and voters still don’t know the results.  Joe Biden wants to turn this local mail-in horror story into a national nightmare on November 3.
It's funny because you think the picture of Biden shows weakness.   I know it's foreign to you but that is called empathy. Look it up.
And so the Democrats' goal-post shifting begins.  Americans deserve to know the results of the Presidential election on election night - not days, weeks, or months later.   Joe Biden &amp; the Democrats' plot for universal mail-in ballots will create confusion and chaos.
I feel like someone should do something.
The information on Biden was factually correct.          Facebook removes pro-Trump ad aimed at Joe Biden, claiming false information
Tucker Carlson: In Biden's hunt for a VP Susan Rice takes the lead – and she's a threat
They KNOW their candidate isn't fit.
Every day.  It’s a treasure trove of Biden ad material.
Yeah. No.  I won't. I set there enduring chemotherapy and watched John McCain throw a thumbs down that saved the ACA. I've had cancer, heart surgery and have epilepsy. I was never eligible for affordable insurance until the ACA. To say Trump equals Biden is just wrong.
If Biden said something like this the right would meme about it for months
Joe Biden says he wants to “redirect” police funding.  His potential VP Susan Rice wants to “reallocate” police funding.  They are two radical peas in a pod.
Is trump working on Biden’s campaign?
President Trump's approval rating is *7 POINTS* higher than Obama's was at this point in his presidency.  AND  President Trump's supporters are 70% more enthusiastic than Joe Biden's supporters! #MAGA
Early voting will lead voters in some states to cast their ballots before the first debate takes place.   is right, Americans deserve to see President Trump and Joe Biden debate before they cast their ballots.
“Progressives” carping about Biden &amp; saying there’s no difference between Democrats &amp; Republicans worry me as much as the Trumpers who welcome foreign election interference &amp; voter suppression do.   Trump is an actual criminal &amp; fascist bent on breaking America. Biden is so not.
What would happen if Biden announced his selections for his whole Cabinet at the same time he announced the VP?
Biden doesn’t even give reasons to vote for Biden 😂😂
i cannot believe, that with all the powerful voices in #merica🇺🇲 all we could come up with is joe biden (i mean cmon, what the hel)
I'd rather send Biden packing.
It would prove that we still have our democracy, George. If Biden can’t handle a debate then he doesn’t deserve to be the nominee.
I’m just so over the ridiculousness. We all profess to want Trump out of office, right? But this is going to come down to 2 candidates. And one is just AWFUL. I am voting for Biden because we can’t have 4 more years of Trump picking judges.
This is what Joe Biden describes as “peaceful”
Biden assails Trump for 'bald-faced lies' about voting by mail    is an imbecile who can't debate but is losing. His only defense is lying. He's perfect at failing!
The Biden’s will love them!
Lol, Kanye picked his VP before Biden picked his VP.
If Biden gets in someone around him will claim sexual harassment so they can impeach him so the VP can take over right away. Snakes
Biden is a proven, lifelong habitual liar and he’s been on the wrong side of history for his entire life. You can honestly say that Trump is worse, but you can’t make a positive case for Biden without lying.
Yeah, they hate Bernie Sanders and were part of the propaganda push to help Biden block Medicare for All.
Listen to Rish. Biden isn’t going to be the nominee.
This won’t age well. All these clowns counted Biden out to Sanders, Warren, and Bootiejuice in the first primaries but now you think he’s going to beat   How about predicting who will win the debates? Or better yet, predict if there will be any debates...
155,000+ Covid-19 deaths, millions out of work because of Covid-19, you don't want to do jack squat for the people in our country that are suffering but you have all kinds of time to b/s about Biden??  Do something for the people for a damn change.
Biden's doing the same shit, unfortunately. "Texas is in play, donate!" Just focus on Florida, Pennsylvania and Michigan, dude. Nothing else matters.
"OK, Joe, let's go," said an aide, shoving him down into the basement. "What Joe was trying to say is that he's chosen a well-qualified candidate who will run the country -- err, I mean, help him run the country -- with excellence."
Truth Tellers Warn Democrats Of Possible Joe Biden 2020 Loss | Tim Black  via
Tamil, I may just follow you, just to see how you react when your trumpy world goes upside down in November, and when he's arrested right after Biden takes the oath. Wait for it. We'll be watching
After shipping countless American jobs overseas, Joe Biden talks about how he wants to help American workers...  President Trump actually gets the job done! 💪🇺🇸
Why would Biden supporters be out to see you?
The radical left has taken over Joe Biden &amp; the Democrat Party.  Don't let them takeover America.
