#BREAKING: Former VP Joe Biden selects California Senator Kamala Harris as his running mate/VP candidate.  The ticket will be Biden/Harris.  If elected, Kamala Harris would be the first female, first Black and first Asian American vice president.
In Historic Pick, Joe Biden Taps Kamala Harris To Be His Running Mate
Kamala Harris Is Biden’s Choice for Vice President
Biden picks Kamala Harris as VP nominee  via
BBC News - Biden's VP pick: Why #KamalaHarris embraces her biracial roots
Biden picked a cop!!!! Incredible
BBC News - #Biden VP pick: #KamalaHarris chosen as running mate
I do think that this also opens up other possible ideas on what roles  can and should play in a Biden administration, or in the Senate. #CripTheVote
I wanted  to choose  for VP, but at the moment I think  is a better choice than I was thinking Biden would make. #CripTheVote
. has made decision on running mate
Has anyone tried anagramming potential VP names with Biden's to see determine who the selectee is?
Biden's America is 2009-2016. Most people prefers that over 2017-2020.
Biden is the only one of them not linked to Epstein. The connections that Trump and Clinton have to Epstein looks very bad for both of them.
I don't care who Biden picks, I'm going Joe. The alternative is an idiot who thinks WW2 ended because they were afraid of the spanish flu Pandemic......in 1918
Biden campaign abandons multi-million-dollar digital ad push
But Biden tried to pull the *Bernie and I are buds for decades* until Bernie wedgied him in the debates. Biden is such a chauvenist pig he just brushes off women taking shots at him.
Nope. Bernie called him a liar about SS in the debates. Biden's ego won't allow him to give Bernie anything other than towel guy in the Capital men's room.
Krystal and Saagar: Biden VP Pick IMMINENT, New Tea Leaves Reveal Who Ha...  via
Biden announces that the real VP is the friends we made along the way.
I cant wait to see the surprise on Joe Biden's face when he is told who his running mate will be. It'll be like a kid on Christmas, but will it be a disappointed look of surprise or an elated look of surprise?
Bernie Sanders: My Message To My Supporters Is To Vote Early And Vote For Biden
I’ve seen 1 in liberal Nova...it’s weird. I wonder if Biden even has one in his front lawn or if he knows how to find his front lawn from his basement.
Ilhan Omar is a black woman, yes. Not very likely to be Biden's VP choice, though.
My Washington military contacts have informed me that Barack Obama will be the Biden VP pick. ENJOY!
ever seen any Biden signs In your travels?
Americans  Deserve  To  Watch  Joe  Biden  And  President  Trump  Debate  Before  They  Cast  Their   Ballots
And why a Biden administration is complete fiction.
A Colombian Socialist Leader, Ex-Terrorist Group Member endorsed Joe Biden and Democrats are just like 'huh... totally normal. Nothing to see here guys!"
I'll wait for a vaccine that President Biden and Dr. Fauci approve of.
It is actually Mayor Pete in a Joe Biden suit
🗣️🗣️ A vote for Joe Biden is a vote for the largest tax increase in history.   Middle class Americans, hardworking families, and seniors will all pay more if Joe Biden gets his way.
Biden could pick a potato
Sarah Palin is trending so the obvious reason is she will be Biden's VP.
Why doesn't Biden?
OK fine. I will vote for Biden.  All he has to do is push #M4A  If he doesn't, then it's his fault for losing to Trump. Sounds fair?
Look, After Trump's blunder last night you shouldn't be tweeting anything about Biden. ...........
This ought to make all Republicans named Jennifer Rubin flock to Biden.
Good morning to everyone except the Biden campaign staffers who donated to the "nonprofit" that paid bail for a convicted rapist and accused murderer.
Joe Biden is an empty vessel for radical left's extreme agenda.  Here's radical Rep Jayapal bragging about how she was able to "significantly push" Joe Biden to "do things he hadn't signed on to before" and reassure extremists that he is "movable."
Biden will be made to do the same.
Tucker rips lack of coverage of DC mass shooting, claims media silent to help Biden campaign
'Are you freaking kidding me?' Tomi Lahren shreds CNN’s Brian Stelter over criticism of Biden media coverage
🚨NEW  Ad🚨  Joe Biden wants to raise taxes on middle class families and dole out benefits to illegal immigrants.  American can't afford Joe Biden. #MyJoeAd
Joe Biden is an empty vessel for the radical left’s agenda!  “With these task forces that we had, we were able to significantly push Joe Biden to do things that he hadn’t signed onto before. So, he is movable...”
Biden put out a statement condemning as well, where is POTUS? #BelarusProtest #Belarus
Yang would have been the better choice for VP than whoever Biden selects. Would have set Yang up for a 2024 run. I see Biden as a one term and done President if he wins.
Would rather see Biden choose Andrew Yang.
Polling from different states showed he was close to Warren in many places and ranked higher than some of the other candidates. In Iowa he was 2nd to Bernie in non-white support during the caucus (of course Biden did significantly better in SC and overall than any of them).
And now over to Dave for the weath- Wait just a minute folks, we’re just now hearing that Biden has announced his VP Pick, and yes, yes, it is in fact Regis Philbins corpse still dressed in his full shrek costume from Letterman
If joe Biden had the cognitive ability to form a literate sentence he’d be cancelled
Was on the road most of the day today. Saw so many Trump signs and flags. Not one sign for Biden anywhere. #MAGA #Trump2020
Live look at the Biden staffer who came up with #MyJoeAd
Hey Humpty Dumpty!  Big deal Joe Biden got on a bike for a 50 foot ride or until cameras were gone!  You guys are making fools of yourselves over this!  We know it was for show!  No one who really rides a bike outside, rides with a mask on!
So #Trump PROMISES to get rid of #SocialSecurity if he becomes #president again. Does he WANT #US to #vote for #Biden?!?
America is actively dying. Electing Biden won't magically bring back the "real"America.
PRO TIP: If the NY Post reports that Dick Gephardt is Biden’s running mate, you should double-check that.
With Biden, yeah. But the rich donors love her because she’ll do whatever they say, so her chances weren’t zero.
joke: buttigieg went to be named biden's vp  woke: biden died and buttigieg is there for an impromptu LBJ-esque swearing-in for the nomination
China's greatest dream is that Joe Biden wins, because they will own this country.
Team Biden  Disability Coalition Convention Watch Party - Tue 8/18, 8:30 – 11pm    #CripTheVote #RevUp #DisabledTwitter #DisabilityTwitter #DisabilityRights
Biden’s VP pick is still a tossup.
Michael Moore tells the truth about Joe Biden and triggers the MSNBC aud...  via
Saagar Enjeti: Jimmy Carter's Dire warning about Joe Biden  via
Kudos to the Biden Campaign for their genius hashtag idea. #MyJoeAd is working out great! Awesome job guys!!
Biden staffers donate to group that used donations to bail out convicted rapists and accused murderers. #MyJoeAd
Not supporting anyone but he's better than Biden. A Biden win will be the most catastrophic outcome possible of the last five years.
Robin Williams' daughter Zelda fires back at Eric Trump for sharing video of her late father joking about Joe Biden - CBS News
NEW #MyJoeAd titled: Please Don't Make Me Vote For Joe Biden
We can’t let Joe Biden and his goons destroy the U.S. Economy
No way him and Biden are just going to speak from a study.
Remember when Joe Biden said “poor kids are just as bright and just as talented as white kids.”  #MyJoeAd
Biden will announce Pocahontas Warren at a midnight pool party
Team Biden  Disability Coalition Convention Watch Party - Tue 8/18, 8:30 – 11pm    #CripTheVote #RevUp #DisabledTwitter #DisabilityTwitter #DisabilityRights
We need to get rid of Biden, first.
Can  provide literally one single good argument as to why voters SHOULDN'T be able to watch Donald Trump and Joe Biden debate before they vote?  I'll wait.
If I did the braingetter joe biden song id parody undone the sweater song instead of buddy holly
This is me when Trumpanzees try to make a moral judgment about Biden! #DumpTrump #Biden2020Landslide
Voters deserve to watch Joe Biden and President Trump debate before they cast their ballots!
If you wondered how much confidence kids have... my 7 yo  was pumped to hear about Joe Biden's commitment to the environment. She wanted to know if he will be "taking appointments" once he is president, she has a few things to go over with him. #Biden2020
Organic (no-retweet) phrase popularity on Twitter of "Trump wins", "Biden wins", "Trump loses", "Biden loses", via  Click points in timeseries to view tweets 📈
Democrat run cities are out of control.   The policies that are leading these cities to ruin are the policies Joe Biden wants to implement nationwide.
"One weekend in August highlighted the contrast of Donald Trump as a bold leader at the helm, forging a national renaissance, versus Joe Biden as a tired and tottering basement dweller, being commandeered by the most radical elements of American politics."
Awesome. So when Biden becomes President, or the next Democrat, they'll just sign an executive order providing federal funds for abortions.
These sound like great investments in our country.  I can’t wait to vote for Joe Biden!
Because it’s in the Mueller report. I’m sorry it wasn’t spoon fed to you by CNN. Here is my favorite video. Your boy Biden has some explaing to do...
“Today we need to talk about the glaring lack of diversity amongst the black community. So buckle up, bucko, because today you’re going to learn how to be different from each other!"
Russia Continues to Meddle in Election to Aid Trump, U.S. Intelligence Says
It’s what they are doing to Donald Trump. Where Biden has been flat out saying ACTUAL racist shit, all the blame is directed to Trump for no reason.
If it can happen in Belarus it can happen in Biden’s America
Cuz most people don't pay attention to politics and are easy to brainwash.  There is a reason most old voters supported Biden over Bernie cuz they largely consume corp. media, I mean propaganda.
Joe Biden has been trying to defund Social Security for as long as I’ve been alive.
Imagine being proud of Biden only up 6 over Trump, woof
If it’s that important then Biden had better start offering something to voters. Those votes matter, right? He should work for them.
The Mount Rushmore conversation shows you  is a brick shy of a load. 60% of the USA hates him and he thinks he is worthy... Biden 2020 or Jesus come get us all!
A must-see before you vote this fall.  Click for a preview of: The Choice 2020 from
The general environment with 10%+ unemployment, a failed federal response to a pandemic, and an incumbent who's had historically awful approval ratings his entire term . . is not Biden +2.
You understand that my argument is not about whether Trump or Biden will be elected, but about the Constitutionality of what Is happening -Right?
If you feel that way, I’m sure you will look forward to President Biden’s executive orders to address climate change.
🚨NEW  Ad —&gt;   Joe Biden tried to cut Social Security and Medicare for decades.  Now, Biden is promising YOUR benefits to illegal immigrants.  President Trump is protecting Social Security and Medicare!
If you guys read the actual tweet most of these people have endorsed Biden and have advocated to vote for him.
Notable: Rita Braver says Jill Biden is in her home during this interview...  Where was Joe?
Joe Biden calls this a peaceful protest.
LOL wait. Why can Jill Biden do in person interviews but Joe Biden has to stay in the basement?? #HidenBiden
Biden should leave up portions of Trump's three fences.
Democrats will mention Tara Reade as if consensual gay sex is the same as rape, but they’ll still vote for Biden while claiming that Morse has to go. They have no principles and they don’t care about victims at all.
Hillary Clinton is ‘plotting a comeback’ to usurp ‘senile Joe Biden’  via
'Super Creep' | Joe Biden Creepy Clips Compilation 2019 | Parody Song  via
'Biden's cognitive issues can no longer be ignored'  via
This is what the presidential race looked like exactly four years ago today  via
I see your point. I read it as Biden was committing blackmail by making that move.
Biden hates god
Ok I am ready for sports to be over. It was a fun couple of weeks but not it’s just Trump or Biden or sports or something about the sex you lie about having.
Hey numbnuts -- the DNC committee IS working from the inside. Stop playing stupid fearmongerer and pound sand. Biden is BLUE MAGA. And the cheese has slipped off his cracker mentally. Perfect candidate for corporations to control the government.
Do you care about character? Because this is an example of Biden's character.
Biden should come clean about his Ukraine crimes
That would have more weight if Biden wasn’t also trying to get rid of Social Security.
Not Biden. Joe Mama lmao gottem
President Trump is right, Joe Biden has gone further left than Bernie Sanders.
'Very telling' advertisements released showcasing Joe Biden's incompetence  via
"No Empathy" clip of Joe Biden from an interview with Patt Morrison of t...  via
MASSIVE Trump Boat Parade!!  *whispers* there has never been a boat parade for Joe Biden
It's awful and funny in a terrible way watching these old liberal heavyweights like Bill Clinton and Biden deteriorate in front of our eyes, while the DNC attempts to reboot them like JJ Abrams. Really makes you feel like a part of history
Robin Williams Roasted Joe Biden Cognitive Abilities Years Ago  via
Biden’s fleet
JK! C’mon Man! Are you a junkie?!  Biden campaign says no VP pick yet after bike trail quip
Are you that desperate to disparage Biden that you can't even admit he can ride a bike just because Trump is too fat to do it himself?
Joe Biden’s idea of “responding” was to call the President’s life-saving China travel restrictions “xenophobic.”  If he were President he wouldn’t have implemented the restrictions and countless more Americans would have died.
Seriously!! Does KEBRA think Nina is the gatekeeper of all black people? Or just those that don’t line up behind Biden because this is some racist BS!
Am I the only person who is fine with China helping Biden out?   For years I have watched troll farms pollute the internet for conservatives, and saw actual friends of mine succumb to the brainwashing.
HAHAHAHAHAHAHAHAHAHA...oh, you're serious? Pfffffff..HAHAHAHAHAHAHA..sorry, sorry..I am taking you seriously..Pffff..HAHAHAHAHA....  James Carville Claims Trump Won't Show Up Debate Biden
Trump will leave your church alone. Biden will let progressives sue your church if you don’t support abortion.
Patience is a virtue and so is giving due consideration to the selection of a VP running mate.    It is refreshing to see a leader exhibit both qualities. Biden is well within the normal timeframe for making his announcement.    I welcome proper deliberation.
The reason leftists can't figure out who Biden's picking as VP is much the same as why Biden can't; they both can't decide which prominent Democrat leftists hate the most.
Color me surprised.
And can you address my initial statement? Policy... what does biden bring to the table. Why is he the best choice?
Elder Abuse Biden will be a puppet...
That’s a lame list of whataboutisms. Biden has insulted just about everyone. Trump didn’t ignore any virus, and joe is a gaff machine. Try harder. What about trumps policies could be improved if biden took the seat?
Though it didn’t come up in this speech, I’m pretty sure Biden pronounces Thailand with a “T” when he reads it.
You mean when will Biden find out who his boss will be?  Once he gets elected, he is taking a nap and going into retirement.
Republicans push Kanye 2020. But will it really hurt Biden?
The entire george w bush administration in joe biden’s DMs
We should open an investigation on Biden’s collusion with China immediately. That’s what we do now, right?
Well if Will &amp; Grace can’t save Biden...
And  knows all about what Russia is doing! He's helping out Russia along side of Rudy Giuliani! Ron &amp; gang spent 4th of July over there two years ago! So yes, there is a cabal working tirelessly to try to stop Biden! Guess they're scared! Good.
Let's ask  He must know. After all, he is working with Russia and Putin to deliver DJT! Why did Ron and gang spend 4th of July in Russia? I'd like to know that.  You're looking for Biden dirt. Makes you a dirtbag!
Internals must be bad. No way they’d acknowledge the economy if they thought they had a chance for senate majority/ Biden winning.
Biden Tells Staffers To Pick Any Black Person For VP 'Since They All Think The Same Anyway'
Sent you a DM with link to kzillion Biden memes. Enjoy.
No one:  Absolutely no one:   Not one single soul:   Joe Biden: ARE YOU A JUNKIE?!
“Listen, bucko!” Biden yelled, jabbing his finger at the pigeon. “I get tested every day! You hear me? Why are you just bobbing your head around? Are you some sort of junkie?”
Don’t forget the time he said: If you have problems voting for me or Trump, then you’re not black. And the one where he said: What are you, a junkie? Biden answers with racist comments when he doesn’t want to tell the truth.
It don't think Biden would like his age and cognitive decline to be the reason for stepping down. It's better for his legacy to compete the term and act like he never wanted to be president, that it was only out of duty and love for his country to save it from Trumpism.
Just appoint a team of advisors to vote on decisions for Biden to make.
Why would they want to replace Biden?
How has this pandemic and economic crisis affected your ability to work effectively as a collaborator with the rest of the DNC to insure Joe Biden is the next POTUS!?!?!?
So many “good” Christians speaking out about Biden cherry picking biblical law and not owning up all the other laws they’ve set aside is ridiculous. Especially Matthew 7:1-5.
I really cannot understand the BernieBros who are labeling Biden as tRump2 &amp; refusing to vote for him. Seriously idiots? Can you not see that if tRump is re-elected, if there’s any doubt abt a Biden victory, that tRump/Barr will almost literally burn it all down? 🤬
I think Biden will need to pick Angela Freaking Davis to overcome all his past--and future!--racially tone-deaf gaffes.
Joe Biden is a cave man 👌🏻
You idiots. Biden is not tRump2. 4 more yrs of tRump means SCOTUS &amp; courts loaded with RWNJ judges, putting progressive policies out of reach for another generation. It means you may not be able to vote at all in 2024. It means intensified persecution of LBGTQ &amp; immigrants. 🤬
Trump used a photo of Biden praying to make him look weak.
Joe Biden has no clue what it takes to rebuild the economy  ❌As VP, he oversaw the SLOWEST recovery since the Great Depression  ❌Today's jobs gain is 3X better than any gain while Biden was VP  President Trump built the greatest economy in history once &amp; he's doing it again!🚀
Plus, If you voted for Bill Clinton or Barack Obama, you can vote for Joe Biden.  Hell, Dr. Angela Davis is voting for Joe Biden.
Biden walks back African American 'diversity' remarks, lauds community's 'diversity of thought'
Explain … what exactly?  Most of these are extremely reasonable, especially when you know that he has a mild stutter.  Also, criticizing Biden for "not talk too good" while supporting Trump is *really rich*.
I'm starting to wonder if Sleepy Joe Hidin Biden is waiting to officially announce his VP pick until after so many absentee ballots and early votes are cast.
Uh oh! Cleanup on aisle Biden 🤪
Biden should use eminent domain to turn Mar A Lago into a national historic site and the actual southern white house, a la Camp David.
Is there anything logical about Biden running for president? Looks like elderly abuse 😟
The best part: looks like even senile Biden is doing better than Hillary 🤣 how low can she go 🤣
Several sources tell me that Joe Biden's VP is still a tossup.
New add! Biden doesn’t represent the good parts of America.  When will he do a real interview? Someone ask him about Byrd, and Ukraine.
seems like we getting some mixed signals, his staff walked back his comments
I guess we'll see how Biden handles it but I doubt he'll have much of a different approach honestly
Joe Biden is a fucking idiot
Lolololo.   Wait.   Hahahahahah.    Sorry.  Lol.  Ok. Lol. Haha.  Seriously .  You think Biden corrected his statement?
I actually don’t care if Trump or Biden mispronounce a word or a name. Mispronunciations happens. I opppse Trump because he has terrible policies.
Joe Biden: "are you a junkie?"  c'mon man, geez.   CC
I drafted a tweet in response to Biden's gaffe originally, but figured it wouldn't get any attention. Only responding now because there's real differences in policy behind whatever Conway's throwing out.
Joe Biden shouldn't call people junkies. Am I shocked that he did? Absolutely not. Has he been awful, re: drug policy in the past? Oh, yes.   Which administration would be better for people with SUD, Trump 2020 or Biden 2020?  That's super easy.
1. Biden refers to people as junkies  2. Trump praises Duterte, who has people who use drugs killed  Hmmmmmm
Krystal and Emily: Joe Rogan KNOCKS Biden After New Cringe Interview Dis...  via
BBC News - #US election 2020: #Trump says opponent #Biden will 'hurt God'  How can any person of faith support this horror show?  stands for nothing that any faith holds dear.
When your grandma dies of covid, "the Lord works in mysterious ways."  Thought of Biden being President, "will hurt God."   Nothing can hurt God. If Biden wins it's part of His plans.
ok im not saying I like biden or anything, but what if i also want to hurt god
BIDEN WILL HURT BIBLE. AND GOD!!!!!!
"ouchie"- God at Biden
The best part about a Biden-Harris ticket will be Porter in the Senate.
Watching people that I feel like I would like in real life try to create the perfect character for seeing Biden as irredeemable is painful to watch. Since I, too, have an online problem, I sometimes feel like Tom Hanks to Leo DiCaprio in "Catch Me if You Can".
This statement, like biden, won’t age well
Joe Biden is the only choice. We must defeat Trump at all costs.
Biden fans aren't on the left.
John McCain was the Republican’s Joe Biden, only difference was a war hero and Purple Heart. Neither were ever correct and always self serving.
Ssoooo....who ya GONNA vote for?????.....given that, in these dirty life and times, a vote for ANYONE other than Biden is a vote for Drumpf!?!?!?! (no self-righteous sanctimony allowed in your reply----IF THERE IS ONE!?!?!)
Biden will give his speech sitting on the can
here we go: all the never trump "resistance" grifters are getting ready to stab biden in the back
god is dead by joe biden's hands
Because we would vote for Joe Biden’s corpse before you.
'No, Joe! Spit It Out!' Shout Aides As Biden Takes Huge Bite Out Of Cognitive Test
Biden raises eyebrows with remark contrasting African American, Latino diversity
never seem willing to offer an opinion on which man, Trump or Biden, is better suited to serve as the president over the next four years...
It’s going to get ugly when this starts playing on tv constantly. It’s from Biden’s speech on the 1994 crime bill witch is literally everything #BlackLivesMatter is protesting against. He wrote the whole thing.
What- he thinks Biden will see God walking down the street and try to run Him over with his Camaro?
We need to stand against Trump's racism! ..with Biden's racism?
Anyone who voted for Biden might as well be working for Trump.
Wow, really lost my respect for Noam Chomsky lately...  Krystal and Emily: Noam Chomsky's New Biden Pitch 'Your Feelings Are Irrelevant'  via
Biden done got too comfortable riding Obama wave. He really be trying us