You spelled “Joe Biden” wrong... twice, actually.
The more pressure we can put on him, and make him understand the consequences of what’s he’s doing, the better. He should know that a Biden admin will prosecute him. He should be famous. He should have the full wratch of democracy at his doorstep. I think we are getting there
Rejecting Biden's Threat of a Nationwide Mask Mandate, Trump Suddenly Respects Limits on Presidential Power  #SmartNews
Biden's campaign is actually worse because his only argument is "I'm not Trump" and that's not even true. Trump and Biden are both racist Republican sexual predators, there's no difference between the two.
Joe's exactly like you, what do you expect? Both Hillary and Biden are deeply unpopular among their own voters, so that's not really different
Have to also credit the Biden people for obfuscating the search just enough to make Harris seem like a surprise pick as well.
There's no path to victory for Biden. Even without GOP shenanigans, he'd still lose. Hell, Biden couldn't win the nomination without DNC shenanigans. The progressive votes Biden needs to win are gone to Howie Hawkins (I know, I'm one of many)
What did your model show for 2016? Did you have Trump beating Clinton? If you did, which I’m sure you didn’t, I’ll believe Biden wins
I think women in this country, no matter their political affiliation, should be pleased with Harris being selected as Biden's running mate. It is cool that an articulate and smart woman has worked hard to place herself in such a position. Awesome.
The Undertold, Undersold Story of Kamala Harris
The National Association of Letter Carriers, which represents 300,000 current and retired workers, said Thursday that Trump has long been hostile to the Post Office.
It’s the truth...he has. What Kamala &amp; Biden done for black folks besides besides mass incarcerations?
No. The problem is not the USPS and its problems. The problem is TIMING. Trump isn’t talking about USPS problems; he’s talking about restricting voting. Let Biden fix the USPS.
Chuck Hagel, other Republican critics of Trump will back Biden during Democratic convention  via
I cant figure out who flips positions faster. Biden, Harris, or Fauci. They all suck in my book. And do not give the post office even one red cent. Let them get the funds they need from Amazon! #MAGA2020
Gosh you’re right Chris.  Nothing to see here...  😜  Why would Biden try and take credit for it then?  Dope.
With the exception of Harris, it appears Biden May assemble the same crooked crew we lived through 8 years of. I guarantee you this, they turned the intelligence community illegally against US Citizens, they won’t hesitate to do again. #MAGA2020
Wow! Does Trump realize HE was/is responsible for the nation’s pandemic response, not Biden? #failure
NBA says photographer who posted offensive Kamala Harris meme is no longer in bubble  via
Also-ran for profit prison are modern day slavery! Now tell me again why we should vote Biden/Harris when they are both responsible for this?
Well that would be Biden and Harris for sure!
If Biden is going to nominate this guy to be the chairman of the Fed, I'm going 3rd party.
Trump is literally listed on a case as a pedo WITH EPSTEIN. not saying Biden is a molester but you have to call out ALL the pedos
Historian says Biden will beat Trump in November — and he’s been right since 1984 | Opinion  #SmartNews
1/1 of course we remember ‘laughter’. That’s why Biden is locked in the basement with the water bugs and other drain dwelling varmints. He’s provided quite a bit of ‘laughter’ every time he’s opened his mouth.
Robert, a U.S. Navy veteran, is voting for Biden because he feels Trump has not fulfilled his oath. - YouTube
unless they have pre-selected the ones who will now "voluntarily" take fall - so the big players (BHO, Hillary and Biden included) stay out of jail ....
Biden family has a lot of money at stake if he is tough on China.
Vote for Biden. Our survival depends on it.
The claim that Kamala Harris is not a citizen is completely without basis in law or fact. ITV demonstrates again Trump’s total unfitness for the Presidency. Vote Biden/Harris🌊🗽🇺🇸
Biden Campaign Releases What it Says Are ‘President Trump’s Coronavirus Lies: 152 and Counting’  #SmartNews
Richard Fowler: Trump sabotages his reelection campaign with his incompetent leadership — Biden benefits  #SmartNews
Should not be a problem. After all, she’s a politician and Biden doesn’t remember what he had for breakfast.
Mazel tov,   on becoming Joe Biden's running mate!! I will do all I can to help get you elected. As a special bonus, we'll have a Jewish Second Gentleman. Love from Omaha and put  in the Cabinet.
Trump’s confidence appears to be slipping – despite the familiar outbursts  #SmartNews
This thread makes me want to vote for Biden. Stick a finger in Obama's eye.   😆😆😆😆
Biden’s mask 🤡
An 11% spread between Biden and Trump would be a true landslide election. It would mean major Democratic majorities in both the House &amp; Senate. A Senate without McConnell or Graham.
Trailing Biden after Harris pick, Trump admits 2020 mail in voting plot  via
‘The President Was Not Encouraging’: What Obama Really Thought About Biden  via
Would you be willing to lose your job to vote for joe Biden?
Today marks the day we finally get conviction of Obama/ Biden DOJ  lawyer who lied on FISa warrant to set up Trump in Russia probe.  Next up Comey , Brennan, Clapper, then Obama and biden!  Time to get you mf’er !!
Today marks the day we finally get conviction of Obama/ Biden DOJ  lawyer who lied on FISa warrant to set up Trump in Russia probe.  Next up Comey , Brennan, Clapper, then Obama and biden!  Time to get you mf’er !!
Today marks the day we finally get conviction of Obama/ Biden DOJ  lawyer who lied on FISa warrant to set up Trump in Russia probe.  Next up Comey , Brennan, Clapper, then Obama and biden!  Time to get you mf’er !!
Today marks the day we finally get conviction of Obama/ Biden DOJ  lawyer who lied on FISa warrant to set up Trump in Russia probe.  Next up Comey , Brennan, Clapper, then Obama and biden!  Time to get you mf’er !!
Today marks the day we finally get conviction of Obama/ Biden DOJ  lawyer who lied on FISa warrant to set up Trump in Russia probe.  Next up Comey , Brennan, Clapper, then Obama and biden!  Time to get you mf’er !!
Every day I become more convinced the Biden-Harris era will be known as Weimar 2: Electric Boogaloo.
I worry that tRump will have Biden murdered... after all, tRump will stop at nothing to stay in office and out of prison
Trump lies that it is Biden — not him — who has ignored science about COVID-19  #SmartNews
Ya - if you can't see the corruption of Biden and the Obama WH you are blinded. Trump has not come CLOSE to the Obama administration and the Clintons
In fact, what Joe Biden said was that all governors should issue a mask mandate.
He's so proud of his word play. Does he not realize that this is a Biden Harris campaign speech?
Angry - Biden wins, how much damage can 🍊 do between November 4 and the inauguration?
Shame on all of them for using Kanye, knowing he is not mentally healthy at this time.    And how racist the Trump campaign is to assume that Kanye will pull black voters away from Biden?!
She called her self that when she scolded Biden about busing - the chickens come home to roost
The debate over masks has moved to the presidential race.
LIES???? HE has done more for this country in 3 years than Obama and Biden did in 8. None of his "lies" were substantive and I can guarantee you if the media scrutinized Obama like they do Trump Obama would win hands down.
Not if Biden/Harris win in a landslide in November.
Chuck Hagel will be supporting Joe Biden in this election.    Don Bacon votes in line with Trump 94% of the time and agrees with virtually EVERY part of Trump's agenda.    Very very different Republicans these men are. 👍
I love this article!!!  Fantastic insight to Biden/Clinton/Obama relationship and why Biden is the best man right now for our nation...
You said you can post a dozen videos of Biden being racist - let's see them.
Would love to see the racist Biden videos - please share, thanks!
Biden can't his shoes Kamala is constitutionally  ineligible  It's Trump vs. Pelosi They're going to pull their every dirty trick and then some.
There is a large portion of progressives who will refuse to vote for Biden. I want her to get out the vote to beat Trump. She knows there’s a fracture in the left, she could bring it together. She does not. Bernie does, but she’s a non-factor. It’s weak shit.
I am so sick of the lying deceitful mean spirited unprofessional press. I can't stand watching it. Shame Shame Shame. Let's see when someone piles on Biden how you all react. Disgraceful
I don’t care about the color of her skin or her family’s. I care about her qualifications and she is severely unqualified to be president. If elected I see Biden quitting do to health reasons.This all a sham to have our 1st female president be a woman of color.
Biden/Harris (resisted the urge to say HOJO, cause I used to live close to a Howard Johnsons) should concede now. Only way for the ticket to win is massive mail-in ballot cheating/harvesting. Need to see RECORD voting for  in Nov!
Oh sweet. I wasn’t planning to vote Biden but if it’s actually a vote to destroy America that’s very compelling. You have given me a lot to think about here.
...when he said “I am running for President of the United States.” Reagan definitely said that before Biden did. Total plagiarism.
Biden campaign raises $48 million in 48 hours after naming Kamala Harris as VP choice  #SmartNews
Biden 46th runner up!!
Because she slept her way to the top and abuses her power to keep her record looking A1. What happened to her calling Biden a racist? Or believing his sexual assault accusers? She’ll look past all that to be able to be #2 in the world
Please find better arguments. At best, this showcases Biden’s authoritarianism
Get caught up with the morning's top headlines, the national weather forecast, today's celebrity birthdays and more.
Mr.President. So I watched,Joe Biden's  announcement to K Harris. He had his phone upside down. My biggest fear, is that if Joe Biden wins he won't make it four years and them Kamala Harris is President. I think it's going to be another Reagan Landslide for you!  Good Luck! Sir..
Biden resigns with dementia. Harris appoints Hillary VP. Harris commits “suicide”. Hillary is President. 😳
Kamala bedded down with influencial politicians and cheated on her husband to get ahead!! She is perfect for a slime ball like Biden!!
She bedded down with influencial politicians and cheated on her husband to get ahead!! She is perfect for a slime ball like Biden!!  He can sniff away and she wont tell.
They will say anything. Last week Trump said Biden wanted to hurt God. 😂
Where is the science that wearing a mask, outside , in the fresh air, walking or otherwise saves lives?  There is non because it doesnt.  Biden is a moron who read this , barely, off a piece of paper he was given by his handlers. So feable he has no original thoughts.
I hope I can go canvassing for Biden soon. I want to do something soon for them this is a team we can me proud of #BidenHarris2020
Trump assails, misrepresents Biden on mask mandate in partisan White House briefing
Poll: Biden maintains clear lead over Trump nationally
Civil war is inevitable.
Open mouth. Insert foot.  Biden was right about this back IN OCTOBER!
Pirro  needs to be thrown off the air for everything she says but THAT sounded like a death threat on Joe BIden!
Dems want mail in votes bc they can rig a piece of paper but they can’t rig a debate where Biden would get absolutely shit on
You mean when Biden is elected I’m going to stay positive!
Dems want to avoid debates bc they know Biden has no shot against Trump. Biden couldn’t answer a question w/o it on paper or someone else answering it for him
Y’all don’t have to like trump, you just have to know what’s best for America...and that’s definitely not Biden
🤡 ass. Michigan is about as relevant as Sleepy Joe Biden. Talk the talk if your team is worth a damn. Ohio State's biatch. Don't forget who your daddy is.
You also killed more Americans with your negligence in the last 3 months than Joe Biden and Barack Obama did in their 8 years in office.
This is an abusive relationship. You have to know when to walk away.   And before you yell at me that “not voting for Biden means I’m voting for Trump”...
Why do the Biden’s continue to hide?
Joe Biden and kamala Harris? You dumb shits can't be serious..
Biden on Trump opposing Postal Service funding: 'He doesn't want an election' | TheHill - The Hill  via
Chugging is a nice way of saying “slowest recovery”... took 6 months for Trump to double the Obama and Biden economic growth.
You all &amp; your staff need to pray for clarity &amp; grace, after tweeting support for Biden-Harris.  Didn't you fire someone for tweeting pro-Trump a while back?  Good thing I believe in God &amp; #Catholic doctrine &amp; not the leadership, your pathetic from the Pope on down!
The Biden-Harris tkt is anti-American, anti-Catholic, pro-abortion even after birth, they are pro-murder!  They are anti-police, anti-freedom, no personal responsibility,.  They promote indoctrination &amp; Communism.  . is NOT #Catholic if you are promoting tkt. #Catholic
It’s not official Trump gear, this is fake just like Biden has products made overseas, though no one want any of it.  get a clue!
Biden has a 25 point lead in New York according to the latest polls. This is Trump just saying shit. Because in fact, he's terrified and wants to pretend he's confident. Unfortunately.
Let's see, obama wins Nobel prize for peace when he was elected, didn't do anything. Trump gets a major peace deal done and biden wants credit for it, now he wants to mandate what we do, and he's not elected. Stupid biden
See, there is no reason NOT to vote for the Biden ticket because Omaha already has mandatory masks.  We were the last city our size NOT to require them. Nobody is afraid of masks. They rely on the Covid tests.
Trump calls Kamala Harris ‘mad woman’ and bizarrely claims Democrats want to abolish ‘any kind of animals' and tear down Empire State Building #SmartNews #wtf #crazytrump #idiotinchief #Biden/Harris2020 🇺🇸🇺🇸🇺🇸💙💙💙💙💙💙💙
Come for the caring.  Stay for the racism.
Biden has no say on anything, except when he spoils himself, then the nurse has to clean him
You’ve got a typo there. Please remove Biden and insert Trump.
It was obvious from the very beginning. Harris checked all of the boxes, and crucially, already had a comfort level with Biden.
Its truth serum!   According to the new york times however Biden is a lying dog face pony soldier   .  We need the slug to take some
America This Week: United We Stand takes a look at Joe Biden's VP announcement and President Trump's reaction.
I expect him to get some largely ceremonial Cabinet post in a Biden administration.
This public speaker starts his talk on a treadmill on stage. It’s an effective and unexpected opener. I’d pay to see Biden use one at a debate and crush Trump.
If someone can convince me Biden &amp; Harris's policies and actions throughout the years, haven't had a worse effect on black men compared to Trump's admin than I might vote for them. If not then MAGA all the way.
Kamala has done more public speaking in 2 days than Biden in 2 months. Why?  #BidenHarris2020
Trump also urges Americans to wear masks but opposes a national requirement. Plus: The NFL tries to virus-proof stadiums, and local school officials struggle with reopening difficulties.
Trump also urges Americans to wear masks but opposes a national requirement. Plus: The NFL tries to virus-proof stadiums, and local school officials struggle with reopening difficulties.
You deserved that call,I believe she called you one other time as well. You are her number one fan and that was a personable thing for her to do. I hope she will be in the Biden administration!
Biden the bigot lies and the next bigot affirms his lie. Thank you for being a prime example.
Well last time i checked #Biden is not the president    is! Go back to your #BasementJoe
If Trump can’t defeat Biden and his commie followers then he doesn’t deserve to be President and America deserves to become a third world banana Republic.
Ya   Right  Her, comrade Biden, and Bolshevik Bernie  all bought and sold by.,,, Russsia!!!  Tried to take down a sitting president  They are all mf’ers that need to go
Come on white women!  It’s up to us to vote Biden and Harris into office! Trump thinks we are not smart.  Let’s show him.  BIDEN HARRIS 2020!!!
I can feel your fear all the way over here in Nebraska’s 2nd district, where Biden leads in the polls.
Mark Cuban says people watched Fox News instead of the NBA because of the Biden-Harris coverage.
About damn time!  calls for a nationwide #maskmandate mandate, starting immediately!
About damn time!  calls for a nationwide #maskmandate mandate, starting immediately!
The Democratic presidential candidate also responded to those who push back against such mandates: “This is America. Be a patriot. Protect your fellow citizens. Step up, do the right thing.”
Joe Biden says no one should go outside without a mask for the next three months.  If you water your lawn you better have a mask.  Wow.  What a cutting edge idea.  I’m gonna vote for Joe.  He is sooooo smart.
At 19 weeks, 6 days, 23 hours and 59 minutes, it’s not a human being but at 20 weeks it is? Regardless of that illogical train of thought, dismemberment abortion rips apart a child limb by limb. You are okay with that? Joe Biden’s Democrat Party I guess!
And please explain me what ”science” is mandating mask wearing outside! 🤣🤣 Must be the Democrat 5600 genders science. BTW .. Did Joe Biden stop being a racist and a grabber to Kamala as soon as she got picked for VP? Miracle!
Joe Biden’s Democrat Party — they think ripping a human being apart limb by limb is a human right.
Possibly the best reason to vote for a Biden/Harris ticket
It started with a tweet from Dr. Jill Biden. “Hey (Douglas Emhoff). Are you ready?” she asked. “Ready to work! Let’s go (Dr. Jill Biden)!” he wrote back. So who is Douglas Emhoff?
Did you really think they answer any unscripted questions. Biden will only do a debate if moderators only ask him questions that his handlers provide. It’s amazing the protections being provided by the left wing media mob. Biden sold his office, and will sell out America #sad
The Bolsheviks have spoke! "Let's institute a mask mandate"- Bolshevik Biden  We have to Fight this nonsense👊🏽🇺🇲
Your jokin right decency and honest are not biden qualities
Joe Biden is a sinner who carries the name of God in vain.
Questions have arisen about whether Johnson's Senate committee is mimicking, even indirectly, Russian efforts and amplifying its propaganda.
Fox News' Jeanine Pirro Tries To Walk Back Ominous Prediction About Joe Biden  #SmartNews
You were never planning to support Biden!
Joe Biden Opens Up 12-Point Lead on Trump in Wisconsin: Poll  #SmartNews
Crook, yeah biden is a crook. But hillary is even more crooked
Biden is one sick puppy
How many of those 2% would have voted for Biden in the first place. May bte they would have voted for trump or not voted at all.
We know in Biden's case he cashed more than just our governments checks.
If Joe and Donald split the electoral college 50/50 then the decision goes to the House, where Dems rule.  It’s that simple: there is no reason for me in NECD-2 to vote for Joe Biden in order for him to get ONE electoral college vote. I don’t want to, &amp; don’t have to, so I won’t.
Biden Points Out Predictable Trump ‘Whining’ About ‘Strong Women’ Like Harris | Talking Points Memo  #SmartNews
Kamala Harris' Favorability Rating Higher Than Trump, Pence and Biden's: Poll  #SmartNews
Thank you  !  Brilliant to frame Harris’ “failed” presidential run in light of what Biden learned during his failures
They are laughing at us due to you ineptitude. Btw no matter what you try to do to the post office it will not stop me for casting my vote for Biden/Harris. #RidenWithBidenAndHarris2020
Why no news coverage and panic when the swine flu hit in 2008? Because the dems were in power. They will wreck the country to get trump out of office. If biden is elected, the virus will be forgotten. The deep state is real folks.
I understand not wanting to vote for Biden but last election showed not voting had a lot to do with Trump winning too. If Biden is willing to have someone as his right hand who is more for the people, I think he’ll be influenced to do more good AND if his health declines she will
Trump or Biden, we fucked either way
Trump used sound effects from The Texas Chainsaw Massacre for his latest campaign ad  #SmartNews
Joe Biden getting a huge boost from Kamal Harris selection for Vice President. People love it all over the country. Lot of energy and enthusiasm for BIDEN/HARRIS.
Hey  even ACLU of Nebraska says "one-size-fits-all laws have no place in healthcare." Yet your plan would strip 180 MILLION Americans of their private healthcare and force them onto a one-size-fits-all plan that even Joe Biden said would bankrupt the country.
In her first remarks as Biden's running mate on Wednesday, she spoke of her mother's Indian roots but described herself as the "first Black woman" to be nominated for the vice presidency on a major party ticket.
But don't just get carries away with the Trump-Biden battle. Senate races are just as important.
Part of a Biden win would mean that the progressive wing of the Democratic Party would have an up tick in influence. The question is how much. Probably not a lot, but more than now. Obviously. This is not a radical liberal ticket.
I think a Biden-Harris ticket has great potential. If voted into office, I will watch how they address funding for the military-intelligence establishment, tax cuts going to corporate America and the 5%, the ongoing saga of Palestine, and Social Security and Medicare funding.
What will brain dead Biden and pelosi have to say ???50 yrs in office and the dumb asses could not do this!!
Even funnier...Biden pronounced it the same way as Tucker did during their joint appearance
Biden will never know the difference.
Donald Trump’s daily briefing on Coronavirus never mentions any of the basic facts such as numbers infected and more tragic numbers of people dead of Coronavirus. President Trump  is now focused Kamala Harris and accusing Biden of attacking God.
Listening to Biden and Harris talk yesterday I felt instantly better. Then I listen to the orange baffoon talk I had nothing but pure rage running through my veins.
I saw the Biden campaign on I-80 west bound.
Wrong and wrong again, Trump’s deregulation is the only thing that saved our economy.  Ask yourself why in 8 yrs Obama and Biden could’nt accomplish what Trump did in 6 months?  I’ll wait...
Despite what Twitter says, many ppl did  vote for Biden. I'm not saying the DNC and media didn't impact things but I knocked doors for Yang and many voters I spoke with were planning to vote for Biden. He's a "safe" vote in their eyes and I can't fault wanting safe after Trump.
The October Surprise will be some new language around the same old “Obama / Biden spied on Trump Campaign” narrative. The difference this time will be timing and it will be cloaked in absolutes from Barr.
Oop- here comes a twitter person who swears they know me just bc I don’t fuck with Kamela or Biden. I hate Trump , I hate everthing he stands for but what I won’t do it set the bar as low as Biden or Kamela just bc y’all want Trump out of office. I want the mf outta there too
Text TRUMP to 88022! I stand with
Kamala Harris Lies Repeatedly in First Speech as Biden’s Running Mate                                  I’m thinking th blow hard should take 2 minutes and READ this!!
Biden doesn’t know Idaho from Iowa or where th F he is at any moment in time.
Trump can still win in November.  Biden's favorable/unfavorable rating is bumping up against 50%. Market volatility and suppression tactics and other factors are in play.
Right wing propaganda gives you a free pass for all of your lies and failures. You're a fool to think you'll beat Biden/Harris. #DumpTrump2020 #BidenHarris2020Landslide
This right here. Not a Biden fan, Kamalah is meh for me BUT I know where I stand with this president and his racist white supremacist rethorics he has been pushing over the last few years. So yes, I will celebrate the black woman, daughter of immigrants, hbcu alumn for sure.
Jon figures he will be back on the inside information train again if Biden wins the white house.
Kamala Harris receives strong marks as Joe Biden's VP: POLL
Nebraska, I would not entrust Biden/Harris  to oversee a 2 yr olds birthday party let alone this great nation! 🇺🇸
Get caught up with the morning's top headlines, the national weather forecast, today's celebrity birthdays and more.
Sleepy Joe and Prostitute Kamala treat the 2A as a dog treats a fire hydrant.  Alarming Poll: Majority of Voters Think Biden’s VP Will Assume Office -  via
NSSF: Biden Chooses Sen. Kamala Harris for Gun Control Partner -  via
Biden, Harris appear for first time as a team - Arkansas Online
According to Kamala she believes the sexual abuse charge by Biden accuser  is credible.  Now what will the slug say???  Even her father will have nothing to do with her!
Biden just seen taking another grueling bike ride
Biden rides a bike!!  Lol   So can he idiot!!!
