You spelled “Joe Biden” wrong... twice, actually.
No.  Its because Biden is stable.  tRump is unstable and somehow his negotiations with China always leaves his own company  without the tariffs he brags about.
GOOD: Biden showcases how wearing a mask doesn't stop you from doing recreational things such as riding a bike.  BAD: No helmet?  I'll admit, I never wore a helmet in my youth, but times  change.  And I guarantee when my wife sees this that'll be the first thing she notices.
Still 55 million less cases than H1N1 during Obama/Biden admin!
Vote.  Campaign for Joe.   Support the Lincoln Project, RVAT, Meidas Touch, and 43 Alumni for Biden.
Well based on her history, there is an 89%chance she had sexual relations with Joe Biden!
If he thinks wearing a Confederate flag will draw people away from Biden, he is very mistaken.
I think so too. Hillary Clinton: Biden has 'great choices' for running mate to help defeat 'wannabe authoritarian'
Hey bernie! You sound like biden! Only you admit to being socialist! Thank god you won't be president!
Biden says Trump executive order is 'a reckless war on Social Security'
Ok everyone, let's try this another way. It's January 20th and Joe Biden has been sworn in as our new president. If you could ask Trump one question, what would it be?
Sleepy? When's the last time you got this type of exercise?  According to   is wasn't with her.
I have posted this on my Instagram. I know some people personally, who definitely have their head straight up Trumps ass. Honestly, I feel a lil sad for those delusional people thinking that Trump is heaven sent! Btw...VOTE FOR BIDEN!!!
What is his stance on segregation bussing? Didn’t you call him out on his stance on racism? So, is Joe Biden a racist?
So when will you call out Joe Biden and Hunter Biden on their dealings with China?
Remember when Republicans were actually patriots vs traitors?
DnC asked Biden not to participate.  Less he says the better.  Trumps a gonner...
Answer to Who is best suited to fix the U.S. economy between Joe Biden and Donald Trump? by Henry Morgan
Excited to share this item from my #etsy shop: Anti Trump Face Mask, Tide VOTE Removes Stubborn Orange Stains, Funny Liberal Democrat Face Mask, Biden 2020 Face Mask Sublimation Face Mask  #stickytudes #facemask #dumptrump #donaldtrump #joebiden
Clearly! Can't wait for a real leader! Joe Biden
Biden risks alienating young black voters after race remarks.
Biden's olfactory senses would explode.
AP: Michigan Gov. Gretchen Whitmer met with Biden as VP decision looms.
Russian anti-Biden election interference finds ready conduit in Republican senators  via
Kanye West's unlikely White House bid is getting help qualifying for presidential ballots in key states from Republicans around the country, fueling suspicions he's being pushed to run by allies of President Donald Trump
this is heartwarming
NEW: Gretchen Whitmer met with Joe Biden last Sunday as the presumptive democratic nominee gets ready to make a decision on a running mate. Whitmer is on a shrinking short list of possible candidates.
I sincerely hope someone is telling Biden to shut the hell up &amp; let Trump hang himself. There is plenty of rope. We don’t need Biden saying something stupid now, or inadvertently touching someone in a suspicious manner. Pick a female VP, and let’s get on w it.
Portland?  Really?  Biden is a puppet?
NEW: China wants President Trump to lose the 2020 election &amp; Russia is trying to harm Joe Biden's chances, the head of the National Counterintelligence &amp; Security Center says.  Details:
Imma start calling you Joe Biden
looking desperate when you have to use Biden's yesterday comment as 75% of your reporting today. #Biden2020  it's refreshing every once in awhile I get nervous that trump will scam his way to re election
RESISTERS, THIS HAS TO BE STOPPED SOMEHOW! ANY IDEAS?  Russia trying to undermine Biden in election, White House intelligence report says
U.S. intelligence has assessed that China is hoping President Donald Trump does not win reelection, while Russia is working to denigrate Democrat Joe Biden.
Joe Biden is a pedophile #JoeBidenIsAPedophile
So if you were in democratic politics you wouldn’t want to be on the VP list I bet people are begging to be included knowing they not getting picked. Y’all hate Biden so much y’all can’t think straight.
I don’t really agree that Biden is a bad candidate, relatively speaking. But assuming you’re right,  there’s nothing wrong with voting the lesser of two evils. Given the current state of affairs, we could do much worse than Biden.
No.  The Democrats built the economy.   Trump just rode what was in place, until he crashed it.  Now Biden will have to start over
I think this is the right way to go.  You can’t bully trump. He’s just gonna do whatever the fuck he wants. But we can bully Biden, break him down, and force him to adopt progressive policies. He’s already given a few conssesions. It’s obviously not ideal, but idk what else to do
IMO, There is only ONE who is BAD (Trump) and one who is GOOD (Biden) GO JOE GO!!! 😃👍🇺🇲🌎
It's literally what they do.  The norms of what are legit accusations to levy at your opponent are out the window with them.  I mean, Trump just accused Biden of trying to "hurt God" yesterday - and the ridiculousness of it aside, that's a really bad thing to say about any one
Your guns will be taken away immediately? By Joe Biden? Who is this raving lunatic? And let's hope the gullible rube in the White House doesn't watch his Fox show.
Don’t let 2020 be another Jill Stein moment. We must bring honor &amp; integrity back to this country. Vote for Biden no matter who!!!!
Yep. I'd like these people to tell me what, exactly, are Trump's policies? They seem to be 1) enrich myself, 2) racism, and 3) get re-elected. Biden may be seeking office when he should fricken and he clearly has racial bias he hasn't dealt with, but he's nothing like Trump.
I will vote for Biden regardless of who he picks as a VP.
We've been told plenty of times to realize what Trump was trying to say as opposed to what he actually said. That being said, I claim the same rules for Biden.
so he was wrong you ever been wrong before these are just terrible examples especially when you put them up against Joe Biden who might literally have dementia
but again how does that relate to the KKK he is just increasing the livability in suburban areas which will raise property values and if we talking about black poverty pre corona I think Trump was beating Biden on that front
It literally says it in this the article you gave me
- Here is a clip of Biden saying the N-word multiple times just thought I would throw that in
- Ukraine phone call proving the quid pro quo   - Biden pushed it in the senate  - Biden on the crime bill actually kind of disturbing watch the whole thing  We all know he don't campaign
NAFTA and pro iraq war are documented  - Biden on Bird friendship  - Racial jungle and segregation   - Obama administration spying   - Isis and how Obama admin helped
How about Biden being pro Iraq war or pro-NAFTA or his best friend Robert KKKBird who also happened to be the person who filibustered the civil rights act in 1964 or maybe Joe Biden stating he doesn't want his kids growing up in a racial jungle to why he likes segregation
I hope you ain't voting Biden atleast
Actually Trump has helped the black community significantly  pre-presidency and while president if you would like examples I would gladly tell you and Biden well he has done his best job to cripple the black community through his 50 years in politics
Biden didn’t write that! Catholics don’t believe in abortion!
It depends if they are black or white because a black antisemite would most likely be anti Biden and Kamala  a white antisemite is most likely a neo nazi version and they probably are pro trump
But I think those voters who are closeted antisemites are anti kamala and anti Biden they probably are going to vote with trump cause he is pretty  straightforward
Yes, by voting for Joe Biden on November 3rd
You are dead wrong.  That's what I have to say to you.  I have never, and WILL never, assert that any human being, much less any politician, is perfect.    Joe Biden is not.  But he's a good man-now supported by increasing numbers of conservatives &amp; GOP members who recognize it.
Biden said today that he would not stop a past president from being prosecuted. Today Trump said Joe Biden could hurt god.  Pretty good day for Biden.
Biden has bowed his head in prayer more times in the past couple of months than Trump has in his entire life.
Hell, if Biden’s that powerful, we better elect him or else. What’s he gonna do to God if he loses?!?!? 😮😱😳
If Biden had the power to ‘hurt God’ does anyone think trump would still be president?After Trump got elected in 2016, I knew everything would get worse. It certainly has. I have way more confidence in Biden leading our country now than Trump. It isn't close. #BidenHarris2020ToSaveAmerica
What’s wrong with you?? I’m going to vote for Biden and the majority of people from Cedar Rapids sure as hell didn’t vote for Trump. Even if they did would you want their kids to suffer? Would you say the same if Katrina victims?
Private prison industry backs Trump, prepares if Biden wins - ABC News via  -
And joe Biden sexually attracted women and children but yet, you still support him
Seriously, who thinks Biden and Harris had better check for bugs since Donald has a major projecting problem.
Tensions linger between Biden and Obama camps throughout 2020 primary campaign: report
U.S. Postal Service Warns of Potential Mail-In Ballot Delays
Eek, and to think that I was hoping that Biden would select Rice.
the ever so slight, lingering, breathless pause between “we’re not gonna let joe biden and kamala harris cut america’s meat!” and a half-hearted round of applause is where we all live now. it’s home.
Biden is done after the first term, surely. If Kamala follows him she’ll probably be on board with that plan
Biden is evil?
Me to my mom: you know trump wants to stop funding the USPS  My mom: well you know Biden wants to defund the police  Me: exactly... your point is?
Are there any Biden masks?  All I see are Trump masks.
Postal workers union endorses Biden, warns 'survival' of USPS at stake  via
Our lives do depend on it. That’s why America needs to vote for Biden
Biden/Harris campaign slogan should be: Your F*cking Last Chance To Save Democracy
Dan, the people holding out have made it very clear that if Biden admin even symbolically adopted just one of the (massively popular) major policy platforms: M4A, GND, debt-free college, legal weed, etc he'd win by 10 million votes. Joe is the one who won't budge.
South Korea &amp; US had their first documented case on the same day. They had 300 deaths, we'll have 300k by November if people don't start following mitigation strategies. You know what I think about Biden and Harris, but we've failed at every level so far.
Yikes. There is no way the Biden campaign has lawyers working on potential election controversies.
“Not my first choice” is primary talk. The primaries are over. Vote for Biden/Harris and every down ticket Democrat like our survival depends on it, because it does.
Meh.  I’m still voting for Biden!
This is so deeply depressing, but I also understand the Biden team’s logic here, given the kinds of crazy right-wing judges we’ve got all over this country right now. (Though by this logic, Ted Cruz would be just as ineligible for the Presidency)
Biden has been a staunch drug warrior his entire career and I would be embarrassed if I didn’t know that. But you do you.
I don’t know which would be more embarrassing, actually not knowing Biden has been a drug warrior his whole career, or thinking nobody else would know that
I was born in 76, I have a functioning memory, and you need to do your homework:
Joe Biden wrote the law that funded the “street crimes” team that kicked in doors in my city for weed smells. GFY, Karen. You couldn’t sound more white right now.
There’s a shit-ton of spite towards leftists in this thread. I don’t begrudge you for voting how you will vote; I won’t vote for Biden because he fucked up my and many of my friends lives with the war on drugs. So he can go to hell.
Radio said this perfectly regarding Biden/Harris.  "They're a little more centric than what some people want but it's better than what we have."  Aka: Democrats dropping the ball to make actual change once again.
Details of the Biden campaign's concerns about Tammy Duckworth's eligibility as a "natural born citizen"
It's not pretend. Joe Biden is a decent human being who cares about America.  Anything else is just propaganda.
👇Biden has noticed before our own elected officials. Thank you. #derecho2020
Yeah WTF why is Joe Biden in the Democratic party? Oh because it's a party for corporatist sellouts to rake in campaign cash, not a party to protect human rights, working people, or democracy.
PREACH BIDEN
Just for clarification: - Since I'm not voting for Biden, I'm giving a vote to tRump. 🙄  However...  - Since I'm also not voting for tRump, I must be giving a vote to Biden. - I'm giving a vote to Hawkins.  So, to sum up, I am voting 3 times at once. Damn, I'm good! 😂
Yeah, Biden himself doesn't seem enthusiastic about it. But many "progressive" types will push for it.
Political prosecutions will be great again, if Biden wins.
Virginia mayor urged to resign after saying Biden picked 'Aunt Jemima as his VP'  via
Wow, are you ever in for a surprise if you actually start paying attention! 😂 Biden/Harris is a Republican ticket from the Reagan era, fully conservative &amp; in service to the moneyed minority. Just because you've embraced an actual fascist wannabe dictator doesn't make them Left.
I would note that, when defenders of Joe Biden attempted to deflect attention from the Reade accusations by trying to dummy up very similar claims against Bernie, I openly called for a public investigation. The accusations never caught on, however, &amp; simply disappeared.
President Joe Biden is ON IT:
Biden did call a member of the kkk his friend and mentor. So does Hillary. research the democrat party history, instead of watching too much your news who spoon-fed you lies.
can any of you name a single one of Joe Biden's policies without looking it up
And I'm still wondering why Biden saying racist things isn't a big deal, but Trump is a "racist" even tho he's never said the shit Biden says.
I’m attending Joe Biden for President’s event, “National Women for Biden Bimonthly Training” – sign up now to join me! #TeamJoe
Iowa Roundtable on Joe Biden's Latino Agenda with Congressman Ruben Gallego Friday, Aug 7, 2020  via
I love how the limits of the form guide the visual so much. Like the whole metaphor is trains because that's an easy digital asset. The angles on Biden are so deliberate to hide that he's basically the default sim or whatever.
A “Club for Growth Action” political slander ad states “hundreds of thousands of schools have closed indefinitely” and that “four years under Biden is a lost generation.” Can you please fact check before you attempt hyperbole? Another need for #newsliteracy in this nation.
I have full faith in Biden. He and Obama salvaged our country from the recession. Biden is proven.
Can’t wait Yang! You’ll be a great part of Team Biden.
I sure have fun offending people on the far left and far right by showing my support for Biden/Harris 2020. These people are excellent for our country. I love Kamala Harris. She deserves to be leading our nation.
You've lost more jobs in three months than Barack Obama and Joe Biden did in 8 years. Unemployment rates are at levels not seen since the Great Depression and nearly 170,000 Americans are dead because of your administration's failed efforts at containing Covid-19
Check out Broadway for Biden's video! #TikTok
I’m happy too!!! For the people! Wealthy and poor. This is why I like Kamala.
I sure can. Heaven forbid a natural disasters distract us from Biden's VP rollout.
For Biden/Harris? Why bother? 🙄  For a ticket that actually represents the interests of the People? Hell yeah!  Face it, the DNC doesn't care if Joe loses, so long as their status quo grift games are safe. They're rich. Trump isn't hurting them.
I’d like to say, i’m disappointed about the VP choice. But, I’m also disappointed about Biden. Both seem like half-assed attempts at being a democrat. I’m done with the party, they’ve failed me, &amp; others.  That DOESNT mean I won’t vote for them. I am not stupid. #SettleForBiden
this ad suggests that Joe Biden is capable of operating a hand crank train car at a speed comparable to an actual train, but he respects the town center enough to lower his speed while passing through.
Being against protecting child molesters is humorous? She’s an awful pick with a track record probably worse than Biden’s. Because picking between the lesser of two evils has done so much good. It’s not perfectionism to not support terrible people.
Join me in supporting Joe Biden and Kamala Harris via
Haven't watched CNN/MSNBC/FOX or any other MSM in years now, so not really sure what they're babbling on about, but I imagine it's probably about how Biden/Harris will "save the country" from the Orange Menace. Propaganda is propaganda. I'd imagine it wouldn't take long to spot.
Really glad I watched the Biden/Harris event - it’s a great pair of speeches, especially from Kamala, and it made a nice, neat case for why they work well together. Neither were my first choice for either role, but I feel really good about this ticket.
Join me in supporting Joe Biden &amp; Kamala Harris via    #KamalaHarrisVP #VoteBlueToSaveAmerica
Joe Biden says some sus stuff sometimes but isn’t it because he has a speech impediment?
As a member of the lgbtq+ community having Donald Trump as president is hard. Having an outwardly homophobic Vice President it’s very hard as well. I ask for those that follow me and are old enough to vote to vote for Biden. A vote for trump is a vote against me.
Well, now I’m more excited about Joe Biden.
Harris Is Set to Appear With Biden; Trump and Allies Attack Her
Biden/Harris over Trump/Pence all day
She truly is a despicable individual. Completely blows my mind that the Biden campaign that she was a good pick.
my main hope with this administration is that Biden picks some kickass cabinet members and let’s them do most of the work. also, good thread
If you’re excessively tweeting about Biden-Harris, I want to know how many times you’ll volunteer between now and November. 🤔  This election is too important to be a pundit on social media and not do what it actually takes to win. ✅
It's so nice hearing Biden and Harris speaking like real leaders rather than ranting about toilets and endorsing food products.
Biden and Kamala are nailing this event IMO. Very, very excited for their White House.
why must joe biden have press conference while i am trying to watch jeopardy????? i am OPPRESSED
Or when they try to say Biden isn't mentally competent. Meanwhile, their guy can't form a coherent thought.
Biden is so much better when he gets mad. It clearly focuses him and reminds him of the stakes of the situation. Even in this speech he improves the second the topic turns to trump. I think he’ll kick butt in that debate.
Biden kind of has the founding father look going on with the white hair.
Same for Biden. Says a new racist thing every week. Black people ain't black, poor kids are just as bright as white kids, etc.
Why won't Biden debate Trump?
Voting for Biden/Harris is like paying an insurance bill. You don’t WANT to do it, cost is high, payout is low, the ppl in charge are rich corrupt sleaze balls, you know it’s a scam that only makes THEM richer, but if you DON’T do it, ur fucked. This is democracy/capitalism 🙃
I didn’t vote for Kamala. I think some (not all) of the critiques of her track record are warranted. That can be true AND I can be happy Biden picked her over others. I can think critically about her politics (as we should for all politicians) AND appreciate this historic moment.
Yeah, that's gonna be a 'No' from me, brah. I can't vote for Biden if he won't debate Trump.
Still not voting for Biden, but this, this, this. The two can coexist. ✨
Can’t wait to see the duality of Dems this fall simultaneously supporting BLM and the Warden Biden and Officer Kamala ticket. Pure aneurysm material 💥🩸🧠💀
Crazy how Biden was able to take the time out of his busy schedule of sucking on raw hot dogs or whatever to pick a cop/warhawk as his vp. Really thought we were gonna have to wait a bit longer
the candidates need to earn the vote of the ppl then. instead of ppl shaming those with criticism of the candidates. we should show them how they have changed. but ignoring criticism adds to toxic rhetoric. i already plan on voting for biden/ harris.
Once Biden wins office, this virus will disappear and so will i.
Let’s do this for our country, too! Biden/Harris 2020!!!!!
I’m seriously keeping a fucking mental note of every dumb liberal who posts some positive shit about Biden picking Copmala as his VP. Y’all are all dead to me.
Biden  -opposes universal healthcare -supports and is supported bypredatory banks -is an architect of brutal racist law enforcement policy and friends with segregationists -was literally picked to be VP to appeal to white racists.  But go off I guess...
It’s hardly the number one reason to vote for them, but Biden-Harris is one of the most religiously diverse tickets ever. Harris is Christian but grew up with heavy Hindu influences and her husband and children are Jewish. Biden would be the second Catholic President.
This suburban housewife is voting for Biden and Harris because I want equity in our schools so I want low income housing scattered around town instead of concentrated in a few schools. #VoteBidenHarris2020
It’s ridiculous that we actually have to make a law like that. Trumpmerica Gone Wild. Biden/Harris.
You should know by now that politicians will say whatever they think will gain votes. What they do with power is the true test. Both Biden and Harris failed those tests.
This is why Biden/Harris 2020 is the deal. They will be able to be held accountable in ways Trump (so far) has managed to run away from faster than we can sue him.
LOL. Biden also believes in jailing nonviolent drug offenders. What do you say to those people?  Regardless, both admins will continue bombing brown people across the globe. Supporting the USA empire is immoral. Undermine it instead, through agorism.
What do you think of Biden's choice of  Join me at noon #RivertoRiver  for analysis from political scientists  and Donna Hoffman
For example - Trump may try to declare victory on election night even when there are many absebtte ballots left to be counted in key states. But that will be much harder to do if those states with outstanding ballots are already reporting for Biden.
Plus she and Biden despise each other
It's never been a binary choice. Your lazy acceptance of such does not make it fact.  You claim you supported Bernie. Why? Policies, right? (Just like rest of us) So how precisely does Biden benefit you? He doesn't. Electing Hawkins gets rid of Trump, too, &amp; gets the policies.
I'm gonna listen to my Black, queer, fat,  nonbinary, deeply informed friend on this one, but I guess y'all progressives who think you know better, go off. 😂 Biden ain't great, but at least he listens to the country. Kamala is a solid pick, and either way, Trump is outta there.
There should be a reporter in the same room as Joe Biden sleeps in tonight. When he first wakes up, the reporter should ask him if he remembers who he nominated as his VP today. Would he answer correctly?
Is that seriously all you people can do? Spew Party propaganda &amp; talking points? Let's try something. WITHOUT MENTIONING TRUMP, tell me what a vote for Biden/Harris is actually a vote FOR (not against; for). They've already turned down every policy that the People support.
via  can’t wait for the debate!!!
Donating to a local food bank is way better than to statists like Trump or Biden.
I didn't know they were going on a date.   Child please!!! Let's fix the fucking country before we start crying about how much Kamala and Biden are in love.
Just overheard some people talking about when Joe Biden crashed their dance marathon meeting and no one wanted him there. Good times.
Not biden picking kamala. It’s the biden picking kamala for me
Wow. It seems that Joe Biden is more Catholic than you claim to be. #nograceatall
The only thing conceivably better than this country getting to tell  "you're fired" in November is doing so with a landslide victory for Biden &amp; Harris with a margin so large, so huge, so beautiful.  The biggest margin.  Man.  Woman.  TV.  Camera...
For everyone on the left saying Ds should just nominate whoever b/c look Rs are calling Biden and Harris socialsts etc. anyway - the problem isn't what Rs say but how it sticks. And it doesn't stick for either candidate (esp. while trying to paint Kamala as a cop also)
The Harris-Biden debate, in fact, is going to be boring
progressives trying to be enthusiastic when they go to the polls to vote Biden/Harris
Biden has 570k+ likes on his Kamala Harris announcement. How does it feel to know that in less that an hour more people said fuck trump with a like. Far more than your supporters have liked any of your tweets to date?
Settle for Biden and you will lose the respect of myself, and countless other freethinking black people in the world. Stop.
