You spelled “Joe Biden” wrong... twice, actually.
Gazette says photo they took of Biden airbrushed and used by Trump campaign without permission
Bernie was robbed (again). Biden won't save it. I am thinking.  I'm thinking of what actually *corrects the problems* that led to tRump in the first damn place, &amp; Joe "Nothing will fundamentally change" Biden ain't it! Neither is whoever they intend to replace him with.
And Biden stops the fire? No, he just pulls a curtain over it. Trump is a symptom of problems that have existed, not their cause. If we allow nothing to change, we will end up with another "tRump" in 4-8, &amp; likely a more dangerous one. Green gets tRump out, too.
Then I'd suggest you get to phone banking &amp; door knocking for Biden, because he's going to need all the help he can get. There are millions of us that are done with the lesser-evilism bullshit.
'No such thing happened': Former acting AG Sally Yates says Obama, Biden did not urge Flynn inquiry  via
If the Dems gave us literally *anything* to vote FOR, they might stand a chance. Obama won Iowa. But then failed to deliver much in the way of actual change. Joe Biden isn't even pretending he'll change a damn thing to help people.
Joe Biden will bring lobbyists &amp; bankers to the table, the same as both Clinton &amp; Obama did. At this point, they're literally trying to lose. They have given the People nothing to vote for. All they have is "better than Trump"; a bar so low I'd have to dig a hole to trip over it.
It's not what they see in him. It's what they don't see in Joe Biden or the Dems; any real substantial difference. The Dems are just as dedicated to the corporatocracy as the GOP. They're doing precisely nothing to earn votes or change minds.
If #BlackLivesMatter movement has made a difference in our attitudes one must wonder if Biden heard the calls?
Thank you Don Winslow and hell yes I’m voting for Biden so there will be indictments and other #ConsequencesForTrump  Because we deserve better than a spoiled brat who has gotten away with cheating and assaulting women his entire life.   #ConsequencesForTrump
"Trump campaign ad against Joe Biden contains a number of doctored images, CNN and WaPo report"
Sally Yates said today that Obama and Biden did not attempt to influence the FBI investigation of Flynn during a January 2017 Oval Office meeting with top national security officials.   Her testimony counters repeated insinuations by Trump and his allies.
Dear campaigns: Do not do this.
I’m cool with Biden acting cautiously in a pandemic.  And FYI this pic of Biden was taken in my hometown Coralville IA watching an Iowa football game not hiding.
I’m from Coralville Iowa where this picture of Biden was taken with my state Senator Zach Wahls. #SuburbsForBiden #NoComradesUnder1k
I'm not saying Biden loses (I don't know who will) I'm saying I'm confident that Iowa is going Red this year, and probably in all subsequent election years. Biden is really unpopular here even among Democrats (see: caucuses), let alone swing voters.
Biden has always been really unpopular here, even though Obama is popular (Illinois). We almost killed his campaign in the caucuses. Another Dem (Sanders, Warren, Pete) might have had a chance to beat Trump but once Biden was nominated that notion went 100% out the window.
Hate to say it, but Biden ain't the answer. He &amp; the Dems work for all the same Big Money interests as the Republicans do. If you're serious about seeing real change, there's 1 party in this election representing policies that help, &amp; are favored by, the People, &amp; that's Green.
Biden? Yes he is going to win!!
I was literally in the room of my Iowa town mayor's Holiday Bowl watch party when this photo was taken. Biden was neither hiding nor alone nor in "the heart of Delaware" when this photo was taken...
Biden to accept Democratic nomination virtually as DNC further scales back 2020 convention  via
I really hope people have their eyes open right now. Plus when we get to the debates Biden needs to whip out every single one of these receipts
Thank God Kanye pulls votes from Trump, not Biden. This is excellent work. They just can't stop the suicide cult thing, can they? #GOP
Biden and Greenfield are tied to eachother in Iowa, which i long suspected. If Biden wins, Greenfield wins. If Biden loses Iowa, Greenfield loses.
Let’s remember who encouraged Americans to drink bleach; that guy had to take a test! Biden was right to laugh the question off,
"The campaign is now in methodical mode as it talks to finalists one-on-one. ... In third place is Rep. Karen Bass, who had a faltering performing on the Sunday shows after revelations about her past views on Cuba and Scientology."
Biden, i am told, cannot pardon state charges. Or civil litigation. 😉
Great interview, but Jill Biden is as delusional as her husband.
Kind of required given the bullshit they regularly pull, wouldn't you think? I mean Trump, Cruz, Cotton, Graham, McConnell, Clinton, Pelosi, Schumer, Biden... All just a bunch of useless clowns!
He could be Joe Biden? 😂  Honestly? Inspiring is nice, but in the end it's just a bonus. Howie &amp; the Greens are willing to earn our votes by backing/pursuing policies favored by a majority of Americans, that serve our interests over those of the Donor Class. They'll work for us.
...Biden supporter. - Facts don't matter - Only official narratives approved by the Almighty Party are to be accepted/discussed - Anything not fitting said narratives is either "fake news" or "a misunderstanding" - Any failure to engage in unquestioning worship is to be shamed
Not much. It's basically been SSDD. - Trump's still an unhinged, narcissistic twatwaffle - #MAGAts still think he's the 2nd Coming - Biden's still a corporate puppet that's being gifted the nom to stop Bernie, &amp; still pandering - #BlueMAGAts still think he's the answer
I would love to visit the Deep South right after Biden wins
Competent national leadership would keep Obama Biden programs like PREDICT which had scientists in Wuhan working on finding and slowing epidemics. Trump cut that program and got rid of other Pandemic Plans and Trump and GOP are responsible for these deaths.
I assume it's going to be Harris. I could be wrong, but it seems unlikely that Biden has actually waited till the last minute to select his running mate. I just wonder what point is served by all this veepstakes political theater, if that's what it is.
Biden is far left? In what universe? I can’t imagine what your sense of the “middle” is
The beloved coffee and lunch spot in Cedar Rapids has been a frequent stop for presidential candidates, including Joe Biden, Carly Fiorina and Rick Perry.
It’s just so damning. He truly isn’t capable of doing the job. This is why Joe Biden can skewer him in a debate.
Because it would be the conservative Dem thing to do. Lines up perfectly with everything else Biden has said like considering a republican VP.
Even if Biden wins AND gets inaugurated, Biden will pardon him as show of reaching across the aisle and to "put it behind us" 🤮
The key of this turd statement is "most people I know". Ask yourself, who are the people that Kellyanne Conway knows? I am pretty sure they aren't the folks who will be voting for Joe Biden in droves.
Just remember, if Trump can do anything he wants under Article II, so can President Biden.  Imagine the possibilities!  Part of Trump's family can be deported, his businesses forced to divest, his associates jailed (or re-jailed!).  Tread carefully!
Here's a good reason not to debate:  Trump will not agree to having his microphone shut off when it is Biden's allotted answer time.  Everyone witnessed his constant interruption of Hillary Clinton's answers during their debates.  Trump thinks it's a game show.
What makes it dumb is that early voting is usually underway before debates or the occasional "October surprise." Using it as an excuse to skip debates this time is silly and suggests a fear that Biden wouldn't do well.
But we both know that Joe Biden is not the answer. You're still my fave, &amp; I appreciate all you've done throughout your career, but I simply cannot follow you down this road to nowhere.  #NoToJoe #GoingGreen
#Iowa A message for Iowa Republicans.              Iowans for #Biden: Dignity, Leadership, Honor, &amp; Science- saving lives.
#Iowa A message for Iowa Republicans.              Iowans for #Biden: Dignity, Leadership, Honor, &amp; Science- saving lives.
#Iowa A message for Iowa Vets Republicans.               Iowans for #Biden: Dignity, Leadership, Honor, &amp; Science- saving lives.
#Iowa A message for Iowa Republicans.              Iowans for #Biden: Dignity, Leadership, Honor, &amp; Science- saving lives.
#Iowa A message for Iowa Republicans.              Iowans for #Biden: Dignity, Science, Leadership, Honor.
#Iowa A message for Iowa Republicans.               Iowans for #Biden: Dignity, Science, Leadership, Honor.
#Iowa A message for Iowa Republicans.              Iowans for #Biden: Dignity, Science, Leadership, Honor.
#Iowa A message for Iowa Republicans.              Iowans for #Biden: Respect, Science, Leadership, Equality.
#Iowa First Lady Barbara Bush has a message for Iowan Republicans. Trump is an awful person when it comes to women.        Iowans For Joe Biden: Respect, Science, Leadership.
Well, suh, I do not read every Tweet on Twitter. But I do read many, as evidenced by my response to you. So I can only say what I have seen -- which is ZERO Tweets about Bernie buoying Biden.  I have seen multiple Bernicrats switch to supporting Trump, though.
Congratulations Theresa! Iowa Democrats have some great women on the ballot. I get to vote for Theresa Greenfield and Rita Hart along with Joe Biden. #WomenAgainstTrump
Biden is better on: healthcare, nuclear proliferation, climate change, corruption  Trump wants to slash SS/Medicare &amp; pre-ex cond protections during a pandemic, not to mention how bad he's bungled the coronavirus response Biden expands Medicare to 20mil .
Except that they will use Biden to secure the nomination, complete with a VP pick, &amp; THEN hand it off to the VP (my bet is Hillary). DNC is never going to allow anyone like Bernie to be the nominee. They have already shatered their own rules to prevent it twice.
If Bernie were to get back in as an Independebt or leading a 3rd party ticket, yes, I would absolutely be on board. But, no, I am not supporting Joe Biden, or whoever they switch to after acknowledging Joe's decline. The Democratic Party has made it very clear they don't rep me.
Has Biden considered picking Michelle Obama as his VP?
Unless Joe Biden actually adopts policies like M4A, GND, and marijuana legalization I along with millions will not consider voting for him
Well why the fuck are you supporting Biden then. Why aren't you fighting for us?
Your description of Biden has no basis in reality and isn’t his perception in the general population. Dumb comment.
This may hold true in other soon-to-be former Trump states...‘Hating Joe Biden doesn’t juice up their base’: Key swing state slips away from Trump  via
Our highly scholarly, carefully crafted tweets thus reflect some difference in views.   But they're close enough that we can reply to each other in a positive way because we both believe the 2016 riots won't be repeated if Biden wins. 2/2
claims that Article II gives the President unrestricted power.  This would be true of President Biden.  If Biden wanted to act like Trump, can you imagine the laundry list of Executive Orders he could issue?  Starting with the legal status of Trump's in-laws?
"If you elect Donald Trump, there will be no smart people. I have spoken to the smart people and they have assured me that they will only produce smart people for a Joe Biden administration.."
So you can't refute the logic of my argument? Just "can't happen". That's the best you've got? In the example I laid out, who's winning, Evan? That you won't stand up for the policies that benefit you is not my failure, it's yours. Biden is not even "objectively better". (1/2)
But young people won't vote for Biden! Said people who don't know what they're talking about.
Klobuchar knew that no matter what the truth, her position was untenable. My bet is she was the frontrunner and now Biden is trying to make a second choice.
I hate everyone responsible for making Biden the nominee
The Biden joke was stolen from Twitter also
Does Joe Biden know where Joe Biden is?
still placing bets on Biden/Loebsack
My guess is it's part of the general strategy of not making waves while Biden has a comfortable lead. No rush to mess with the race while they're winning. But who knows if that's the case.
We've never had one, they've all believed in some kind of woo woo bullshit spiritual nonsense -- but even Biden's Christian delusions pale in comparison to Trump elevating a psycho that believes demon jizz causes illnesses and that hydroxychloroquine snake oil crap.
Biden's first Executive Order should be to close every single educational institution you attended.  Notice they're not bragging about having you as an alumnus.
I never thought Biden or anyone else should debate Trump.  If you review the debates with Hillary,  Trump kept interrupting her answers, and she couldn't properly make her points.  If there is a debate, his mic needs to be shut off during Biden's answer time.
Very hard to campaign on “If you elect Biden, what will happen with him is already happening with me.”
You need to vote for BIden then.
I really want to find a way to move forward without locking down, but it’s starting to feel inevitable that we will at some point. Probably in January when/if Biden takes over. Hope we don’t have to.
At this rate, I hope to get to a actual bar or restaurant to sit down in about 2022 if Biden wins and 2026 if Trump wins. #covid
#YesWeCanAgain have leadership that wants to help people, that tries to do the right thing like Joe Biden. The Constitution Matters. Right Mattera. Truth Matters. Science Matters. #VoteBlue #VoteBiden
All this shit is silly and I'm just happy to see Democrats get frustrated and eat each other, but I love how establishment libs love to call people childish and then do petty childish shit in the same moment. I bet these people are terrible parents.
If Joe Biden was President we wouldn’t have over 155,000 dead and more still dying from a Pandemic because Biden and Obama hired scientists to look for early warnings of pandemic that Trump defunded. Biden wouldn’t have lost 1/3 of our GDP by bungling Covid19 response.
#Biden #VP contender #KarenBass praises Scientology in 2010 ceremony. ⁦ make a smart decision.
Joe Biden rallied Iowa Democrats at Sunday’s Hall of Fame Celebration, saying the state is critical for his campaign and flipping the Senate in the general election.
Yes it's awful. And it makes me wonder what Trump will do around vaccination efforts if he loses to Biden.
Also was supported in the Black community is my understanding. I like Biden I just don’t really see who Kamala would be scaring away. But what do I know
If Trump can shut down a business without due process, then Biden can shut down Trump hotels.  Might not stand up in court, but courts take time, and that if you accept the court's decision.  Might be an abuse of power, but removals via impeachment are difficult.  Let's play!
A coworker tonight told me it’s imperative to vote Trump out because of what he represents. I said I won’t be voting because I don’t think Biden represents anything better. He had no response. This is no revelation, I just wanted to document this real life interaction.
Thanks so much for helping with the Biden momentum by lying to pollsters and making Trump look even more unpopular!
Isn’t that just rounding out his campaign? The idea of a fighter/someone that can excite many Dems while allowing Biden to continue to keep his hands clean  Plus you need someone recognizable to the general public. At his age people need to know the VP can take over. My 2 cents
PolitiFact - No, Joe Biden will not ‘abolish’ police or prisons, as Donald Trump said
But also we don't want biden to decide who we nominate in 2024, in 2020
I hate that Biden is taking his time but also it's probably a good thing lol
Okay but even that is a benefit to a biden presidency. The normalcy of biden allows those of us on the left to have actual energy to focus on policy advocacy not just surviving the day
“It is sexist to say you can’t trust an ambitious woman.”
Biden is a puppet of the radical left, and he doesn’t even know it!
25 Reasons to Support Joe Biden.... that Have Nothing to do With Hating Trump
I could have gone my whole life without hearing Chris Dodds name again. Biden made a big mistake tasking him to run the search
I believe what I see of sniffer creepy Biden😂
He literally endorsed Biden so yes he would
An hour after the polls open, major networks will call the election for Biden.  Journalistically, it wouldnt be right to call it before the polls open.
Let’s say Trump does agree to leave office after he loses the election. What’s the percentage chance he’ll attend Biden’s inauguration? We’re talking more or less 0%, right?
Isn’t this your home state?  Poll: Biden leads Trump by 4 points in Florida -
really wanna know why the biden coronavirus ad music sounds like the terminator 2 theme
Why NextGen America is Endorsing Joe Biden by NextGen America   IMO, Trump and GOP tyranny is why. #GOPTerrorists MUST BE STOPPED: Obstruction of Covid Response; Obstruction of Racial Justice &amp; Rule of Law; Occupation of our cities, kidnapping, terrorizing.
Why? She shouldn’t be near Biden. She promoted military action in Libya &amp; was responsible more than anyone for our weak response to Russian election hacking.
You are not just voting for Biden in November. You’re voting for democracy. You’re voting for the legacy of heroes like John Lewis. You’re voting for the future they envisioned, that they suffered and bled for. For a more perfect union.
If football gets cancelled and presidential debates happen, Biden should absolutely point out that many of the viewers would be watching football instead if a Democrat had been in office.  Football fans will be pissed and I'd use that, if I were him.
Wouldn't there normally be presidential debates by now? Campaign ads? I'm seeing none of it. I haven't heard anything from Biden about running for president in months.
Oh, JFC. 🙄 Are all of you people so brainwashed by propaganda that you're no longer capable of critical thought? I'm not for Biden, so the only possibility that exists in your empty minds is that I must be for tRump? Tell you what, #FuckTrump &amp; #FuckBiden! Who am I voting for?
2020 Election Live Updates: Republicans Rebuke Trump for Floating Delaying Election, Something He Cannot Do
The choice is obvious.
Biden slams Trump for promoting false COVID-19 claims from 'crazy woman'  via
You've got this. Joe Biden knows you are amazing...
I have noticed a house on my normal running route has put up a big "Socialism Sucks" banner. Weirdly that banner didn't go up when there was a chance an actual Democratic Socialist might be the Dem nominee. This is in the midst of plenty of Biden signs.
As Joe Biden's VP pick looms, Susan Rice says Trump is 'protecting Putin' - ABC News -  via
Thanks Pres Narcissist, because every day you make sure I remember to Vote for Biden, Vote for Sanity, Vote for Morality and Vote to reject you.
Soooo many conversations just like this! 😂  For  the  &amp; Biden supporters: You want my vote? Fine. Earn it. #GND &amp; #M4A: full versions, not watered-down corporate-friendly neolib knockoffs. That's my price. Meet it, you get my vote. Ball's in your court. I'll wait.
Kamala wouldn’t be my first pick b/c there are more experienced people on the list (Rice, Warren) and I don’t love her prosecutorial record. But “ambition” is a stupid reason to disqualify her. Biden has called himself transitional. We need someone thinking about the next step.
I don’t know if Kamala should be VP. That depends entirely on her and Biden and their relationship and their respective visions. But I absolutely know this is stupid, sexist, insulting reasoning that would never be aimed at a male VP candidate, period.
In 2016, we pretty much knew  was gonna pick  Nobody else on the short list stood out and the search leaked like a old row boat. This time around, atm I don't know who Biden's gonna pick. I imagine we'll see a narrowed list in the next few days
No hc professionals questioning Biden's mental health? Seriously? You have really bubbled your information, haven't you? Of course you won't see such questions on any of the DNC's MSM allies (propaganda only on there), but I've seen dozens just on here.
I'm learning that. Slowly. On November 3rd, we'll take our final exam to see if we learned anything.  Spolier: I'm voting for this fellow "Biden".
Nope, sure won't
We got an ad that was like Joe Biden KNOWS someone who TALKED TO someone who PROBABLY THINKS we should DEFUND THE POLICE   🤦🏻‍♀️🤦🏻‍♀️🤦🏻‍♀️
So, what does it tell you that you recognize so many descriptors of tRump in a list about Joe Biden?  Or do the bad things only matter when it's the "other side"? 🙄 (there's only really one side, anymore, the corporate one)
Kamala is a long-standing friend of the Bidens; and she’s worked with Beau and Dr. Biden. She’s had a longer personal and work relationship with the Biden family than Susan Rice. Rice is going to have to answer-rightly or wrongly-about Benghazi which won’t be pretty.You spelled “Joe Biden” wrong... twice, actually.
Also important - The Ds have to take over all the state legislatures possible so, when the election gets to the Electoral College the Electors will vote for [hopefully] popular vote winner Biden - AND since this Admin has messed up the Census, to protect and clean up that fiasco
Here's a weird thought: what if Joe Biden is racist and that's why he keeps saying things that sound racist?
Joe Biden spent 4 decades SAYING he was defending the middle class but never accomplished it.  He was only productive in stealing speeches and being inappropriate with women and girls.
Biden's America--the preview.
Biden Leading Trump Among Voters Who Favor Being Alive  via
Dude, if Trump is Cancer, Biden is chemo. Not a great thing, as you're essentially trying to kill the cancer before the chemo kills you. But we still need it. At least Biden will know to pick competent cabinet members that won't kill their departments from the inside.
What a stark contrast between Biden and our failure in office. I really hope Biden wins. trump is a disgusting being.  #Biden2020ToSaveAmerica  #TrumpIsANationalDisgrace
His face before he says it! 🤣 *Closes eyes... “Please God let me say this with a straight face...”
It looks like he had to try real heard before he said it! 😂😂
If elected president, Joe Biden says there will not be 'another foot' of wall constructed on the U.S.-Mexico border, ending one of Trump's big campaign promises.
I didn’t want to believe it last time, but he also predicted you’d be impeached. Alan Lichtman always knows. Start packing.
That Joe Biden video about his Corvette really hits different when you read the anecdote about Biden seeing an alleged reckless driver near his home and chasing him across state lines to do a citizens arrest and then continuing to pursue charges until the guy begged him to stop.
Those are all conservative controlled, how do we implement? They have the military. Even the Democrats are controlled by conservatives. Hence Biden.
Yes but they are going tondona switcheroo sometime soon to somebody who can drum up enthusiasm... Biden is not going to be their candidate
Uhh, might want to check the polls. Biden is like +7 in AZ right now. Of course it will tighten, but it's going blue this year.
I don't understand why the Republican party exists? Conservatives already have the Gop, maga, freedom caucus, &amp; bought half the democratic party. Hence Biden. They are less then 1/2 of the population but get 75% of the representation. #TaxationWithoutRepresentation
Trump is in electoral hot water. It could be even worse for him by November | Art Cullen  #SmartNews
This makes my Friday even better! 🤣🤣
Yes I saw one up the street from me that said “Joe Biden works for Iowa” and of course I laughed because I thought what exactly does he do? The sign isn’t there any more.
Right, Biden Did!  A time bomb for disaster!
Right, Biden Did!  He is a time-bomb for disaster.
^While watching Joe Biden speeches
“The poll also finds that Biden racks up a large margin (62% to 31%) in three counties – including the state’s largest, Polk – that as a group went for Clinton by 17 points in 2016.”
Yesterday Biden: black community is not diverse Today Biden: ...  Idk anyone in their right mind would consider this joker
Another four years of Trump and the country will be begging for anything else and that includes Marxism.  Biden is not a long term solution but better than what we have now.
Cardi B Reveals She's Spoken To Joe Biden, Talks VP Candidates
"Let me be clear: Voting is a right — not a privilege." Joe Biden #goodTrouble #necessaryTrouble
Remind me of the Catholic church’s stance on war (against), the death penalty (against), refugees (for), etc etc etc. so don’t come at me with Joe Biden is pro choice so can’t be Catholic.
Yeah for Joe Biden. Eric should be more worried about Cy Vance.
Why not just have Joe Biden take over now?
Biden is insinuating that the people in society with the least power are responsible for the problems in said society. Fuck that.
