You spelled “Joe Biden” wrong... twice, actually.
Also important - The Ds have to take over all the state legislatures possible so, when the election gets to the Electoral College the Electors will vote for [hopefully] popular vote winner Biden - AND since this Admin has messed up the Census, to protect and clean up that fiasco
Here's a weird thought: what if Joe Biden is racist and that's why he keeps saying things that sound racist?
Joe Biden spent 4 decades SAYING he was defending the middle class but never accomplished it.  He was only productive in stealing speeches and being inappropriate with women and girls.
Biden's America--the preview.
Biden Leading Trump Among Voters Who Favor Being Alive  via
Dude, if Trump is Cancer, Biden is chemo. Not a great thing, as you're essentially trying to kill the cancer before the chemo kills you. But we still need it. At least Biden will know to pick competent cabinet members that won't kill their departments from the inside.
What a stark contrast between Biden and our failure in office. I really hope Biden wins. trump is a disgusting being.  #Biden2020ToSaveAmerica  #TrumpIsANationalDisgrace
His face before he says it! 🤣 *Closes eyes... “Please God let me say this with a straight face...”
It looks like he had to try real heard before he said it! 😂😂
If elected president, Joe Biden says there will not be 'another foot' of wall constructed on the U.S.-Mexico border, ending one of Trump's big campaign promises.
I didn’t want to believe it last time, but he also predicted you’d be impeached. Alan Lichtman always knows. Start packing.
That Joe Biden video about his Corvette really hits different when you read the anecdote about Biden seeing an alleged reckless driver near his home and chasing him across state lines to do a citizens arrest and then continuing to pursue charges until the guy begged him to stop.
Those are all conservative controlled, how do we implement? They have the military. Even the Democrats are controlled by conservatives. Hence Biden.
Yes but they are going tondona switcheroo sometime soon to somebody who can drum up enthusiasm... Biden is not going to be their candidate
Uhh, might want to check the polls. Biden is like +7 in AZ right now. Of course it will tighten, but it's going blue this year.
I don't understand why the Republican party exists? Conservatives already have the Gop, maga, freedom caucus, &amp; bought half the democratic party. Hence Biden. They are less then 1/2 of the population but get 75% of the representation. #TaxationWithoutRepresentation
Trump is in electoral hot water. It could be even worse for him by November | Art Cullen  #SmartNews
This makes my Friday even better! 🤣🤣
Yes I saw one up the street from me that said “Joe Biden works for Iowa” and of course I laughed because I thought what exactly does he do? The sign isn’t there any more.
Right, Biden Did!  A time bomb for disaster!
Right, Biden Did!  He is a time-bomb for disaster.
^While watching Joe Biden speeches
“The poll also finds that Biden racks up a large margin (62% to 31%) in three counties – including the state’s largest, Polk – that as a group went for Clinton by 17 points in 2016.”
Yesterday Biden: black community is not diverse Today Biden: ...  Idk anyone in their right mind would consider this joker
Another four years of Trump and the country will be begging for anything else and that includes Marxism.  Biden is not a long term solution but better than what we have now.
Cardi B Reveals She's Spoken To Joe Biden, Talks VP Candidates
"Let me be clear: Voting is a right — not a privilege." Joe Biden #goodTrouble #necessaryTrouble
Remind me of the Catholic church’s stance on war (against), the death penalty (against), refugees (for), etc etc etc. so don’t come at me with Joe Biden is pro choice so can’t be Catholic.
Yeah for Joe Biden. Eric should be more worried about Cy Vance.
Why not just have Joe Biden take over now?
Biden is insinuating that the people in society with the least power are responsible for the problems in said society. Fuck that.
The first debate should just be questions about policy for Biden and identifying pictures of animals for trump.  Biden will still win.
Catholic voters group calls on Biden to condemn 'rising climate of anti-Catholicism' | TheHill
Biden Flu!
At this point I’m not going to get excited about any news until he comes via text directly from the Biden campaign.
My Statement on Faith. Like so many people, my faith has been… | by Joe Biden | Aug, 2020 | Medium #PresidentBiden
Why don’t we just let Joe Biden be the President now.
Joe Biden will be our second Catholic President. Trump is NOT religious, unless you count worshipping yourself.
P.S.  If Biden can hurt God, wouldn't that make Biden God?  Also, I officially decree that all toilets are now called "Don".
I am not a #Republican or a #Democrat. I will not join any cult, political or otherwise. That being said, I will vote for #Biden. Not because I like Biden or his policies, I don't. However, trump is an existential threat to all human life.
If at this point you can't see that Joe Biden is a 100% Class A racist idk what he can do to convince you. He says these head scratching comments on national TV and doesnt realize theyre inappropriate until someone tells him they are.  This doesn't mean Trump isn't either btw
I pray for you Mr. Biden, I hope your team cares about you enough to get you the help you very clearly need.  GOD bless you❤️ #prayforbiden #prayforjoe #someonegethimhelp #pleasehelpthispoorman
biden could sexually assault a woman in the 90s and he still has my vote
Commission rejects President Trump's push to add debate against Biden
Do you think Biden could win Ohio?
Oh shit we're already at the "GOD IS DEAD WITH GRANDPA BIDEN" stage of the campaign, that's awesome
Panic porn since school is starting.  Closed schools help Biden. 90% political and 10% virus.
Joe must not be hanging out with the women I know. Don’t discount and belittle them Joe!
I could care less what that lady says... You're straying from the original point. Did Biden say that? No. He said ban assault weapons. Until he proposes a bill don't lump all democrats together. Not all democrats are the same just like all Republicans aren't the same.
As we argue about rather negligible things (who will be the VP choice by Biden, eg), people in Beirut are echoing what we did here after 9/11 -- desperate posts looking for lost family members, people frantically searching the rubble, needed aid not arriving from the USA. 😢😰
So many random tweeters (or bots?) suggest that the DNC somehow "chose" Joe Biden as our candidate. Not so fast!
Why? When has a VP pick ever mattered before? Everyone in contention has the experience and skills needed.   And ANY vote that's not for Biden is a vote for Trump.
I'm seeing a lot more support for Biden here than Trump. It's annedotal but I wouldn't be surprised to see Biden win by a slim margin.
With less than 100 days to go before Election Day, Focus on Rural America surveyed people in Iowa, Michigan, Minnesota and Wisconsin.
. held a virtual roundtable with Iowans on behalf of the Biden campaign this morning. He talked up the "huge opportunity" in Iowa this year. "I'm excited about Iowa. And, as I say, in Virginia seven years ago we were all red. Today we are blue as blue could be."
You are so ridiculous. This is right up there with saying that Biden is going to hurt God, but he's weak. So is he powerful enough to hurt God or not? You don't even recognize praying when you see it. You took a picture of Biden praying to use in your lying commercial. Enough!!!
Who needs debates when Joe Biden just keeps beating himself. That whole interview he did was filled with tons of Trump campaign material.  No wonder they have him locked in the basement
The Biden campaign announced it is adding four new staffers in Iowa who previously worked for Amy Klobuchar, Elizabeth Warren and Bernie Sanders.
I mean; it’s a satirical account of Biden, how could I not boost it?! We all need a laugh and this will do nicely for just that! Show our comrade some love! 🌹✊🏻❤️
You know that's the plan because no way in hell they are really backing Biden
They are also going after high capacity mags and certain stocks. Don't lie and say Biden is going after AR15s because your false views of "libtards". I know this is hard to believe but there is such thing as being a moderate. You can support gun rights and have liberal views.
Trump also used his trip to Ohio to talk trade, telling workers at a plant, 'I will stand up to the foreign trade cheaters and violators that hate our country.'
#IMpotus is a desperately sick puppy.  As one who attended Marble Collegiate for show/to be seen, Trump has some nerve spewing against Joe Biden, a man of genuine and demonstrated faith.
Joe Biden quoted as responding “Listen here Jack. I can do more pushups than God
At least Biden knows how to hold a Bible.
Bottom line is, if you want Biden to be your president, you are so bereft of common sense that it’s impossible to take you seriously.
I'm skeptical about the margin in that poll. But I think Finkenauer is well-positioned and Biden will be very helpful to down-ballot Ds in NE Iowa. Lots of "Kennedy Catholics."
Missed our Rainbow Forum on 8/5? Join Iowa Safe Schools' Executive Director, Nate Monson, as he virtually sits down and talks LGBTQ topics with  Joe Biden's Senior Advisor in Iowa. 🏳️‍🌈🇺🇸🏳️‍🌈
Trump commits the 7 deadly sins daily &amp; he thinks Biden hurts God ... wow!!!
Biden must be mighty powerful. Guessing this is a nod to QAnon- Biden being the anti-christ, yeah?
Sounds like Mortal Kombat...God vs Joe Biden 😋
I don't love Biden and he might not be all there. I'm not all here either, but he's better than that loon. He's smarter, kinder, and more coherent. I would have settled for just one of those.
My gut says that Collins can pull through, especially if people anticipate Biden will be president and Ds will have control.
I guess Biden isn’t as weak as Trump has been saying. Hurting god? That’s “stepping on Superman’s cape” level of shit stirring g there.
Trump Unleashes Deranged Rant Claiming Biden 'Will Hurt The Bible, Hurt God. He's Against God'
"Joe Biden is too inept to string a coherent sentence together. Also, he is strong enough to hurt God Himself"
All of the dumdum liberals who get up in arms specifically about Trump's vulgarity and inarticulateness and who post flowery quotes by dead slaveowners saying "this is how a Real President communicates" have been in the tank for Biden since last summer. Make it make sense.
Isn't Biden a Roman Catholic?
Aside from the obvious Trump-Biden stakes, it's important to remember that the winners of the down ballot races will dictate which political party in your state wins the right to attempt to gerrymander the other party out of existence in the upcoming redistricting cycle 👍
The first thing President Biden should do is order that abomination around the people’s house taken down. Well, one of the first things. But that one would be easy.
I buy that Iowa is going to be competitive, I don't buy Biden is up 6.
Will Terry McAuliffe finally address his remarks where he said Joe Biden should stay in his basement and away from voters? #ia01
Yo-Semite doesn’t even compare to this babbling that Biden is projecting. Get help.
When I hear Terry McAuliffe talk about “build back better” but then he ignores Joe Biden’s promise to eliminate hundreds of thousands of blue collar jobs. #ia01
Biden's currently up in the polls because he hasn't had to get out and say anything but now that we're closing in on the big day, he has to start trying. This is what we're going to get!
. campaign says it knocked on over 1 million doors in the past week alone.  Joe Biden’s campaign says it knocked on zero.   Republicans say their door-knocking dominance could make a difference in November. #Trump2020
(I think that's more-or-less correct. I don't think Biden was involved, but, Yates came to the Oval to inform the President that Flynn was the target of an espionage investigation, and she was told that the investigation should be done "by the book.")
Surprising margin and I'm cautious, in the absence of other public polling on #IA01.  That said, I believe  has positioned herself well and Biden at top of ticket will help her in NE #Iowa (lots of older Catholics here). D voter registration edge now around 30,000.
89 days out and Joe Biden’s campaign is STILL playing catch-up in Iowa... #LeadRight
Oh and it’ll be an appetizer for the POTUS/Biden debate that evening.
Experts held 'war games' on the Trump vs. Biden election. Their finding? Brace for a mess  via
All Biden had to do was be quiet till November and he would win. He probably still will but I'd also like him to not speak
They're not genuinely freaked out. They just want to sabotage the Biden economy.
We really only voting for Biden because he's not trump. I hate it
Just like Mike Pence, I am also returning to Iowa! Except I’m coming back to get  elected. Let’s  go!
💯  The  is nothing but the party of old white guys, pretending it's the late 1950's. Hell, they're trying to re-litigate the civil rights movement. Trump claiming that Biden will destroy the suburbs. It's all of a piece.
I’ve seen maybe 3 Biden bumper stickers around central Iowa in the past few months 🤷‍♂️
Trump Campaign Busted For Deceptively Manipulating Biden Photos In New Ad  #SmartNews
Virginia mayor who said Joe Biden picked Aunt Jemima as VP faces calls to resign  #SmartNews
If vaccine is available around the election, Pres-elect Biden will really appreciate all the work that went into making it happen. He may even thank Trump to shut him up and let him snap his suspenders about what a hero he is. Because there’s work to be done. And SDNY is waiting.
please visit  as we know he is working with shady people in Ukraine to get dirt on Biden. DM me for my payment info.
Joe Biden is drawing from the caucus teams of some of his former rivals to round out his senior Iowa staff three months to Election Day. Some familiar names here:
Joe Biden's mental ability is a campaign issue that can't be ignored  via
Part of getting older is understanding what battles to choose and also the art of compromise. Is Biden a compromise from Bernie or Warren or Yang? 100%. But it doesn't mean that a Biden admin wouldn't be vastly different from a Trump admin.
I understand the perspective of my young progressive friends who feel like voting for Biden is the same as voting for Trump. I encourage you to think about what the next four years will look like under the current administration and ask yourself honestly if you believe that.
Trump campaign uses unauthorized and altered Cedar Rapids Gazette photo to criticize Biden | The Gazette
Trump said he wasn't doing debates. So Biden doesn't have to do jack - except letting Trump implode.
There’s a lot that got us to this point, no question. I hope that people realize if Biden wins, it’s not over. The work to deal with why we got here and prevent it from happening again is just starting.  Otherwise we could end up back here again.
has been debating since he has been elected. The media is the voice of Biden and has been attacking Trump since day 1. The great thing is the more they attack him the more support he gets.
Joe Biden won't be going to Milwaukee to accept the Democratic nomination, while President Trump's considering giving his acceptance speech at the White House.
They need to do it again over the video of Biden in a basement that includes altered photos used without the photographer's permission. The misrepresented and lied about the places and circumstances of the pics, too.
As if that somehow absolves you from guilt. Stop lying and there won't be a problem. Same with digitally altering Biden photo's and LYING about where they were or what was  happening. If Trump can't win fairly, he doesn't deserve to win. Full stop.
I'm voting for the lesser of 2 evils. Biden wasn't even in my top 5.
We're done answering our phones. My who street is lined with Biden and BLM signs.
Must be Trumps fault... I suppose he made them stupider by making them watch Biden speak
I agree!!! I've sent a few tweets toward Biden, letting him know he's badly under-represented on TV here. He needs to remember rural areas rely on TV quite a bit still.
Hilarious. 🤦‍♂️ Biden forgot more than Trump ever knew. And didn’t even have to be a criminal to get there.
You REALLY think Biden is afraid of debating the stupidest, most corrupt, pathological lying faux president in history? How do you people believe this idiot?
Joe Biden probably doesn't even have a drivers license.  Did we ever see Obama's birth certificate? Hehe 😉
The  really should be stopping Trump from using fake photos of Biden in tv ads.   Here are some of the REAL photos that Trump's minions altered:
If you thought the ‘Defund the Police’ movement wasn’t coming to the suburbs, think again.   This is what folks in Eagan can expect to see if Joe Biden and his Democrat friends in the House and Senate have their way. #mn02
As your President I'll say  F the Constitution.  Little by little we'll tear it apart.  And with the Police defunded. Have fun keeping your family safe and your stuff, well, yours.    I'm Joe Biden, and I'm not sure where I'm at, but I love corn pop.
Trump is not a conservative under any circumstances.  He is all about himself.  Biden is more moderate. Besides we have bigger fish to fry then Green New Deals
Debates are useless and should be abandoned. Just a bunch of try to be clever oneliners. Do a fact based interview like  does. You get all the information needed to vote for Biden
They still haven't answered my request for why FB censored a post I made about Trump while letting the other person's Biden post stand. In my opinion, they're interfering in the election by censoring out things unflattering to Trump.
True or False: Joe Biden will be the nominee on Election Day
Biden is doing it while sitting on the crapper...or while skinny-dipping in front of the Secret Service.
Surely you jest!  Hahahaha You sure that's the hill your campaigns wanna die on? We've listened to Trump for 4 years. Biden is eloquent by comparison. How much did Trump understand yo-semite? Is Greenland for sale? What's covfefe? Who stormed airports in revolutionary war? ETC.
Yes we will: Joe Biden
I've never been more excited to cast my vote for Joe Biden as our next President! #VoteBiden2020
And they think they get to choose the moderators while asking for it.  Delusional. Biden should ask for Trump to release his taxes before any debate.
🌈 Don't forget, our next Rainbow Forum is today at 5PM on Facebook Live with  Joe Biden's Senior Advisor in Iowa!  #lgbtq
You have nothing on Biden so you have to invent shit. You incriminate yourself daily. You'll be in jail sooner or later.
Full disclosure to any fellow comrades giving me a follow:  I'm a former Bernie or buster who's voting for Biden. I think Biden is pretty terrible, but he (and by extension the DNC) are far and away better than Trump/conservatives in general.
WHY THE HELL NOT?
I’m channeling Ra’s Al Ghul from Batman Begins.  The Republican Party must be destroyed.  First, a landslide victory for Biden.  Then purge Trumpism.
Biden’s more than happy to debate you and he’s already agreed to do the three debates. Stop gaslighting your ignorant sheeple.   #JoeBidenForPresident2020
I'm actually surprised the campaign managed to get someone with some passable photoshopping skillz.  Normally it's just a stock photo with Biden's head pasted on it.
Again, the irony. I don't see any pictures of Biden with known pedophiles in there. In fact he's making most people smile and laugh.
You might as well vote for Trump if you are mad at the Democrats and can’t see yourself voting for Biden. At least your vote will count then.  Voting third party accomplishes NOTHING.
You should be concerned about the Biden's being involved with Epstein's Island.
Why are we not talking about the Biden's owning land adjacent to Epstein Island?
Never seen someone (especially running for office) get away with more racist remarks than Joe Biden. Let’s send him to the retirement center #VoteRed
Joe Biden will accept his party's presidential nomination from his home in Delaware.
Joe Biden will not go to Milwaukee for DNC
very funny watching these Biden attack ads claiming he’s adopted a radical far left agenda. unless he does a kickflip and starts pushing for m4a, that dude isn’t radical
Can you just take the red pill on Biden already.
Sorry,  If you need another Joe to go to Kopp's and eat cheese curds with this month let me know.
Report: Biden no longer coming to Milwaukee to accept presidential nomination
Things are changing every minute, but for what it’s worth, the novelty of Joe Biden’s running mate may have a bigger impact on fall college football than UConn’s cancelation:
..why do you think there's no Biden yard signs or bumper stickers out there...🤔
Visit DC when BIDEN is President!
Bankruptcy baby? Pfff that’s the dumbest response I’ve ever heard. Even job Biden could come up with something better
Joe Biden isn’t afraid of anything, but after the Johnathan Swan interview, Trump should be. I can’t believe you’re not embarrassed for him. And honestly after that dancing fiasco of yours, you should probably sit this one out. 👇🏼
Joe Biden: why do I need a test?
Biden's campaign is reserving airtime in 15 states and plans to launch an 'unprecedented' paid media campaign to educate Americans on their voting options.
Then we MUST Vote Biden to do so!
This is stupid. Joe Biden has already agreed to 3 debates, and I seem to recall him participating in about a thousand democratic primary debates. This crap is just playing into the GOP playbook.
I think she is more senile than Joe Biden... the left has drunk the kool aid and found it refreshing and now is trying to force their poison on us... all states that legalized marijuana is breaking federal laws
I’m attending Joe Biden for President’s event, “Iowa Roundtable on Joe Biden's Latino Agenda with Congressman Ruben Gallego” – sign up now to join me! #TeamJoe
You are better than everyone else in mainstream media.  Hopefully you get to interview Biden.  Presidential debates are not need just fact based discussions.  Keep going.
Joe Biden, who never eulogized anyone even remotely problematic, cannot be associated with this.
I'm gonna stick with Biden for 2020.
They are doing a great campaign for Biden! 😉
Joe Biden cares, Trump does not. “It is what it is” was his response to the death of Americans.
I LOVE listening to your interviews that are filled with lies &amp; falsehoods. YOU are helping Joe Biden's campaign with every interview you do. KEEP IT UP!!!!Maybe if the  figures out that China helping Biden could negate Russia helping Trump and they will finally take foreign intervention in our election seriously.
US officials: Russia denigrating Biden ahead of election  #SmartNews
Yes! On the national level we are all so used to Trump’s insanity it has become old news.  When Biden makes a gaffe it becomes a story for days, just like the 2016 race with Trump and Clinton.
Yeah but Biden was on TV with Obama a lot
Exclusive: Kanye West Indicates That His Spoiler Campaign Is Indeed Designed To Hurt Biden via    Reports say Republican and Trump-affiliated political operatives are trying to get Kanye West to siphon votes from Joe Biden.
Well you asked where my was rage, so I was just letting you know. It was a woman running for president. Everyone else saw what was coming and new Trump would be this bad and Hilary would be better. Those same people will now vote for Biden and he's no better than her.
But that's what the corporate wing said the Republicans would call Bernie, thus Biden was the "safe" choice (nevermind the fact his numbers vs Trump were the lowest of all running at the time) if Biden is a socialist,  words don't have meaning anymore.
Your thoughts...?
Trump isn't doing anything about the bounty Putin put on American soldiers because Russia is trying to help Trump get re-elected! Russia is sending attacks on Biden through Congress like Lindsey Graham! Trump and his cronies are SO Corrupt!
I LOVE this headline: Trump’s ‘depraved incompetence’ has forced Biden to function as an ambitious president like FDR: columnist – Raw Story
Russia doesn't want Joe Biden elected, so Russia is sending attacks on Biden through the Congress like Lindsey Graham. That's why Trump won't do anything about the bounty Putin put on American soldiers, because Russia is trying to help Trump get re-elected!
Well I’m poor, and poorer since trump raised my taxes, and I’m voting for Biden.
"Condescending white liberal racism" is an accurate assessment of Biden's recent comments (and entire career), no matter the source.
Why does the MSM not ask Joe Biden why he doesn't acknowledge his grandson? And you think he cares about you and your kids?  LMAO!
#DementiaJoe #biden is still waiting to see who he has picked for #VicePresident~! #DemocraticParty
Every Biden interview is a dumpster fire. My God man. No wonder the party keeps you hidden. The debates alone will be good entertainment.
, roe v wade is the law of the land so too bad if you don't like late term abortion?  Evangelicals made a deal with the devil? No, hun, anyone that supports Biden is making that deal!
Fact check: Joe Biden said he actually said it.  Glenn, you suck at fact-checking. May I suggest you educate yourself in the art of computer program writing?
YOU are radical. Even Joe Biden would veto your healthcare plan. #ComradeKara
